email,{W6R3-T6UL01DB-9721PCPX},07/01/2010 16:04:49,RMW0542,PC-7543,BSM953@northropgrumman.com,,,Rae.Melissa.Wilson@dtaa.com,28419,0,contribute management team platform develop responsibilities years job concepts experience call concepts required management expert team contribute compensation degree initiative process report multitask on-line job on-time guidance self people multitask growth growth hours industry required develop responsibilities customer responsibilities dynamic industry strong management dynamic develop platform multiple develop platform
http,{G9D4-X0FE90ID-0043WJQZ},07/01/2010 16:23:51,RMW0542,PC-7543,http://hp.com/WboUhagvat1944152218.jsp,required benefits technologies responsibilities management technologies degree guidance on-line job resume compensation management growth management experience expert initiative resume degree responsibilities multiple initiative relocation team passion sales report passion resume equivalent team job salary initiative resume job platform passion process resume experience management technologies interface responsibilities resume degree dynamic responsibilities hours multitask multitask required concepts salary dynamic guidance hours degree passion growth
http,{Z5C3-T9ED82YU-2432HZVQ},07/01/2010 16:43:38,RMW0542,PC-7543,http://monster.com/WboUhagvat1180707852.html,on-time permanent dynamic platform industry industry multitask multitask hours benefits start dynamic strong salary equivalent dynamic expert opening sales technologies equivalent platform benefits benefits hours resume visual dynamic skills skills technologies management interface experience develop start benefits customer passion self management people people technologies people degree multitask required benefits equivalent customer growth report start develop visual growth industry guidance years management
http,{R5B2-L8JV82UU-6769EBTR},07/02/2010 08:29:22,RMW0542,PC-7543,http://boeing.com/WboUhagvat1904327536.htm,skills dynamic skills expert concepts responsibilities report concepts management permanent self experience multiple job engineer dynamic management multiple job customer contribute team compensation degree benefits interface dynamic analyze multiple industry part-time customer passion industry start sales required sales benefits strong process benefits industry strong sales sales required part-time on-line dynamic industry multitask concepts degree benefits management call team responsibilities job opening skills strong engineer skills report
http,{F2G7-K3OG89EV-2687RHLV},07/02/2010 08:43:16,RMW0542,PC-7543,http://careerbuilder.com/WboUhagvat660170997.htm,analyze job platform years equivalent hours years compensation multitask dynamic starter years develop growth part-time people process skills experience degree multitask equivalent platform engineer responsibilities develop responsibilities compensation report contribute people process equivalent permanent responsibilities customer sales sales years start start develop responsibilities multiple job platform interface initiative required opening growth opening on-line customer equivalent required on-time customer equivalent develop
http,{V1L8-E7LP16HB-7659RMQM},07/02/2010 09:37:02,RMW0542,PC-7543,http://monster.com/WboUhagvat1180707852.html,people concepts contribute team degree responsibilities years required strong years multiple industry self experience develop equivalent required multitask equivalent skills multitask multiple degree platform passion concepts contribute team starter on-time management benefits multiple experience job team interface years experience resume contribute on-time growth multiple opening years salary multiple initiative develop concepts required degree team platform
http,{L3A3-P8WE81BY-8076PJIU},07/02/2010 10:10:06,RMW0542,PC-7543,http://careerbuilder.com/WboUhagvat660170997.htm,develop industry growth permanent expert guidance strong recruiter benefits report platform opening multiple resume report skills skills experience years expert dynamic management strong develop equivalent multitask resume compensation customer opening expert industry contribute concepts passion initiative multiple develop on-time self required concepts hours develop experience management interface platform required platform resume
http,{Z8O0-P9VK53SM-3285KUSG},07/02/2010 10:26:56,RMW0542,PC-7543,http://simplyhired.com/WboUhagvat57469130.jsp,management expert responsibilities start multitask team call technologies platform technologies years self customer self years multiple experience experience opening skills industry sales resume skills years team experience expert growth platform initiative years permanent customer resume years people degree initiative strong on-time required initiative start interface multiple degree growth experience contribute customer multitask years management multiple job experience
http,{O6E2-C8WG67YO-8276JGIH},07/02/2010 13:42:13,RMW0542,PC-7543,http://aol.com/jobs/WboUhagvat1963819229.jsp,years interface initiative experience required multiple salary permanent start dynamic team start on-time skills technologies equivalent recruiter start develop contribute interface recruiter years years initiative experience growth guidance resume responsibilities team opening equivalent report job develop degree resume concepts dynamic required contribute resume skills years initiative job customer contribute multiple required benefits dynamic permanent technologies management opening multiple passion equivalent initiative
email,{O9C4-W8NS61AT-3481VRTX},07/02/2010 14:44:58,RMW0542,PC-7543,BSM953@northropgrumman.com,,,Rae.Melissa.Wilson@dtaa.com,25529,0,expert report dynamic benefits team job develop contribute multiple technologies multiple people on-time equivalent equivalent initiative on-line salary responsibilities job team strong team resume develop develop on-time customer report experience process technologies start people experience management growth develop permanent report compensation concepts hours resume industry degree concepts multiple people opening dynamic concepts passion part-time years industry
http,{R7A8-R8XH48WY-4652ABTK},07/02/2010 15:02:06,RMW0542,PC-7543,http://simplyhired.com/WboUhagvat57469130.jsp,management develop initiative part-time report skills team equivalent experience required report strong guidance degree resume growth skills required equivalent team permanent concepts job degree passion industry job benefits sales on-time management degree industry dynamic concepts people report multitask concepts technologies equivalent
http,{Y8F3-L3HR74RC-2768LPWW},07/02/2010 15:17:17,RMW0542,PC-7543,http://harris.com/WboUhagvat1919385663.htm,salary strong responsibilities responsibilities customer starter platform initiative multiple experience start analyze permanent degree responsibilities passion initiative contribute multitask degree guidance team interface self responsibilities experience resume management customer
http,{K4K1-T1KX29GI-5793AANW},07/02/2010 16:42:45,RMW0542,PC-7543,http://simplyhired.com/WboUhagvat57469130.jsp,interface process concepts strong customer customer team dynamic part-time report opening dynamic multitask develop passion equivalent years multiple start job sales equivalent starter responsibilities start passion opening responsibilities industry responsibilities start develop concepts engineer years multitask experience contribute job multiple passion multitask multiple degree dynamic management part-time people people customer customer platform hours multitask contribute
http,{L5C7-B6RO15FD-4532GEMR},07/02/2010 17:04:36,RMW0542,PC-7543,http://northropgrumman.com/WboUhagvat572113271.aspx,customer report contribute guidance years benefits interface concepts growth salary start benefits multitask concepts analyze degree degree initiative experience strong platform people dynamic initiative growth dynamic report strong growth team start strong team management initiative technologies growth experience required strong industry experience platform concepts multitask experience skills team years guidance on-line years permanent job people platform people degree starter starter concepts benefits required initiative resume resume dynamic sales develop experience dynamic opening permanent on-line benefits equivalent degree
email,{L6D7-A4UM66VW-6094XMRX},07/02/2010 17:33:37,RMW0542,PC-7543,BSM953@northropgrumman.com,,,Rae.Melissa.Wilson@dtaa.com,26626,0,people start develop benefits dynamic compensation job sales experience experience customer guidance skills management equivalent initiative team technologies multiple interface initiative sales people interface start permanent contribute strong passion platform strong experience relocation analyze growth dynamic management compensation job sales skills equivalent degree hours analyze dynamic strong people skills visual expert multiple management team customer dynamic team
http,{X6F7-W4JW22HM-5507RDWH},07/06/2010 08:57:35,RMW0542,PC-7543,http://simplyhired.com/WboUhagvat57469130.jsp,develop process sales permanent multiple years multitask multiple people expert platform degree platform passion dynamic permanent required analyze contribute initiative customer team start passion start guidance develop contribute on-time report interface skills years resume responsibilities resume interface analyze customer guidance people years engineer management dynamic start customer team contribute sales report develop required multitask
http,{G5T4-J7JX98ZV-3969XHBB},07/06/2010 09:34:36,RMW0542,PC-7543,http://yahoo.com/hotjobs/WboUhagvat752138490.php,recruiter technologies team opening interface analyze analyze industry responsibilities part-time process hours sales report skills growth multitask resume years equivalent responsibilities skills engineer sales resume develop experience guidance multiple on-line on-line years sales hours contribute people compensation skills job compensation opening hours job
http,{T2H4-V1PR65RZ-7192XJLV},07/06/2010 09:35:45,RMW0542,PC-7543,http://careerbuilder.com/WboUhagvat660170997.htm,responsibilities industry on-line process report experience required develop job degree job process required platform permanent passion multitask interface job degree resume job passion customer years recruiter responsibilities responsibilities start benefits required contribute equivalent initiative permanent strong degree interface passion resume years years experience industry platform customer dynamic people start starter technologies on-line dynamic people report initiative management degree degree start
http,{V0Y4-L4AK55CK-8853QULV},07/06/2010 09:42:37,RMW0542,PC-7543,http://lockheedmartin.com/WboUhagvat1636367808.htm,people responsibilities job skills experience responsibilities equivalent degree equivalent analyze people experience start management industry contribute technologies job initiative multiple required skills develop guidance experience strong people develop multiple growth benefits initiative
http,{T4C1-Q6XU61CF-7644HPBG},07/06/2010 11:12:49,RMW0542,PC-7543,http://careerbuilder.com/WboUhagvat660170997.htm,initiative multiple on-line resume customer industry skills responsibilities permanent opening strong degree analyze initiative degree skills interface dynamic contribute report on-line degree years people job resume responsibilities industry responsibilities concepts customer opening strong responsibilities strong technologies job initiative job sales years
email,{N4F5-I6UV24TN-0111QODK},07/06/2010 11:19:28,RMW0542,PC-7543,BSM953@northropgrumman.com,,,Rae.Melissa.Wilson@dtaa.com,14918,0,report customer team engineer on-time customer multitask process job expert technologies technologies concepts technologies report concepts start years management multitask customer team equivalent management interface team skills technologies benefits dynamic customer customer multitask required growth develop dynamic growth multitask on-time multiple customer strong responsibilities equivalent job multiple hours customer years concepts
http,{A4K7-O1WR86KJ-2432AIGN},07/06/2010 14:50:19,RMW0542,PC-7543,http://craigslist.org/WboUhagvat1105403916.aspx,customer multitask skills engineer skills skills start permanent multiple technologies experience expert interface required multitask required interface multiple permanent start guidance expert engineer skills contribute sales develop contribute platform develop customer years customer years required multitask multitask dynamic responsibilities compensation initiative contribute multitask responsibilities responsibilities equivalent permanent multitask strong opening resume job skills report start guidance management required
http,{D8O4-D8TU82VQ-7733STLI},07/06/2010 16:38:38,RMW0542,PC-7543,http://indeed.com/WboUhagvat1680703797.html,dynamic job degree permanent passion management job report technologies years on-time job visual develop opening experience job multitask equivalent equivalent team on-time skills interface visual report opening permanent job develop start concepts skills initiative skills degree job technologies contribute relocation years experience opening years technologies responsibilities dynamic opening benefits analyze experience
http,{T0L0-C9QD37JW-7169KQNE},07/06/2010 17:50:28,RMW0542,PC-7543,http://harris.com/WboUhagvat1919385663.htm,equivalent years platform growth contribute initiative platform permanent opening required interface responsibilities customer growth report process multiple team degree strong start interface years required responsibilities opening passion skills on-line on-time resume team concepts growth degree hours growth resume responsibilities multitask customer expert recruiter job years opening multitask platform
email,{M8T0-T3NE26SO-1014FNWR},07/07/2010 08:40:37,RMW0542,PC-7543,BSM953@northropgrumman.com,,,Rae.Melissa.Wilson@dtaa.com,26128,0,engineer on-line permanent interface equivalent process strong growth growth passion sales opening dynamic degree multiple equivalent hours hours skills visual interface initiative report on-line customer growth years multiple analyze multiple guidance develop develop platform initiative required salary concepts experience degree interface industry start multiple permanent
http,{T4A4-U0CD93WP-3384DOUC},07/07/2010 08:43:52,RMW0542,PC-7543,http://indeed.com/WboUhagvat1680703797.html,self engineer opening part-time start growth concepts platform strong resume years analyze start multiple strong years multiple people degree team develop opening call skills team skills strong process platform multitask permanent visual people multitask dynamic technologies sales contribute people on-line multiple growth start growth required skills
http,{U6K6-K9WG66GX-4717XEXQ},07/07/2010 08:55:53,RMW0542,PC-7543,http://linkedin.com/WboUhagvat1479839504.aspx,degree experience team people develop passion strong experience starter required self analyze resume skills interface growth job multitask management benefits technologies customer sales years expert develop analyze multitask passion engineer initiative compensation resume responsibilities benefits concepts degree recruiter initiative interface contribute degree passion analyze concepts analyze growth management management starter report opening salary required multiple process multitask report required
http,{K0N9-F2MA16OV-7291IVRN},07/07/2010 09:07:26,RMW0542,PC-7543,http://simplyhired.com/WboUhagvat57469130.jsp,expert sales management degree start on-time people concepts self years people sales skills contribute responsibilities passion customer management equivalent guidance benefits starter benefits expert expert opening strong on-time multiple years years benefits people equivalent permanent sales permanent management industry multiple resume strong responsibilities visual required self strong guidance skills opening platform guidance customer resume interface resume required analyze contribute contribute experience dynamic engineer concepts initiative develop guidance multitask
http,{C6I3-D4GR80RE-7950FFAR},07/07/2010 09:56:10,RMW0542,PC-7543,http://lockheedmartin.com/WboUhagvat1636367808.htm,team develop compensation develop guidance hours experience benefits industry expert permanent compensation technologies contribute process years responsibilities dynamic contribute degree resume contribute technologies develop required multitask report degree team passion job contribute on-time recruiter resume passion management analyze management report industry multitask skills benefits contribute team platform growth contribute required permanent resume guidance strong multiple resume multiple concepts
http,{B8M0-G0GK19ST-6857TXVA},07/07/2010 12:04:58,RMW0542,PC-7543,http://boeing.com/WboUhagvat1904327536.htm,growth skills multitask customer team team on-line technologies sales part-time visual customer customer customer years degree platform team starter required initiative start concepts sales degree team strong customer benefits develop team people on-time compensation guidance develop multiple strong multiple platform dynamic job self people opening strong responsibilities
http,{Y3T7-M8QG75HG-8617LJLF},07/07/2010 12:31:57,RMW0542,PC-7543,http://yahoo.com/hotjobs/WboUhagvat752138490.php,multitask relocation years passion dynamic customer guidance resume platform process start skills team contribute degree multitask multiple equivalent required team responsibilities passion people management multitask multitask multiple passion hours initiative resume growth on-time strong people people responsibilities passion guidance dynamic years years
http,{V8H9-N7WB10HF-4870JSBQ},07/07/2010 12:49:00,RMW0542,PC-7543,http://indeed.com/WboUhagvat1680703797.html,years report equivalent management starter passion resume benefits guidance resume degree on-time skills multiple part-time required passion degree years platform opening passion team multiple multitask equivalent analyze years degree industry sales degree people concepts platform industry compensation strong job degree platform required experience on-time concepts strong job people dynamic industry skills skills growth develop strong multiple required skills opening team
http,{G9H8-N4VC06IM-2597VIYS},07/07/2010 13:41:14,RMW0542,PC-7543,http://indeed.com/WboUhagvat1680703797.html,initiative customer industry contribute guidance develop equivalent experience start required concepts opening opening growth platform starter required on-time passion interface degree required team interface industry contribute passion expert platform years sales permanent industry opening responsibilities salary interface years industry hours multitask develop required hours platform multitask opening hours degree years skills growth skills benefits multitask multiple sales permanent industry multitask
http,{C5S2-R5GM87OI-5966MFRJ},07/08/2010 08:34:49,RMW0542,PC-7543,http://lockheedmartin.com/WboUhagvat1636367808.htm,dynamic degree skills multitask equivalent sales opening sales job experience years initiative passion call salary opening expert equivalent degree on-line visual experience platform dynamic strong concepts years degree passion degree analyze resume team
http,{K6S8-K2XU10FY-4942NCGJ},07/08/2010 11:43:57,RMW0542,PC-7543,http://simplyhired.com/WboUhagvat57469130.jsp,initiative multiple passion on-time compensation permanent multiple salary salary people management starter multiple growth starter engineer resume people degree team required concepts opening degree interface sales self degree salary growth customer contribute customer job interface contribute technologies industry guidance growth relocation opening dynamic people job skills interface experience initiative years concepts multitask sales sales skills interface management opening strong contribute opening guidance passion
http,{H1C9-E0HD36JB-7446CBQO},07/08/2010 12:21:30,RMW0542,PC-7543,http://harris.com/WboUhagvat1919385663.htm,customer contribute contribute opening contribute team multitask degree dynamic interface management team expert permanent multitask analyze permanent required management degree skills team process initiative dynamic develop people concepts required compensation analyze expert responsibilities strong develop interface report team develop people on-line skills part-time skills degree sales industry platform growth salary multiple skills
http,{M4H0-E6NA14XF-2126QKXA},07/08/2010 12:47:22,RMW0542,PC-7543,http://linkedin.com/WboUhagvat1479839504.aspx,resume initiative equivalent platform guidance skills on-time team people responsibilities experience hours expert equivalent people experience technologies multiple sales resume multitask years concepts strong start develop dynamic self responsibilities job on-line customer industry resume equivalent passion technologies dynamic multitask sales sales multitask experience start permanent process develop technologies required self required opening
http,{A5A7-G6GI61OM-1739RUOR},07/08/2010 15:30:34,RMW0542,PC-7543,http://yahoo.com/hotjobs/WboUhagvat752138490.php,report responsibilities customer skills expert develop team develop guidance opening equivalent hours engineer degree guidance starter initiative job skills team job benefits growth responsibilities compensation relocation experience multiple experience develop team responsibilities strong starter permanent permanent job
http,{T9C9-J9VT07XJ-1953DEND},07/09/2010 08:13:40,RMW0542,PC-7543,http://northropgrumman.com/WboUhagvat572113271.aspx,industry degree dynamic strong equivalent contribute people people resume growth analyze industry passion permanent job platform process skills benefits growth permanent permanent analyze team management part-time sales responsibilities guidance benefits self customer equivalent responsibilities start passion multiple concepts people responsibilities years interface compensation starter report job platform team benefits concepts technologies industry customer visual team
http,{Q6V9-F3DH52NQ-8547RZKQ},07/09/2010 08:17:46,RMW0542,PC-7543,http://harris.com/WboUhagvat1919385663.htm,skills opening sales degree skills job years sales platform concepts engineer on-time responsibilities required growth required skills equivalent dynamic multiple hours benefits responsibilities interface concepts skills dynamic interface required multitask develop salary interface expert management platform growth
http,{J7N1-Y2AF15PB-1913PFKA},07/09/2010 08:27:25,RMW0542,PC-7543,http://aol.com/jobs/WboUhagvat1963819229.jsp,resume strong passion concepts industry start technologies contribute salary guidance salary degree skills initiative process start experience platform people experience multiple process contribute dynamic guidance growth equivalent dynamic start people visual dynamic sales skills people concepts strong strong interface people permanent management multiple people initiative technologies process on-time equivalent
http,{Z4O2-R6FT50JO-4649WBWS},07/09/2010 09:40:53,RMW0542,PC-7543,http://simplyhired.com/WboUhagvat57469130.jsp,expert degree responsibilities call team required sales start initiative process customer experience multitask starter compensation passion permanent start opening platform contribute on-time job opening required opening skills start years call passion platform experience compensation report relocation dynamic multitask dynamic guidance contribute team customer degree salary benefits guidance strong degree industry concepts team develop people technologies develop visual opening technologies initiative self
http,{H1C0-V5CV66NK-1524EVCZ},07/09/2010 16:56:36,RMW0542,PC-7543,http://aol.com/jobs/WboUhagvat1963819229.jsp,resume responsibilities expert platform part-time part-time opening opening years hours analyze skills job passion job multiple process contribute self part-time contribute people responsibilities engineer develop passion management equivalent resume develop concepts develop multitask management on-time technologies responsibilities people opening process passion management skills sales experience
http,{M5K3-O9KC94QZ-3915DCIP},07/12/2010 08:12:05,RMW0542,PC-7543,http://linkedin.com/WboUhagvat1479839504.aspx,experience contribute multitask multiple start job platform resume team multitask platform passion passion develop start job required industry part-time dynamic strong sales relocation strong job skills on-time resume job sales degree dynamic process management equivalent start passion passion analyze multiple initiative opening sales guidance analyze on-time experience develop required visual
http,{B5Z8-E7JC74FK-3155WHAO},07/12/2010 10:45:25,RMW0542,PC-7543,http://job-hunt.org/WboUhagvat919122234.html,years platform contribute industry engineer initiative opening job initiative engineer resume growth years recruiter initiative resume process develop initiative opening contribute degree contribute concepts team interface expert self report concepts strong analyze opening team equivalent sales
http,{P4N7-P3ZC06XA-1101JXKG},07/12/2010 16:43:44,RMW0542,PC-7543,http://aol.com/jobs/WboUhagvat1963819229.jsp,management expert years required experience people platform multiple interface strong skills customer guidance on-time part-time required job equivalent degree technologies growth guidance growth self develop multiple benefits on-time platform expert skills skills multiple equivalent customer growth contribute job growth interface technologies years
