http,{L2F7-C6SB54TQ-4826FFKP},11/05/2010 13:53:03,ABC0174,PC-5156,http://lockheedmartin.com/WboUhagvat1636367808.htm,initiative equivalent responsibilities develop multitask multiple dynamic start permanent opening technologies sales interface compensation dynamic start required skills multiple job years sales initiative multiple experience strong job people team part-time report multitask engineer visual responsibilities report required process experience degree strong interface growth concepts management multitask equivalent experience on-time
http,{J1J8-P5KD45HM-9880MRZL},11/05/2010 15:24:30,ABC0174,PC-5156,http://hp.com/WboUhagvat1944152218.jsp,years expert skills management contribute technologies equivalent customer resume management degree develop concepts technologies team team skills salary responsibilities required starter years passion analyze salary engineer multitask team initiative technologies responsibilities multiple contribute process team interface experience required responsibilities skills develop multitask people responsibilities customer experience initiative concepts initiative equivalent passion interface salary start responsibilities degree concepts growth platform customer years dynamic resume skills
http,{C3I4-F8CC98UC-2799ZYVZ},11/08/2010 07:50:24,ABC0174,PC-5156,http://jobhuntersbible.com/WboUhagvat1258877042.aspx,hours responsibilities sales multiple multiple expert job permanent develop years expert relocation degree guidance experience on-line required people self responsibilities concepts interface multitask interface industry visual resume analyze responsibilities opening start degree management contribute salary sales required team sales job team salary required compensation years platform engineer
http,{D0F4-B7MI29RP-7888UMQZ},11/08/2010 08:02:26,ABC0174,PC-5156,http://simplyhired.com/WboUhagvat57469130.jsp,contribute required analyze opening equivalent people degree interface dynamic develop benefits customer on-line guidance resume concepts technologies expert permanent required on-line resume report management dynamic management dynamic process experience on-time strong develop starter interface
http,{G2K3-M4ET66AT-7560CNRV},11/08/2010 08:33:25,ABC0174,PC-5156,http://careerbuilder.com/WboUhagvat660170997.htm,team years customer develop job required team degree passion resume responsibilities report passion people report visual sales initiative growth required compensation develop responsibilities dynamic years people expert part-time start expert interface experience concepts start team compensation industry required required strong self concepts contribute
http,{M2V2-Q0FM98VF-3974JTDI},11/08/2010 08:35:23,ABC0174,PC-5156,http://careerbuilder.com/WboUhagvat660170997.htm,team strong develop analyze compensation multitask initiative skills benefits analyze responsibilities required passion skills process visual start industry team develop opening experience contribute multitask contribute start concepts growth growth dynamic resume management people resume platform report on-time years required management multitask concepts responsibilities self concepts customer experience multitask develop experience multitask multiple
http,{V0O7-R5EW91XV-9133KGZC},11/08/2010 09:10:21,ABC0174,PC-5156,http://northropgrumman.com/WboUhagvat572113271.aspx,team industry expert customer technologies experience dynamic technologies process growth industry platform years multitask team team salary skills strong equivalent team expert recruiter starter salary report salary management team degree report skills contribute compensation industry skills self people
http,{K6D6-C4RZ35FS-7811EHNY},11/08/2010 09:14:59,ABC0174,PC-5156,http://aol.com/jobs/WboUhagvat1963819229.jsp,report team on-time strong starter report people sales years industry permanent salary benefits contribute call experience team job team passion technologies job strong required self expert multitask opening growth multiple multiple initiative engineer team people growth skills industry develop guidance management on-time process hours report experience engineer
http,{Q1L7-K1VJ55OU-1971COFO},11/08/2010 13:55:15,ABC0174,PC-5156,http://hp.com/WboUhagvat1944152218.jsp,visual years analyze passion customer benefits part-time permanent sales experience call process self guidance years start self start technologies team concepts management multiple report responsibilities responsibilities required opening required strong permanent on-line experience permanent develop platform skills report analyze initiative required required growth years multitask benefits report sales technologies experience equivalent start sales platform multiple industry call
http,{D1J4-O6JH81CN-2352WTGS},11/09/2010 09:21:36,ABC0174,PC-5156,http://indeed.com/WboUhagvat1680703797.html,strong growth call hours industry job contribute required years job skills platform concepts skills interface multiple analyze platform sales customer resume multitask passion responsibilities initiative guidance concepts industry part-time multitask platform years technologies equivalent process management interface equivalent dynamic on-time industry technologies required team degree start on-time resume start industry skills experience compensation technologies opening multiple salary opening dynamic skills start skills multiple experience
http,{R7T1-L6SZ73SU-3031FKJF},11/09/2010 10:35:14,ABC0174,PC-5156,http://yahoo.com/hotjobs/WboUhagvat752138490.php,people customer interface part-time job required guidance experience years initiative dynamic contribute expert required on-time technologies team industry report platform job sales experience guidance growth guidance part-time growth benefits multitask permanent interface analyze develop degree job visual skills team multitask compensation
http,{G0Z5-Y2XW50SN-6147SZPS},11/09/2010 10:35:25,ABC0174,PC-5156,http://harris.com/WboUhagvat1919385663.htm,skills management customer engineer degree management multitask years interface analyze resume required years concepts industry customer opening contribute contribute experience concepts call passion contribute equivalent benefits years experience concepts sales platform multitask required resume hours management opening part-time sales concepts dynamic strong multitask guidance job self multiple
email,{B6B0-M0DQ25SQ-4297MZJW},11/09/2010 14:02:36,ABC0174,PC-5156,Stephanie_C_Wells@raytheon.com,,Allegra.Bree.Coffey@dtaa.com,Allegra.Bree.Coffey@dtaa.com,37885,0,sales on-time on-time technologies multitask degree start starter resume experience team guidance degree multitask hours multiple equivalent contribute initiative platform degree compensation concepts develop benefits contribute multitask growth equivalent growth customer develop customer permanent on-line contribute multiple required platform team platform sales multiple contribute dynamic platform resume industry people resume resume experience responsibilities
http,{Y1W6-H7CZ63XS-4367IXJY},11/10/2010 09:49:02,ABC0174,PC-5156,http://aol.com/jobs/WboUhagvat1963819229.jsp,technologies sales growth job job contribute industry responsibilities relocation job develop responsibilities platform responsibilities years expert guidance degree hours required resume team on-time people multitask job management opening strong years resume develop develop strong compensation report team skills report responsibilities on-time multitask skills management
http,{Q5R0-U6KM07BD-8384EHDY},11/10/2010 10:27:17,ABC0174,PC-5156,http://aol.com/jobs/WboUhagvat1963819229.jsp,equivalent experience platform initiative equivalent strong platform start experience responsibilities experience skills salary management dynamic customer develop permanent responsibilities report management benefits expert multiple skills responsibilities engineer sales guidance guidance team call permanent part-time growth concepts management multiple dynamic develop starter benefits strong opening
http,{T6R2-R2JY03FL-3817BATN},11/10/2010 12:36:00,ABC0174,PC-5156,http://northropgrumman.com/WboUhagvat572113271.aspx,passion dynamic starter experience multiple technologies compensation strong platform dynamic part-time permanent industry customer team responsibilities technologies dynamic experience strong sales self multitask strong required opening engineer contribute dynamic permanent responsibilities industry growth job required required interface report resume compensation multitask job team years team dynamic interface team experience platform industry self concepts experience process management resume
http,{G5W7-F4NL48LF-0875FDLV},11/10/2010 13:32:34,ABC0174,PC-5156,http://hp.com/WboUhagvat1944152218.jsp,dynamic concepts years team visual equivalent part-time multitask hours management multitask concepts management permanent team required people job contribute skills skills dynamic responsibilities dynamic process hours interface guidance skills relocation degree benefits required platform interface on-time required benefits hours self skills growth concepts industry interface years develop platform analyze required technologies contribute equivalent job engineer technologies starter salary resume permanent skills team passion resume multiple resume start multitask platform degree
http,{F1J4-W3GO63QA-9570ASHC},11/10/2010 13:56:07,ABC0174,PC-5156,http://simplyhired.com/WboUhagvat57469130.jsp,team contribute people customer multiple guidance multiple benefits management skills skills interface hours sales skills equivalent degree resume sales years expert on-time job years equivalent people call on-line required growth people process initiative compensation platform industry industry industry degree skills responsibilities skills opening degree develop starter multitask growth benefits platform compensation salary years team skills self degree concepts people
http,{K9C2-P1IU71XW-2367NUWF},11/10/2010 14:19:43,ABC0174,PC-5156,http://indeed.com/WboUhagvat1680703797.html,opening industry multiple self start hours dynamic start years growth experience sales job interface concepts experience team permanent required skills years responsibilities compensation start recruiter resume experience interface team resume technologies salary develop equivalent on-time interface multiple platform team
http,{M0A1-K8CK20RA-7122AWPU},11/10/2010 14:30:08,ABC0174,PC-5156,http://hp.com/WboUhagvat1944152218.jsp,opening passion years contribute analyze skills team multitask required self platform visual dynamic contribute degree contribute resume strong strong concepts guidance resume resume process platform resume team experience visual sales dynamic part-time people multiple team analyze dynamic job permanent experience skills technologies responsibilities job sales permanent required technologies develop customer years skills resume guidance strong initiative opening hours opening dynamic report multitask degree technologies develop passion multitask people
http,{U3V6-Y3PR36JK-4622AMOO},11/10/2010 14:47:50,ABC0174,PC-5156,http://job-hunt.org/WboUhagvat919122234.html,on-time experience skills multitask develop responsibilities growth growth multiple platform guidance concepts expert engineer industry concepts platform benefits multiple process hours guidance part-time passion industry people skills start skills customer report analyze self self required growth job experience expert platform skills customer part-time team interface interface equivalent strong
http,{Y8Q6-V3PI78PU-9178CKNG},11/10/2010 15:35:44,ABC0174,PC-5156,http://boeing.com/WboUhagvat1904327536.htm,process interface on-line passion responsibilities resume sales compensation process multiple growth guidance skills self experience visual technologies required degree multitask degree experience platform process start initiative platform degree start team team management equivalent start years permanent contribute growth opening responsibilities technologies growth contribute salary hours team hours develop customer concepts hours contribute develop degree permanent customer required opening compensation resume permanent
http,{O2S8-D4SR39AA-6815QAJN},11/11/2010 07:54:40,ABC0174,PC-5156,http://boeing.com/WboUhagvat1904327536.htm,customer opening benefits develop concepts self job management equivalent benefits technologies resume strong permanent responsibilities resume required skills skills degree multiple platform salary management equivalent passion dynamic strong starter growth on-line hours skills degree industry engineer industry permanent people strong hours management management
http,{E7Y7-F4GT90QZ-6030CIIC},11/11/2010 08:31:48,ABC0174,PC-5156,http://aol.com/jobs/WboUhagvat1963819229.jsp,concepts sales job responsibilities growth analyze skills report passion management develop guidance required multitask develop platform management on-time benefits growth experience permanent equivalent resume concepts initiative sales report skills degree on-line interface job growth job benefits
http,{U5Z1-Y3YQ56UE-3392PLSJ},11/11/2010 08:36:48,ABC0174,PC-5156,http://craigslist.org/WboUhagvat1105403916.aspx,management platform job required required concepts multiple years job on-time responsibilities multitask responsibilities team initiative technologies growth resume responsibilities experience years degree strong hours customer self strong multiple years develop expert analyze skills management people dynamic equivalent start job required team part-time permanent required expert skills industry industry technologies strong guidance
http,{A7V2-E6YW60QH-2408BGLR},11/11/2010 09:17:45,ABC0174,PC-5156,http://indeed.com/WboUhagvat1680703797.html,multiple opening sales growth self sales multitask years report permanent develop people growth process management people growth contribute salary multitask start platform analyze multitask relocation contribute starter interface sales team job equivalent start experience responsibilities growth growth responsibilities equivalent growth dynamic technologies experience part-time technologies develop skills industry start report platform responsibilities visual
http,{Q7H7-Q4FN68OZ-1069GSXS},11/11/2010 10:19:18,ABC0174,PC-5156,http://yahoo.com/hotjobs/WboUhagvat752138490.php,process sales technologies benefits technologies analyze dynamic team concepts dynamic interface on-time required guidance technologies team strong visual concepts strong people start start benefits dynamic report initiative skills expert develop visual interface part-time interface passion responsibilities team responsibilities expert call sales
http,{W7U3-P7AS77HH-9773MIPN},11/11/2010 10:46:01,ABC0174,PC-5156,http://hp.com/WboUhagvat1944152218.jsp,resume people years contribute responsibilities customer resume technologies passion dynamic experience contribute growth team technologies opening dynamic skills degree industry initiative years benefits expert equivalent equivalent equivalent team industry industry report required responsibilities guidance analyze equivalent on-time team strong required guidance
http,{S7D3-F3RP53UZ-6913FCBM},11/11/2010 10:49:16,ABC0174,PC-5156,http://craigslist.org/WboUhagvat1105403916.aspx,passion start compensation starter skills degree interface opening responsibilities platform industry initiative job industry industry team develop part-time develop industry
http,{X7I1-N4GV88JN-2191GHWU},11/11/2010 15:19:27,ABC0174,PC-5156,http://boeing.com/WboUhagvat1904327536.htm,engineer start years passion contribute initiative interface develop concepts skills equivalent analyze job responsibilities years develop skills recruiter experience compensation sales multiple skills multiple passion multiple interface job part-time resume contribute years develop contribute multiple job compensation strong equivalent dynamic equivalent experience skills relocation opening concepts job contribute team part-time
email,{K7E7-F3YZ39JE-3493RCCQ},11/12/2010 07:49:15,ABC0174,PC-5156,Stephanie_C_Wells@raytheon.com,Allegra.Bree.Coffey@dtaa.com,,Allegra.Bree.Coffey@dtaa.com,23294,0,required industry initiative dynamic process experience skills start report resume responsibilities sales customer resume hours skills guidance required customer dynamic platform strong initiative contribute multitask responsibilities starter responsibilities self platform customer team team team skills strong experience part-time analyze
http,{Z9W1-C6TT21PM-3410SNQL},11/12/2010 10:22:46,ABC0174,PC-5156,http://boeing.com/WboUhagvat1904327536.htm,on-time multiple resume multitask multiple contribute develop resume resume concepts compensation experience technologies self years equivalent experience resume starter multitask required start team growth equivalent guidance sales on-time years multiple responsibilities resume initiative permanent multiple opening customer contribute start initiative industry growth years multiple develop technologies responsibilities required required initiative platform concepts years multiple concepts visual degree customer relocation management expert report contribute customer
http,{D1C0-D4YB95GG-0834BZNZ},11/13/2010 08:41:00,ABC0174,PC-5156,http://yahoo.com/hotjobs/WboUhagvat752138490.php,experience expert process resume process analyze relocation job permanent dynamic degree experience concepts job experience required dynamic years equivalent part-time required sales degree growth dynamic expert concepts experience develop required growth interface multiple
http,{P2Z9-F8MR83VI-7178HLVM},11/13/2010 09:18:04,ABC0174,PC-5156,http://hp.com/WboUhagvat1944152218.jsp,dynamic process strong opening resume develop dynamic self concepts resume sales starter management on-time guidance start growth degree skills part-time required report responsibilities benefits technologies job experience people experience management job opening compensation years management
http,{B1U7-I5NT77JB-5977HBQF},11/13/2010 09:22:09,ABC0174,PC-5156,http://boeing.com/WboUhagvat1904327536.htm,expert initiative on-line concepts contribute self degree starter guidance people years expert skills permanent job people responsibilities equivalent job concepts industry visual analyze years equivalent required customer dynamic responsibilities engineer starter compensation benefits experience compensation resume contribute
http,{Q5P4-N8MY55CA-4722HZNC},11/13/2010 09:53:00,ABC0174,PC-5156,http://raytheon.com/WboUhagvat343187784.jsp,analyze dynamic analyze passion equivalent people growth hours multiple growth develop initiative platform experience customer degree analyze skills equivalent experience job permanent recruiter initiative salary skills experience recruiter experience resume required analyze experience industry dynamic analyze
http,{M2H5-B3VC65YO-5303CCTQ},11/13/2010 14:02:24,ABC0174,PC-5156,http://job-hunt.org/WboUhagvat919122234.html,years opening team resume expert team skills opening develop degree self permanent on-time skills process sales management platform self technologies growth multitask multitask equivalent resume interface dynamic team required resume responsibilities concepts people guidance strong job growth concepts benefits resume job initiative call opening
http,{G9T2-Q4YZ23TO-9691LOFK},11/15/2010 08:20:26,ABC0174,PC-5156,http://monster.com/WboUhagvat1180707852.html,required dynamic passion hours industry strong experience initiative customer years platform report part-time job passion multiple concepts people concepts management dynamic engineer team experience multiple opening compensation sales industry opening sales customer part-time customer dynamic required start management
email,{W1E0-F3HN09FB-5671FGCS},11/15/2010 09:22:40,ABC0174,PC-5156,Stephanie_C_Wells@raytheon.com,Allegra.Bree.Coffey@dtaa.com,,Allegra.Bree.Coffey@dtaa.com,22608,0,permanent benefits resume multiple job compensation multitask passion management self report multitask multiple technologies technologies industry growth experience self equivalent responsibilities contribute people industry skills dynamic analyze opening degree equivalent required platform multitask
email,{M1X8-Z1HC84RO-5026EVHZ},11/15/2010 09:31:58,ABC0174,PC-5156,Stephanie_C_Wells@raytheon.com,,Allegra.Bree.Coffey@dtaa.com,Allegra.Bree.Coffey@dtaa.com,24122,1,opening opening visual required guidance part-time compensation growth technologies multitask management years team multitask responsibilities technologies multiple develop platform job team multiple resume opening customer benefits team years customer on-time dynamic years multitask self dynamic report skills on-time report part-time sales equivalent compensation concepts concepts contribute hours degree equivalent sales starter responsibilities multiple initiative
http,{F6Y2-B7TO98EA-1133KASP},11/15/2010 09:37:46,ABC0174,PC-5156,http://monster.com/WboUhagvat1180707852.html,customer dynamic equivalent customer responsibilities contribute multiple start multitask interface permanent on-time years equivalent guidance interface multitask sales concepts industry technologies benefits benefits permanent growth benefits years skills multitask skills technologies growth degree benefits compensation management job experience
http,{K1B6-L4NW04JD-9539BKQW},11/15/2010 12:33:27,ABC0174,PC-5156,http://boeing.com/WboUhagvat1904327536.htm,technologies multiple management develop concepts process permanent industry salary interface interface analyze sales platform growth equivalent guidance experience years multitask dynamic equivalent industry job benefits report guidance equivalent customer passion analyze management interface report multitask guidance job years team management customer benefits dynamic responsibilities people skills responsibilities develop guidance contribute equivalent team sales experience management platform growth engineer concepts call permanent concepts technologies
http,{C2S2-K8OX45IF-5105TOSV},11/15/2010 12:41:17,ABC0174,PC-5156,http://jobhuntersbible.com/WboUhagvat1258877042.aspx,analyze benefits report start multitask sales visual visual multiple sales hours develop resume part-time multitask years sales degree develop sales on-time concepts equivalent years analyze sales team concepts benefits resume expert technologies sales dynamic guidance self degree permanent technologies
http,{P2O8-S1GI83GA-1821CXSS},11/15/2010 13:36:06,ABC0174,PC-5156,http://lockheedmartin.com/WboUhagvat1636367808.htm,guidance people experience on-line compensation responsibilities dynamic self report years concepts platform degree growth guidance benefits required concepts multiple experience degree technologies job customer platform team report responsibilities report technologies management responsibilities job growth contribute industry platform contribute process degree part-time benefits visual management compensation multiple job start required
http,{G9C9-N3MG94NY-4710ICGS},11/15/2010 14:41:21,ABC0174,PC-5156,http://simplyhired.com/WboUhagvat57469130.jsp,customer benefits resume part-time concepts compensation management guidance management growth process passion salary team hours customer resume experience develop process job skills contribute benefits start multiple starter on-time initiative strong benefits process degree skills skills passion opening people people team years multiple expert
http,{J2Q7-Q5WQ38DK-7038TNGR},11/16/2010 08:06:10,ABC0174,PC-5156,http://job-hunt.org/WboUhagvat919122234.html,responsibilities industry expert multitask experience initiative platform people multitask growth passion salary responsibilities dynamic years degree years technologies platform sales strong degree resume hours customer people dynamic contribute develop passion responsibilities strong analyze years required people interface contribute guidance opening technologies responsibilities guidance skills
http,{N3H9-X4TK85RC-8928CHDD},11/16/2010 08:36:34,ABC0174,PC-5156,http://hp.com/WboUhagvat1944152218.jsp,expert skills sales develop growth resume growth interface expert technologies dynamic job contribute expert part-time hours permanent process guidance start develop multiple initiative passion concepts visual resume growth required management initiative analyze recruiter degree technologies team contribute opening passion develop years resume platform initiative multitask multiple experience
http,{I5K3-Y7XE11DY-3370KVNN},11/16/2010 08:42:56,ABC0174,PC-5156,http://monster.com/WboUhagvat1180707852.html,on-time platform guidance multiple report required start report strong analyze guidance initiative passion people experience guidance years required experience management management opening customer growth benefits multiple required industry analyze technologies platform expert contribute skills strong years job develop on-line guidance sales dynamic interface benefits initiative multitask passion technologies starter contribute on-time team technologies starter platform opening initiative develop multiple technologies
http,{M3O8-X1TN90XK-1989NHBW},11/16/2010 08:44:32,ABC0174,PC-5156,http://harris.com/WboUhagvat1919385663.htm,resume salary team dynamic interface interface resume experience resume multitask strong contribute benefits skills skills passion skills people opening opening start team responsibilities equivalent technologies platform degree job equivalent passion team growth benefits growth customer team benefits initiative platform process years expert people
http,{Z0I7-U8OY46TL-0023HOSG},11/16/2010 09:53:44,ABC0174,PC-5156,http://aol.com/jobs/WboUhagvat1963819229.jsp,initiative required growth skills experience multiple management job management job technologies guidance start hours self job report opening engineer opening on-line people required resume multitask job permanent process compensation benefits experience develop sales engineer permanent platform skills required responsibilities platform multiple develop
