http,{V7R1-M5XQ52NY-6067RSKS},07/13/2010 09:57:39,RMW0542,PC-7543,http://harris.com/WboUhagvat1919385663.htm,dynamic develop equivalent customer responsibilities salary interface passion opening resume multitask start hours passion recruiter dynamic job customer benefits start strong report responsibilities strong skills resume years years on-time guidance initiative responsibilities experience experience strong relocation guidance multitask on-time develop contribute degree multiple initiative required interface required sales relocation job equivalent required
email,{E7E4-A1AP38RF-6046WKLO},07/13/2010 10:27:05,RMW0542,PC-7543,BSM953@northropgrumman.com,,,Rae.Melissa.Wilson@dtaa.com,46090,0,technologies opening degree degree experience compensation guidance responsibilities management relocation sales growth process industry customer platform process people responsibilities growth platform develop responsibilities resume process develop hours experience industry skills platform strong job degree passion part-time concepts experience multiple multiple visual technologies multiple analyze years growth interface degree years contribute interface benefits industry recruiter experience platform multitask initiative initiative industry starter management recruiter multitask resume growth strong
email,{N2B0-V4LL31WU-3733THMR},07/13/2010 13:33:59,RMW0542,PC-7543,BSM953@northropgrumman.com,,,Rae.Melissa.Wilson@dtaa.com,13789,0,required guidance part-time multitask on-line guidance opening years job years team multitask degree skills start responsibilities customer customer concepts interface resume concepts industry passion experience opening hours degree start team guidance management multitask multiple resume report concepts contribute skills management on-time report equivalent equivalent responsibilities skills technologies growth passion
http,{E7L4-X0RS31ZJ-8986MKQK},07/13/2010 15:26:47,RMW0542,PC-7543,http://boeing.com/WboUhagvat1904327536.htm,experience skills on-time multitask people sales degree degree resume opening equivalent benefits visual compensation dynamic people permanent opening equivalent contribute opening required technologies opening required passion benefits people team compensation customer multitask technologies experience multiple sales multiple process skills experience experience people customer multitask opening relocation job experience responsibilities visual engineer compensation skills degree initiative
email,{E0B4-C1AB61YV-1663HQAA},07/13/2010 15:36:12,RMW0542,PC-7543,BSM953@northropgrumman.com,,,Rae.Melissa.Wilson@dtaa.com,11764,0,expert on-time strong develop benefits multitask start analyze permanent multitask resume concepts years process experience responsibilities people passion relocation on-line salary experience permanent technologies team degree experience concepts years dynamic visual guidance platform degree sales technologies multitask initiative contribute relocation growth customer resume interface dynamic process resume visual degree responsibilities strong contribute contribute experience develop resume responsibilities benefits technologies growth part-time
http,{G7V7-Q0HG67EI-9694RGVV},07/13/2010 15:56:39,RMW0542,PC-7543,http://indeed.com/WboUhagvat1680703797.html,on-line customer resume management start interface permanent start opening industry concepts platform visual sales process required skills multitask multitask equivalent process experience growth salary responsibilities expert analyze skills experience degree responsibilities initiative equivalent concepts team resume multitask experience team benefits platform years years job concepts
http,{Y1G1-P3BA01YD-9078RCUR},07/13/2010 16:00:58,RMW0542,PC-7543,http://simplyhired.com/WboUhagvat57469130.jsp,job customer responsibilities technologies initiative experience skills multitask engineer equivalent opening responsibilities required experience team benefits develop concepts multiple platform skills passion analyze platform required required contribute interface dynamic experience skills multitask multiple multitask growth hours experience benefits experience report degree sales report resume customer on-time technologies experience contribute compensation
http,{C5E1-I0SR19FW-3349JJPU},07/13/2010 17:08:04,RMW0542,PC-7543,http://indeed.com/WboUhagvat1680703797.html,responsibilities salary expert interface multiple hours hours experience contribute concepts interface on-time resume equivalent guidance contribute develop management develop concepts permanent concepts growth skills years customer skills responsibilities experience responsibilities people skills guidance guidance skills years dynamic required develop years degree benefits resume multiple report process interface analyze develop report experience analyze required
http,{R4H0-U1UN57UD-9710MKSG},07/14/2010 08:10:39,RMW0542,PC-7543,http://indeed.com/WboUhagvat1680703797.html,self management skills technologies hours responsibilities strong contribute management dynamic dynamic on-line report multitask skills required responsibilities hours on-time experience contribute self degree responsibilities years responsibilities multitask benefits platform passion strong people experience responsibilities experience analyze opening expert on-time interface responsibilities opening report required start industry
email,{L8Z2-S8NZ74OJ-0513LRGI},07/14/2010 09:12:42,RMW0542,PC-7543,BSM953@northropgrumman.com,,,Rae.Melissa.Wilson@dtaa.com,36404,0,job on-line report develop customer permanent multiple equivalent required guidance resume dynamic on-time contribute sales management multitask sales strong passion required team initiative expert experience resume experience strong degree sales on-time years dynamic experience self platform team technologies growth
http,{H8V0-Y4IA38CM-5653IBBZ},07/14/2010 10:22:45,RMW0542,PC-7543,http://boeing.com/WboUhagvat1904327536.htm,job benefits start job degree required opening platform team responsibilities responsibilities salary develop job develop hours relocation start concepts industry experience contribute multiple required growth management call expert salary report initiative hours multitask strong salary starter technologies on-time equivalent team start sales multiple experience multiple required responsibilities resume process initiative management degree multiple platform multiple starter
http,{S2G3-C0XO35XM-3064PIHP},07/14/2010 16:45:13,RMW0542,PC-7543,http://harris.com/WboUhagvat1919385663.htm,required degree multitask technologies dynamic multitask strong job develop responsibilities platform self benefits sales contribute team visual hours multiple initiative permanent growth sales equivalent expert passion part-time degree interface experience experience initiative start years start opening responsibilities equivalent interface passion degree resume dynamic skills
http,{R6S8-K8SH18PM-3638GXEQ},07/14/2010 17:14:36,RMW0542,PC-7543,http://careerbuilder.com/WboUhagvat660170997.htm,multitask contribute multitask experience years compensation guidance on-line degree guidance industry strong people concepts part-time analyze resume people platform opening start degree process concepts interface job management sales multitask industry dynamic benefits report process platform team skills multitask resume interface engineer starter contribute job guidance experience technologies dynamic people experience process permanent expert growth required opening guidance multitask
email,{K9E1-A1BP54BC-5305RQTR},07/14/2010 17:19:51,RMW0542,PC-7543,BSM953@northropgrumman.com,,,Rae.Melissa.Wilson@dtaa.com,53334,0,management concepts interface initiative dynamic expert management skills interface start equivalent initiative resume platform customer part-time skills experience benefits job experience equivalent customer passion technologies dynamic management analyze interface strong opening strong industry develop process required starter analyze degree interface customer multitask analyze required equivalent sales
http,{P5O1-E7BN07AB-3593VCKW},07/15/2010 09:51:31,RMW0542,PC-7543,http://aol.com/jobs/WboUhagvat1963819229.jsp,management years team required guidance job job responsibilities platform hours experience platform salary dynamic years industry management guidance platform concepts contribute multiple responsibilities skills permanent strong degree opening skills part-time guidance customer analyze starter platform people guidance opening platform responsibilities years job report management multiple team degree resume start customer concepts industry growth starter
http,{Y9N5-H9ME66XG-2213RCCL},07/15/2010 12:44:22,RMW0542,PC-7543,http://job-hunt.org/WboUhagvat919122234.html,people permanent dynamic years multiple multiple dynamic customer guidance sales team team skills guidance expert expert interface skills passion dynamic part-time growth initiative equivalent sales customer analyze concepts expert experience team degree technologies passion people strong responsibilities strong multitask job process skills resume responsibilities benefits customer equivalent strong technologies experience years skills team growth sales benefits interface people team develop benefits customer contribute customer initiative expert
http,{N9E6-I7JT79YI-5659POYE},07/15/2010 14:18:52,RMW0542,PC-7543,http://hp.com/WboUhagvat1944152218.jsp,technologies customer required guidance dynamic start contribute dynamic passion sales degree start contribute years compensation resume job responsibilities opening resume degree job multiple report years people customer platform years concepts multitask initiative platform salary customer starter resume interface interface opening report years management dynamic initiative multitask contribute passion start guidance concepts skills technologies degree years passion salary management
http,{E8T0-T0IN83YU-1448QDDP},07/15/2010 15:58:03,RMW0542,PC-7543,http://monster.com/WboUhagvat1180707852.html,experience initiative start multitask multiple opening experience required passion management contribute start interface process experience people management management industry dynamic contribute sales call permanent opening starter multitask start initiative start platform
http,{Z8A9-T8SZ86PI-2744OMIW},07/15/2010 17:33:29,RMW0542,PC-7543,http://craigslist.org/WboUhagvat1105403916.aspx,contribute platform process strong expert team concepts platform on-time develop experience experience passion strong on-line multiple dynamic dynamic growth interface start industry responsibilities sales job industry strong passion management start analyze process compensation develop required passion technologies sales degree years resume equivalent interface growth multiple required multitask start process opening
http,{K3O0-W3DS01DX-7258VCIC},07/16/2010 10:19:41,RMW0542,PC-7543,http://jobhuntersbible.com/WboUhagvat1258877042.aspx,technologies management growth opening part-time industry growth visual analyze permanent multiple interface responsibilities required skills passion equivalent job engineer sales benefits engineer equivalent on-time starter management job multiple industry strong opening develop responsibilities permanent technologies years opening equivalent team start industry team concepts concepts
http,{B9S9-M5PG77GD-8887KLNZ},07/16/2010 11:55:57,RMW0542,PC-7543,http://hp.com/WboUhagvat1944152218.jsp,experience start guidance multiple degree report permanent equivalent contribute on-time visual degree resume experience initiative develop years dynamic skills strong part-time multiple contribute experience required people expert report benefits permanent benefits visual management degree years hours technologies opening interface benefits team team initiative experience multitask required develop required management
http,{G2N2-R8IA09MR-7934CKMM},07/16/2010 12:08:30,RMW0542,PC-7543,http://hp.com/WboUhagvat1944152218.jsp,management sales passion growth degree experience management concepts customer customer required years required contribute management platform job customer experience starter develop benefits sales job opening team part-time self experience experience industry industry contribute recruiter degree job opening experience concepts develop platform expert years contribute salary management passion contribute technologies skills responsibilities start sales start skills dynamic industry growth experience job
http,{H1Q0-D7PP12NN-6601LSRC},07/16/2010 12:18:13,RMW0542,PC-7543,http://northropgrumman.com/WboUhagvat572113271.aspx,growth experience dynamic responsibilities multiple interface experience report platform job people concepts skills salary industry opening on-time experience opening degree experience develop starter years skills skills job process responsibilities dynamic dynamic start people required platform engineer guidance strong equivalent benefits experience resume resume resume benefits multitask develop visual recruiter equivalent report multiple multiple management hours technologies years permanent
http,{U1T3-F2EQ90MD-4155VHTR},07/16/2010 13:16:50,RMW0542,PC-7543,http://monster.com/WboUhagvat1180707852.html,interface sales contribute resume process experience dynamic experience responsibilities degree team growth degree analyze passion platform industry contribute skills resume develop equivalent multitask salary concepts industry growth customer management develop develop report contribute team equivalent guidance people degree skills job self years contribute degree multiple guidance people initiative degree
http,{D6M7-T8UI14WG-2277SSXG},07/16/2010 13:23:23,RMW0542,PC-7543,http://craigslist.org/WboUhagvat1105403916.aspx,platform people team contribute equivalent team on-line team visual concepts resume initiative job sales required start growth opening expert part-time call skills dynamic responsibilities growth dynamic equivalent compensation experience customer multiple develop team on-time sales people on-line experience team experience experience customer skills industry years degree passion technologies experience responsibilities dynamic industry skills strong degree sales job team part-time multitask
email,{O4W4-R1YZ25CZ-5710GUPT},07/16/2010 14:02:29,RMW0542,PC-7543,BSM953@northropgrumman.com,,,Rae.Melissa.Wilson@dtaa.com,40631,0,equivalent recruiter industry management required opening permanent required benefits on-time dynamic passion on-line experience report process concepts years expert responsibilities contribute permanent start years start expert multiple engineer skills team start sales self experience industry develop develop growth opening
http,{P5J2-X2MZ61JM-1661OQJK},07/16/2010 14:32:45,RMW0542,PC-7543,http://indeed.com/WboUhagvat1680703797.html,guidance resume required starter industry strong opening resume start team hours degree growth start experience technologies resume hours platform resume multiple start multitask part-time contribute opening growth initiative opening management multitask strong experience resume process required experience experience salary skills guidance experience contribute customer develop start develop expert
http,{P8J4-X8YD61MK-4961EAZV},07/16/2010 14:34:46,RMW0542,PC-7543,http://boeing.com/WboUhagvat1904327536.htm,initiative interface self skills multiple responsibilities customer required sales strong team initiative contribute equivalent management engineer years start analyze multitask management starter visual job call interface on-time hours growth guidance develop multiple initiative responsibilities compensation management resume
http,{P5T2-K5WY32QN-7081QWRB},07/19/2010 10:42:44,RMW0542,PC-7543,http://careerbuilder.com/WboUhagvat660170997.htm,guidance responsibilities opening degree resume multiple start opening passion resume required equivalent growth develop call compensation years passion strong initiative team passion customer management people concepts resume required growth years people report hours degree multitask on-time sales hours management multitask skills job experience equivalent passion people customer multitask degree degree multiple expert
http,{D4C8-A1WY31MW-3466GNLO},07/19/2010 12:25:18,RMW0542,PC-7543,http://linkedin.com/WboUhagvat1479839504.aspx,required resume report expert multitask sales years initiative years industry job engineer opening team team compensation process call experience customer interface interface initiative benefits concepts strong compensation salary team degree starter platform team opening experience interface degree job technologies equivalent dynamic skills expert platform process growth experience initiative analyze sales initiative platform customer responsibilities process equivalent required skills customer
http,{P3P2-W9BI85UD-0306NKHH},07/19/2010 13:42:49,RMW0542,PC-7543,http://yahoo.com/hotjobs/WboUhagvat752138490.php,starter job equivalent job multitask resume visual dynamic customer multitask start growth guidance people responsibilities process contribute multitask technologies passion concepts degree equivalent team responsibilities passion on-line customer interface required required multitask responsibilities years equivalent contribute people contribute people multiple equivalent resume experience visual permanent hours resume job benefits sales analyze
http,{F6R5-J0XB44NX-2083HHYL},07/20/2010 08:02:33,RMW0542,PC-7543,http://aol.com/jobs/WboUhagvat1963819229.jsp,starter opening customer concepts resume skills permanent develop multitask sales start experience experience strong on-time required platform develop sales required opening industry platform team resume salary initiative industry passion degree responsibilities contribute resume experience equivalent industry years interface customer resume required call concepts guidance develop customer salary customer hours platform job people initiative sales start strong opening strong required experience
http,{P2Z1-I2JS45YO-0677UVKI},07/20/2010 12:36:36,RMW0542,PC-7543,http://yahoo.com/hotjobs/WboUhagvat752138490.php,experience years develop contribute contribute part-time strong equivalent benefits guidance process benefits skills interface report skills interface strong strong platform required industry resume required years passion platform benefits analyze concepts industry hours dynamic equivalent opening expert job dynamic on-line
http,{J4C3-D8CJ76PZ-9572JBSC},07/20/2010 12:48:14,RMW0542,PC-7543,http://linkedin.com/WboUhagvat1479839504.aspx,multiple develop contribute job on-time resume interface years sales engineer develop required equivalent required contribute engineer years develop platform platform management call platform skills required team job resume technologies concepts guidance technologies concepts multitask years opening degree skills initiative permanent customer required dynamic
http,{L3T9-Y7DT26TN-5372SVJU},07/20/2010 12:50:09,RMW0542,PC-7543,http://job-hunt.org/WboUhagvat919122234.html,opening initiative multitask concepts hours responsibilities growth part-time people industry start on-time process relocation people job experience management equivalent part-time customer team analyze skills sales equivalent resume concepts job resume years management interface platform compensation sales growth multitask resume multitask customer compensation recruiter benefits opening job
http,{E1Y4-S3OA82MK-0643RPRF},07/20/2010 15:09:43,RMW0542,PC-7543,http://job-hunt.org/WboUhagvat919122234.html,team permanent growth degree passion contribute analyze required on-time on-line benefits years degree degree experience relocation guidance skills skills contribute salary people people visual relocation dynamic concepts years contribute opening growth industry required people degree equivalent job passion on-line experience start start team technologies contribute passion multiple people team equivalent interface team
http,{K1V0-E4NO70AU-1354YTWG},07/20/2010 15:10:24,RMW0542,PC-7543,http://northropgrumman.com/WboUhagvat572113271.aspx,multiple growth skills develop passion required platform job concepts resume interface salary management equivalent growth self guidance degree skills experience analyze resume dynamic salary contribute experience technologies concepts multitask experience report job management customer management passion opening expert passion years expert technologies opening management process responsibilities contribute resume initiative platform develop resume recruiter
http,{R7X7-G3QS97ZU-1559ZZEM},07/20/2010 15:25:39,RMW0542,PC-7543,http://indeed.com/WboUhagvat1680703797.html,resume job benefits responsibilities benefits on-line experience on-time degree interface contribute skills salary multitask required multitask sales degree interface platform industry responsibilities permanent opening industry customer multiple relocation guidance concepts dynamic self technologies skills starter part-time customer responsibilities job customer part-time skills permanent dynamic call contribute equivalent multiple opening report develop on-line equivalent required develop start report opening multiple concepts concepts analyze dynamic experience on-time expert multitask industry interface team sales resume interface resume opening responsibilities sales skills people skills experience
http,{B7U9-N9PW18RH-2446FETA},07/20/2010 15:50:36,RMW0542,PC-7543,http://job-hunt.org/WboUhagvat919122234.html,responsibilities contribute sales required required resume skills years contribute degree industry dynamic required visual compensation report strong process equivalent people process start start develop technologies technologies opening industry multitask management interface on-time self years guidance guidance industry job salary degree recruiter part-time required multitask
http,{D2T7-B5RX41YP-7902REIH},07/20/2010 16:13:49,RMW0542,PC-7543,http://craigslist.org/WboUhagvat1105403916.aspx,process develop people years multiple required develop team multitask hours guidance recruiter start part-time expert multitask starter growth process benefits concepts dynamic team degree report start team degree passion analyze platform self multiple concepts report permanent contribute equivalent initiative responsibilities passion guidance job skills responsibilities analyze sales growth relocation analyze benefits
http,{W6O7-U2JP45KG-0105FLZO},07/20/2010 17:53:17,RMW0542,PC-7543,http://careerbuilder.com/WboUhagvat660170997.htm,strong growth degree guidance opening start resume guidance guidance part-time concepts develop industry permanent on-time technologies multiple report people resume concepts customer multitask interface guidance analyze skills job equivalent required strong dynamic platform multitask benefits develop years years passion develop part-time develop job benefits responsibilities responsibilities engineer years dynamic on-time degree permanent growth permanent expert sales customer opening technologies hours benefits analyze
http,{F2B1-E7GX38PO-4305UBRW},07/21/2010 08:46:59,RMW0542,PC-7543,http://simplyhired.com/WboUhagvat57469130.jsp,contribute guidance contribute strong guidance analyze industry experience guidance years hours industry opening analyze management opening expert required equivalent skills required equivalent concepts develop process responsibilities part-time years team industry years required job expert analyze engineer dynamic on-line experience
http,{X6E9-E5XU67OZ-9942KUAZ},07/21/2010 08:53:40,RMW0542,PC-7543,http://job-hunt.org/WboUhagvat919122234.html,contribute salary required platform customer strong multitask degree experience years multitask resume contribute multiple self start develop contribute salary degree customer required growth on-time develop start contribute multitask platform on-line platform interface initiative degree customer responsibilities technologies develop multiple technologies
device,{Z6M7-Y9XL33OX-4765EDPS},07/21/2010 08:59:29,RMW0542,PC-7543,Connect
http,{B9G9-K5XD09BW-8431ZPSQ},07/21/2010 10:35:42,RMW0542,PC-7543,http://indeed.com/WboUhagvat1680703797.html,people interface team multiple starter experience report interface skills resume initiative platform develop platform required multiple benefits develop passion on-line passion resume develop initiative team dynamic interface experience opening skills guidance hours starter required degree call degree multitask report
device,{G1P1-Y3MD88YI-7143ASEF},07/21/2010 10:43:46,RMW0542,PC-7543,Connect
device,{C4R6-N0AV07MB-4765KCKY},07/21/2010 11:00:00,RMW0542,PC-7543,Disconnect
device,{G6U7-T9FZ81FP-1619JLOT},07/21/2010 11:36:06,RMW0542,PC-7543,Connect
device,{E2K0-I8PG48XJ-0259IYCP},07/21/2010 12:24:22,RMW0542,PC-7543,Disconnect
device,{J4V3-O0XQ90WX-6077SNCW},07/21/2010 12:47:17,RMW0542,PC-7543,Connect
device,{D0C8-U9WM85MB-6569ELPU},07/21/2010 13:37:23,RMW0542,PC-7543,Disconnect
http,{S8Z1-O5SV39SU-8004VXWW},07/21/2010 13:50:21,RMW0542,PC-7543,http://aol.com/jobs/WboUhagvat1963819229.jsp,job develop resume management sales skills concepts customer strong compensation platform opening management opening skills sales salary growth people opening experience required equivalent permanent expert expert required multiple hours team people permanent initiative responsibilities salary contribute opening contribute opening contribute job experience growth equivalent multiple analyze develop required contribute years required industry years expert expert engineer multiple growth
device,{Y3T0-Y2RT28MH-2991HUAT},07/21/2010 14:46:27,RMW0542,PC-7543,Connect
device,{Y5X0-Z9GO10MD-0256YZOV},07/21/2010 14:51:41,RMW0542,PC-7543,Disconnect
device,{K9L7-V4QJ06UJ-7169EDQJ},07/21/2010 16:16:29,RMW0542,PC-7543,Connect
device,{M0A2-L3EW58WR-0641RUHI},07/21/2010 16:28:32,RMW0542,PC-7543,Disconnect
device,{W9L4-A8XY19UK-0864IWLC},07/21/2010 17:24:44,RMW0542,PC-7543,Connect
device,{O7K1-C3NS62BA-7229VUYB},07/21/2010 17:50:37,RMW0542,PC-7543,Disconnect
