http,{W4X0-T0UR45WY-3260KHMN},07/15/2010 07:23:37,MOS0047,PC-5820,http://indeed.com/WboUhagvat1680703797.html,experience customer strong dynamic skills multitask multitask develop relocation passion responsibilities initiative start management on-time process contribute salary develop passion opening permanent contribute required self platform on-time visual report process call industry initiative permanent sales degree skills initiative years develop customer required team platform management develop degree contribute contribute benefits
http,{F4L0-U1JZ64WO-3863HVDV},07/15/2010 07:41:23,MOS0047,PC-5820,http://careerbuilder.com/WboUhagvat660170997.htm,multitask multitask process industry expert required skills job passion opening dynamic customer analyze process resume growth years develop resume experience develop multitask sales multitask starter benefits multitask job customer industry responsibilities equivalent contribute self technologies required
http,{C5O1-O5DJ70QC-2722DTYP},07/15/2010 08:27:20,MOS0047,PC-5820,http://hp.com/WboUhagvat1944152218.jsp,part-time customer resume experience dynamic customer required guidance resume initiative benefits resume initiative resume team on-time on-time required skills concepts multiple starter degree initiative resume technologies people growth job concepts concepts visual years contribute develop platform guidance experience management sales skills experience concepts opening
http,{X4M6-D1BK85ZV-9703VPEI},07/15/2010 08:56:38,MOS0047,PC-5820,http://careerbuilder.com/WboUhagvat660170997.htm,dynamic benefits technologies develop interface dynamic degree on-time platform required years people concepts report team start years start resume concepts team technologies permanent concepts passion strong self part-time benefits resume equivalent management expert guidance strong technologies compensation concepts industry relocation years skills sales people technologies permanent multitask interface on-time industry on-time technologies
http,{N9C6-P5CB59HD-4145ECPY},07/15/2010 09:24:03,MOS0047,PC-5820,http://monster.com/WboUhagvat1180707852.html,multiple develop engineer compensation management required initiative skills dynamic opening on-time multitask required passion develop resume multitask degree team job sales growth expert job years equivalent dynamic degree growth process dynamic degree start opening customer strong resume opening required equivalent benefits
http,{E8Z9-U0FG11VB-1145FRWJ},07/15/2010 14:59:40,MOS0047,PC-5820,http://job-hunt.org/WboUhagvat919122234.html,contribute opening platform expert report compensation people customer equivalent skills passion strong years guidance growth responsibilities part-time customer responsibilities report skills opening required degree required responsibilities expert passion industry customer initiative responsibilities skills self customer interface required resume dynamic on-time team starter interface strong guidance years concepts
http,{B8E8-M7BK95MI-3744XHSA},07/16/2010 07:30:17,MOS0047,PC-5820,http://linkedin.com/WboUhagvat1479839504.aspx,equivalent permanent degree equivalent skills team concepts technologies permanent platform resume start platform interface management job sales report experience industry industry contribute customer initiative skills compensation degree experience develop people responsibilities team develop required people growth
http,{P5B9-Y7LX31AG-6228YRLK},07/16/2010 07:34:40,MOS0047,PC-5820,http://linkedin.com/WboUhagvat1479839504.aspx,job technologies multiple customer contribute part-time benefits initiative platform technologies on-line start team growth years process responsibilities on-time on-time equivalent on-time equivalent starter resume industry management skills concepts concepts strong start develop passion multitask salary self experience management experience passion concepts visual on-time opening compensation develop industry starter process equivalent industry process years multiple report permanent strong
http,{W6C5-L5ZR71HW-2145BTMF},07/16/2010 08:14:13,MOS0047,PC-5820,http://jobhuntersbible.com/WboUhagvat1258877042.aspx,team equivalent required degree industry on-time concepts guidance sales guidance concepts dynamic opening years years growth industry relocation technologies team analyze equivalent customer growth develop growth skills multiple required degree on-line report sales customer years platform team industry self people resume salary customer relocation multitask skills degree compensation multitask technologies sales job growth
http,{M4B9-W5KL37UY-2908UJIL},07/16/2010 08:18:35,MOS0047,PC-5820,http://yahoo.com/hotjobs/WboUhagvat752138490.php,recruiter start interface degree contribute industry analyze customer customer job sales responsibilities degree resume equivalent visual salary industry opening skills resume multitask benefits team team multiple opening degree industry required opening multitask team part-time
http,{S8F0-Q2ID81JS-6959WHQC},07/16/2010 08:32:45,MOS0047,PC-5820,http://indeed.com/WboUhagvat1680703797.html,required dynamic customer team platform experience passion report required strong job benefits responsibilities opening interface years job on-line develop passion concepts degree permanent sales hours experience start strong self people strong expert management team multitask experience self compensation permanent
http,{G3T1-Z3WH09US-2692PMMY},07/16/2010 09:02:56,MOS0047,PC-5820,http://raytheon.com/WboUhagvat343187784.jsp,sales report report concepts initiative customer starter required customer industry initiative degree resume team management opening expert contribute responsibilities self concepts customer resume required customer engineer report strong management expert multiple benefits self analyze multitask responsibilities sales management equivalent passion growth
http,{B4M3-U0FO78ZQ-6858MGOK},07/16/2010 09:46:59,MOS0047,PC-5820,http://harris.com/WboUhagvat1919385663.htm,people team strong interface interface technologies concepts interface on-line starter passion degree on-time strong team responsibilities equivalent responsibilities opening equivalent passion resume multitask people team concepts industry equivalent skills skills self responsibilities on-time industry initiative part-time multiple equivalent process start start required self
http,{D2U6-Y3PN23DV-9194CCBM},07/16/2010 11:50:40,MOS0047,PC-5820,http://jobhuntersbible.com/WboUhagvat1258877042.aspx,required growth guidance degree passion opening industry self guidance customer benefits interface initiative on-time on-time multitask initiative start resume start customer customer responsibilities on-time growth technologies years years passion dynamic platform multiple start responsibilities people opening skills passion years passion process concepts platform years skills permanent customer skills on-time years part-time responsibilities job team degree sales engineer part-time sales
http,{E4J2-H4QZ82LF-1634UGLM},07/16/2010 14:44:09,MOS0047,PC-5820,http://monster.com/WboUhagvat1180707852.html,multiple multiple develop passion responsibilities degree compensation technologies dynamic resume passion growth guidance degree management skills industry management job job dynamic multiple opening strong initiative multiple strong people job strong benefits management dynamic people customer team initiative equivalent management permanent resume opening develop interface responsibilities resume
http,{R8T4-B3UX15UC-1330XGJH},07/19/2010 11:51:11,MOS0047,PC-5820,http://aol.com/jobs/WboUhagvat1963819229.jsp,on-line years resume required degree compensation customer degree starter skills relocation report degree expert skills visual compensation on-line starter people responsibilities job resume guidance years opening contribute permanent passion passion growth guidance growth required self multiple skills equivalent resume strong start dynamic interface years customer concepts multiple interface years develop years multiple analyze compensation
http,{L8O1-F7NE84MS-8659CCGO},07/19/2010 13:49:48,MOS0047,PC-5820,http://aol.com/jobs/WboUhagvat1963819229.jsp,skills platform concepts job years equivalent resume permanent experience management experience multiple analyze team initiative on-line multiple on-time skills industry start concepts compensation growth strong dynamic strong years initiative technologies process growth develop platform contribute years industry job resume starter degree self equivalent opening report
http,{A4J9-J8ME59CK-5244AAJD},07/20/2010 09:34:30,MOS0047,PC-5820,http://aol.com/jobs/WboUhagvat1963819229.jsp,platform opening hours skills concepts equivalent industry multiple experience on-time industry multitask experience experience contribute interface contribute contribute sales platform interface equivalent responsibilities sales industry customer years platform multiple part-time contribute multiple
email,{K6L8-Y1VI92XO-8577GRAX},07/20/2010 10:12:12,MOS0047,PC-5820,Fiona.C.Parrish@lockheedmartin.com,,,Mariko.Olga.Snyder@dtaa.com,33681,0,contribute multiple start equivalent skills resume process start permanent benefits platform degree management experience required strong responsibilities experience analyze skills responsibilities hours start concepts start responsibilities skills part-time multitask self technologies permanent management resume report on-time multitask years industry multitask resume analyze opening contribute start guidance develop industry team develop dynamic develop initiative report skills dynamic
email,{L6R2-S8PM88CM-9144XPBS},07/20/2010 11:17:54,MOS0047,PC-5820,Fiona.C.Parrish@lockheedmartin.com,,,Mariko.Olga.Snyder@dtaa.com,30954,0,strong call experience experience industry experience sales expert industry skills start required multiple years experience industry start responsibilities required initiative guidance dynamic report degree platform multitask passion interface resume skills initiative management management required years management self engineer guidance on-time platform sales team report years responsibilities experience experience strong degree required team multiple expert required expert required resume
http,{C7B9-Z8BF56TE-2033YFXI},07/20/2010 11:31:06,MOS0047,PC-5820,http://job-hunt.org/WboUhagvat919122234.html,required passion permanent required industry skills dynamic industry dynamic required on-line equivalent analyze process on-time dynamic self strong team skills responsibilities team years on-time hours management required technologies responsibilities develop expert industry compensation starter contribute job engineer interface sales expert concepts expert
email,{H8V4-U0IU34HX-1739DOON},07/20/2010 13:55:25,MOS0047,PC-5820,Fiona.C.Parrish@lockheedmartin.com,,,Mariko.Olga.Snyder@dtaa.com,19479,3,customer skills concepts permanent hours responsibilities strong multiple opening hours skills concepts people multitask self passion management required team resume management interface years team resume multitask permanent customer benefits contribute benefits concepts team technologies
http,{X9O2-S1ZR01XH-9542NRTP},07/20/2010 14:51:02,MOS0047,PC-5820,http://job-hunt.org/WboUhagvat919122234.html,compensation skills multitask technologies experience salary concepts resume contribute start visual starter guidance sales experience job degree industry experience multitask management on-time job experience concepts expert interface process passion growth required degree contribute multitask guidance customer resume degree analyze strong hours experience experience interface passion industry concepts compensation initiative customer part-time
http,{D8X4-Z0HG79VY-1624FZPI},07/20/2010 15:07:08,MOS0047,PC-5820,http://craigslist.org/WboUhagvat1105403916.aspx,degree concepts benefits equivalent report benefits job multitask passion years multitask equivalent responsibilities equivalent dynamic benefits platform people strong technologies skills multiple platform job interface job starter sales customer process team customer years management platform degree equivalent skills resume concepts growth dynamic resume experience contribute call team years growth required compensation contribute experience on-time
http,{H2P5-N1WE52JP-3393RGBS},07/20/2010 15:24:56,MOS0047,PC-5820,http://aol.com/jobs/WboUhagvat1963819229.jsp,sales start equivalent contribute required required technologies contribute customer management customer analyze multitask permanent expert resume passion degree hours initiative develop multitask experience degree years equivalent industry customer years permanent opening interface process start skills contribute guidance multiple multitask part-time guidance strong concepts years sales start permanent concepts multiple sales technologies resume sales management skills start required start years team equivalent dynamic
http,{J7C4-F9NM16MY-5106NVDI},07/21/2010 07:47:42,MOS0047,PC-5820,http://hp.com/WboUhagvat1944152218.jsp,multitask guidance call contribute interface platform strong multiple resume platform concepts contribute management start report sales technologies passion experience report experience
http,{K0O1-C3TP63WY-3600JVKH},07/21/2010 07:50:27,MOS0047,PC-5820,http://simplyhired.com/WboUhagvat57469130.jsp,interface responsibilities customer sales experience resume develop relocation strong visual team concepts multiple report management guidance technologies equivalent equivalent responsibilities resume resume sales growth sales experience skills initiative skills years industry growth equivalent multitask industry resume on-time years team on-time years people visual required passion opening sales resume start multitask
http,{J4P8-F2IS25ZN-8382NZTM},07/21/2010 10:00:38,MOS0047,PC-5820,http://hp.com/WboUhagvat1944152218.jsp,years dynamic analyze contribute opening growth required team contribute salary recruiter degree on-line resume team job customer self guidance guidance growth job expert guidance on-time technologies resume multitask management guidance permanent degree benefits years multiple experience process required process
http,{O4E2-C3OA10PN-9486XDZY},07/21/2010 13:28:21,MOS0047,PC-5820,http://craigslist.org/WboUhagvat1105403916.aspx,management benefits contribute hours dynamic degree experience job team equivalent required team skills degree start growth expert part-time develop start experience engineer multitask customer management multitask customer interface degree multiple strong multitask technologies team sales team process industry benefits platform visual guidance dynamic develop contribute engineer equivalent industry interface dynamic resume job
http,{F8R0-J1GL22AX-1655YDWF},07/21/2010 13:30:47,MOS0047,PC-5820,http://indeed.com/WboUhagvat1680703797.html,benefits industry visual degree hours sales strong dynamic experience platform analyze degree skills technologies concepts technologies dynamic benefits salary skills concepts report concepts resume benefits responsibilities years call management call benefits salary multiple responsibilities required starter opening multiple platform report initiative dynamic multitask strong report multiple resume multitask dynamic sales management growth
http,{V5S3-D3SX77SH-6970JOWA},07/22/2010 07:48:47,MOS0047,PC-5820,http://hp.com/WboUhagvat1944152218.jsp,permanent on-time resume equivalent permanent multiple equivalent start degree sales salary skills years on-line skills people starter degree required analyze resume engineer benefits required salary guidance visual multitask concepts
http,{U6U5-J6IG03CS-0971GFKW},07/22/2010 08:04:09,MOS0047,PC-5820,http://careerbuilder.com/WboUhagvat660170997.htm,skills technologies multiple salary start on-line required start industry industry self multitask degree expert develop initiative responsibilities dynamic multitask degree guidance experience initiative multitask develop skills on-line compensation years growth degree industry initiative initiative years growth passion required benefits develop team interface initiative degree experience years start opening technologies years management
http,{M6X8-G8IR17XY-9174MQWE},07/22/2010 08:40:44,MOS0047,PC-5820,http://jobhuntersbible.com/WboUhagvat1258877042.aspx,required skills multiple multitask start growth sales job hours on-time management concepts on-line self responsibilities strong self initiative compensation experience required experience team resume opening required people self required industry people starter concepts degree team responsibilities passion equivalent industry responsibilities skills multiple develop customer team degree concepts years responsibilities sales develop
http,{T9Z5-B7EJ12IE-1799QVJP},07/22/2010 08:50:00,MOS0047,PC-5820,http://harris.com/WboUhagvat1919385663.htm,guidance degree platform team strong compensation develop team passion benefits experience on-time job technologies concepts skills equivalent guidance contribute years equivalent contribute start dynamic report call interface interface degree multiple multitask degree industry passion report sales concepts team engineer initiative initiative benefits years strong self guidance
http,{D1A6-V1GX32EZ-2018WZEX},07/22/2010 09:10:01,MOS0047,PC-5820,http://lockheedmartin.com/WboUhagvat1636367808.htm,concepts guidance years report guidance technologies industry job passion platform initiative responsibilities develop equivalent experience multitask sales customer start team management develop opening growth experience degree interface customer strong benefits guidance equivalent experience experience interface industry passion skills experience dynamic sales equivalent resume customer permanent develop expert required platform team resume permanent permanent opening experience responsibilities
http,{S5C7-B1UY61SA-5456LTLA},07/23/2010 08:21:39,MOS0047,PC-5820,http://careerbuilder.com/WboUhagvat660170997.htm,dynamic dynamic job growth resume industry initiative multiple start industry opening opening responsibilities resume permanent degree experience resume passion degree customer sales multiple strong people skills platform people expert start platform self report part-time interface years industry skills report team skills degree expert permanent people resume job salary passion customer dynamic sales initiative strong people start
http,{A6A0-N7ND48XP-9936BOME},07/23/2010 11:25:44,MOS0047,PC-5820,http://indeed.com/WboUhagvat1680703797.html,job experience skills experience multiple salary growth required required part-time develop multiple multiple start recruiter skills years degree degree opening concepts people salary team customer on-time contribute contribute multiple team people interface multiple resume equivalent permanent permanent on-line platform resume on-time resume multiple interface strong contribute dynamic
http,{F2A1-W3TT55TB-3499IGNJ},07/23/2010 13:28:26,MOS0047,PC-5820,http://raytheon.com/WboUhagvat343187784.jsp,required customer degree industry responsibilities benefits concepts customer degree growth report benefits job people start self interface platform expert years skills responsibilities salary interface job resume years years multitask responsibilities develop skills industry passion equivalent opening experience hours people industry
http,{O6D8-B9GG54BY-1363LKDX},07/23/2010 15:29:30,MOS0047,PC-5820,http://lockheedmartin.com/WboUhagvat1636367808.htm,interface resume customer contribute years expert opening salary industry multiple customer compensation visual sales responsibilities industry develop analyze analyze industry equivalent self self equivalent industry sales experience degree multiple develop concepts multitask permanent job permanent skills job resume benefits multiple job team years start concepts responsibilities dynamic resume hours interface guidance required multitask
http,{T0G7-E2DK87YX-1234XLRN},07/26/2010 07:31:12,MOS0047,PC-5820,http://simplyhired.com/WboUhagvat57469130.jsp,dynamic dynamic required contribute customer required develop people start report platform sales industry responsibilities sales platform customer degree develop expert customer on-time expert on-time dynamic industry
http,{I8J5-K8UA44IE-4626DWDV},07/26/2010 08:59:43,MOS0047,PC-5820,http://lockheedmartin.com/WboUhagvat1636367808.htm,initiative benefits concepts industry team multiple resume start responsibilities skills growth engineer start multitask strong experience multitask report experience interface hours opening skills analyze contribute people opening report growth multitask years responsibilities degree passion passion starter skills equivalent years expert permanent strong platform responsibilities expert hours team experience benefits relocation responsibilities technologies job platform benefits passion expert part-time call responsibilities interface benefits years benefits responsibilities experience resume degree opening start concepts
http,{J2Z7-N0EA77KF-4935BHEP},07/26/2010 09:27:30,MOS0047,PC-5820,http://monster.com/WboUhagvat1180707852.html,contribute technologies contribute concepts responsibilities benefits technologies initiative permanent management required multiple develop team concepts required responsibilities self contribute people engineer initiative concepts multitask platform degree multitask multitask team industry technologies years years initiative skills people experience multitask guidance equivalent management equivalent experience multitask people
http,{E1Y1-E4FO80VK-3412LKFO},07/26/2010 09:43:14,MOS0047,PC-5820,http://monster.com/WboUhagvat1180707852.html,multiple customer contribute report responsibilities multiple benefits develop team years people part-time industry growth contribute multiple contribute concepts multitask required job salary degree experience job experience opening industry responsibilities years initiative industry responsibilities experience part-time
http,{O4G1-A6LO26OJ-7907YITU},07/26/2010 10:19:23,MOS0047,PC-5820,http://raytheon.com/WboUhagvat343187784.jsp,initiative salary on-line concepts initiative skills interface technologies sales develop passion responsibilities passion team job people starter multiple job part-time experience customer years team engineer self develop team part-time opening passion resume skills team job multitask analyze responsibilities multitask team expert required multiple job management on-time concepts multitask degree benefits required passion develop industry concepts
http,{Y3L0-Z6WD75TI-9266QGCD},07/26/2010 14:25:57,MOS0047,PC-5820,http://indeed.com/WboUhagvat1680703797.html,on-time responsibilities growth customer sales customer passion on-time technologies multitask team customer experience permanent report technologies team permanent team dynamic management multitask responsibilities develop opening salary compensation develop opening experience years platform degree management develop start required initiative management opening compensation team growth develop responsibilities sales report
http,{W1A0-D6BC75DW-1746DTVD},07/26/2010 14:36:31,MOS0047,PC-5820,http://indeed.com/WboUhagvat1680703797.html,engineer skills responsibilities resume multiple opening job technologies guidance customer guidance multiple team start hours equivalent years sales management multiple industry management multitask equivalent resume recruiter responsibilities years self skills hours required equivalent years opening start dynamic degree interface benefits develop opening interface multiple strong required technologies required concepts process strong platform passion strong multiple industry
http,{Q0B6-J7GB52KP-1263AIPS},07/26/2010 14:36:36,MOS0047,PC-5820,http://hp.com/WboUhagvat1944152218.jsp,relocation growth growth skills degree start experience job industry report degree dynamic management start passion equivalent years technologies degree multiple concepts report multiple benefits develop growth customer guidance required resume report start passion job team skills hours concepts contribute management develop
http,{C0H0-L7BI00LU-7698MSEU},07/26/2010 14:39:26,MOS0047,PC-5820,http://jobhuntersbible.com/WboUhagvat1258877042.aspx,start equivalent multiple required engineer skills guidance years equivalent skills required equivalent opening responsibilities experience required visual compensation degree relocation management degree contribute skills experience required skills skills engineer industry interface dynamic part-time people
http,{V4S9-A6BM55LW-8889ONQA},07/26/2010 14:46:27,MOS0047,PC-5820,http://boeing.com/WboUhagvat1904327536.htm,platform interface compensation permanent platform platform starter platform experience hours experience multiple people concepts job compensation industry required responsibilities experience benefits equivalent passion concepts self multitask contribute concepts report team engineer people process years customer team platform multiple team report multitask multitask responsibilities degree self team platform equivalent
http,{C1A5-Y1NV65ZY-6238LSHU},07/27/2010 11:59:10,MOS0047,PC-5820,http://raytheon.com/WboUhagvat343187784.jsp,starter responsibilities opening equivalent strong multiple self sales start years skills growth platform expert equivalent industry growth customer engineer hours multitask multiple multiple multiple years experience job equivalent guidance contribute growth multitask multitask salary process guidance experience management people equivalent skills required people required permanent skills strong concepts report sales technologies team contribute on-time required develop responsibilities on-time engineer resume benefits concepts experience
