http,{R1Y0-M4IQ19XP-6857ZEUZ},10/22/2010 09:21:16,AKR0057,PC-2879,http://harris.com/WboUhagvat1919385663.htm,multiple salary technologies guidance resume guidance self job start compensation years degree interface passion skills strong interface process multitask start hours hours team hours skills hours sales responsibilities dynamic on-time concepts customer sales multitask customer permanent guidance strong opening dynamic degree management customer multitask contribute platform resume years part-time benefits dynamic
email,{V9H9-U6AA57WQ-4335OIOL},10/22/2010 09:32:19,AKR0057,PC-2879,Adrienne-Osborne@boeing.com,,Aurora.Katell.Rhodes@dtaa.com,Aurora.Katell.Rhodes@dtaa.com,61559,0,compensation job sales call skills multiple passion self experience starter management process platform develop analyze technologies engineer required interface skills hours start passion customer benefits passion
http,{A4M0-L0TR95JN-1935GHRT},10/22/2010 09:56:30,AKR0057,PC-2879,http://jobhuntersbible.com/WboUhagvat1258877042.aspx,multitask platform team platform customer interface skills report permanent management guidance industry expert job benefits on-time process develop team platform call concepts job equivalent contribute team initiative contribute process opening resume on-line initiative technologies on-time hours years on-time skills years skills benefits multiple responsibilities engineer experience passion required opening platform resume industry
http,{A5T6-J9FW97BM-8329YEJM},10/22/2010 09:59:46,AKR0057,PC-2879,http://jobhuntersbible.com/WboUhagvat1258877042.aspx,permanent resume dynamic process job skills responsibilities resume dynamic equivalent self management years resume permanent required management experience opening management starter multiple engineer industry customer report people guidance part-time expert passion starter on-line sales multitask job analyze benefits starter sales start starter required technologies self required resume start industry
http,{U6F6-F9JP32TL-1911BILI},10/22/2010 10:40:31,AKR0057,PC-2879,http://yahoo.com/hotjobs/WboUhagvat752138490.php,customer initiative passion dynamic multiple team opening resume guidance compensation on-time contribute growth multitask starter people multiple permanent recruiter part-time equivalent salary required experience people growth sales years multiple multiple expert passion opening degree multitask initiative degree platform people customer management customer platform passion industry platform on-time customer job skills
http,{J3V3-P6ZP32XS-6694EWUD},10/22/2010 11:15:30,AKR0057,PC-2879,http://raytheon.com/WboUhagvat343187784.jsp,growth concepts self years contribute skills opening multiple interface report dynamic team experience recruiter degree experience sales strong multitask experience develop industry multitask responsibilities skills required dynamic salary responsibilities skills compensation starter guidance experience equivalent passion experience industry on-time platform dynamic passion develop develop opening process multitask on-line
http,{U6A7-W5FR12FP-0227CIXG},10/22/2010 12:48:46,AKR0057,PC-2879,http://jobhuntersbible.com/WboUhagvat1258877042.aspx,compensation develop skills develop multiple guidance responsibilities dynamic technologies benefits equivalent multiple equivalent starter recruiter concepts skills job multitask team compensation responsibilities passion strong industry start report customer skills expert responsibilities management passion industry opening initiative skills team equivalent technologies concepts initiative strong growth process skills platform benefits develop years degree
http,{L9Y9-Q3GQ93GE-3779QSGC},10/22/2010 16:42:19,AKR0057,PC-2879,http://raytheon.com/WboUhagvat343187784.jsp,sales resume initiative job starter experience equivalent team analyze customer skills growth permanent multiple recruiter skills sales team management contribute required hours skills resume technologies team report people report multitask degree engineer opening concepts management compensation experience degree strong team permanent compensation degree
http,{S3C1-I1ZH79UF-1895ABBO},10/25/2010 12:44:06,AKR0057,PC-2879,http://careerbuilder.com/WboUhagvat660170997.htm,people concepts customer equivalent job benefits concepts guidance experience degree responsibilities concepts team people degree years multiple multiple engineer degree experience call multitask sales team contribute benefits years resume skills dynamic resume resume equivalent skills multiple benefits self skills process analyze management management job technologies years multitask expert compensation years degree degree concepts
http,{R9D7-J6VI08XS-4335XUIM},10/25/2010 13:12:13,AKR0057,PC-2879,http://yahoo.com/hotjobs/WboUhagvat752138490.php,initiative skills report years permanent people develop strong process opening customer concepts degree process degree responsibilities benefits concepts management degree multitask experience initiative initiative concepts interface years benefits technologies on-line contribute interface management develop multitask responsibilities initiative self growth technologies report concepts
http,{F0T1-T2YM77RR-3975HLPQ},10/25/2010 14:46:40,AKR0057,PC-2879,http://raytheon.com/WboUhagvat343187784.jsp,compensation people years platform degree contribute report customer analyze platform report engineer initiative responsibilities resume on-time contribute report initiative report interface resume management guidance customer visual hours interface part-time start visual industry customer technologies multitask strong job
http,{H3G8-X3PK33MY-9046DRHS},10/25/2010 15:01:59,AKR0057,PC-2879,http://yahoo.com/hotjobs/WboUhagvat752138490.php,interface required management salary required job interface platform dynamic required contribute team report interface industry part-time strong resume expert expert compensation multitask permanent multitask report sales resume guidance benefits strong resume required resume required opening growth opening responsibilities develop experience growth degree skills management skills passion job
http,{H9T8-J0FQ43AN-0592UMCL},10/25/2010 16:51:51,AKR0057,PC-2879,http://northropgrumman.com/WboUhagvat572113271.aspx,multitask responsibilities permanent sales required start dynamic degree sales sales growth multitask opening multitask industry degree self passion technologies skills contribute industry dynamic dynamic customer skills process platform degree start technologies interface permanent platform people people opening experience passion platform contribute people develop hours guidance platform dynamic platform contribute required management resume degree
email,{V9J4-N7WS39CZ-6049JQUQ},10/25/2010 16:52:12,AKR0057,PC-2879,Adrienne-Osborne@boeing.com,Aurora.Katell.Rhodes@dtaa.com,,Aurora.Katell.Rhodes@dtaa.com,14326,0,opening sales dynamic resume team part-time multitask initiative contribute multiple multiple multiple opening compensation job self contribute permanent experience start passion sales years start years strong management compensation report multiple dynamic expert develop initiative opening benefits dynamic contribute growth management strong benefits expert develop equivalent resume benefits multitask resume industry required analyze years permanent develop equivalent technologies salary dynamic on-time experience technologies team job self develop
email,{Q4Q4-K8JU98JT-6153MTRE},10/25/2010 17:05:52,AKR0057,PC-2879,Adrienne-Osborne@boeing.com,Aurora.Katell.Rhodes@dtaa.com,,Aurora.Katell.Rhodes@dtaa.com,27327,0,resume required interface sales on-line platform passion degree customer years team required multitask years report visual salary on-time strong multiple visual job years resume process degree people passion benefits resume equivalent experience opening opening customer responsibilities concepts contribute industry industry report concepts responsibilities strong expert multitask contribute recruiter
http,{W0J7-H8JN78AZ-1187HPJI},10/25/2010 17:08:31,AKR0057,PC-2879,http://linkedin.com/WboUhagvat1479839504.aspx,job initiative skills equivalent concepts industry industry on-time contribute job platform management on-time skills develop analyze develop resume start passion equivalent concepts people start industry develop guidance customer contribute contribute team contribute opening develop growth interface skills concepts report experience expert develop experience contribute expert platform multitask expert responsibilities resume hours team management team compensation benefits on-time management job years team visual industry growth resume years required
http,{E2Z3-U6VW88HK-8939LURG},10/25/2010 17:58:51,AKR0057,PC-2879,http://yahoo.com/hotjobs/WboUhagvat752138490.php,degree report develop benefits job self industry degree skills engineer required interface growth process strong job resume report process contribute job multiple initiative customer permanent growth responsibilities start passion starter develop start growth team skills people dynamic part-time people multiple contribute job multiple starter multitask initiative part-time starter opening
http,{L2N4-Q6DX78EH-6673CSUI},10/25/2010 18:20:09,AKR0057,PC-2879,http://careerbuilder.com/WboUhagvat660170997.htm,resume sales required resume strong guidance responsibilities multitask permanent platform salary guidance multiple interface resume multiple initiative team interface starter permanent responsibilities process resume sales years self on-line interface years dynamic technologies report management permanent responsibilities resume strong responsibilities industry degree benefits resume equivalent benefits on-line
http,{N2G5-E6AI42VU-5007QIPD},10/25/2010 18:44:27,AKR0057,PC-2879,http://lockheedmartin.com/WboUhagvat1636367808.htm,degree permanent job compensation experience multiple management equivalent on-time experience experience dynamic required years concepts experience passion interface contribute visual interface dynamic report degree resume skills resume platform skills resume engineer sales people expert growth
http,{P9V6-R1RG33LX-0526TERE},10/25/2010 18:47:58,AKR0057,PC-2879,http://linkedin.com/WboUhagvat1479839504.aspx,required platform industry contribute platform passion skills part-time opening platform opening analyze initiative degree experience on-time process responsibilities analyze strong self start years experience engineer benefits team multitask dynamic dynamic management process experience resume technologies strong visual customer resume
http,{C8Q8-O2MC34DN-2198LJLW},10/26/2010 08:13:27,AKR0057,PC-2879,http://indeed.com/WboUhagvat1680703797.html,hours degree years dynamic years platform compensation concepts technologies concepts responsibilities opening analyze skills years responsibilities team industry job initiative contribute recruiter resume experience required
http,{C5Z3-L6GE55KF-0676MAQE},10/26/2010 08:35:06,AKR0057,PC-2879,http://aol.com/jobs/WboUhagvat1963819229.jsp,sales start opening expert permanent develop concepts multitask multiple engineer contribute multiple team years responsibilities dynamic dynamic contribute multiple passion people degree growth years recruiter recruiter report sales opening customer industry years technologies start equivalent growth skills responsibilities skills growth dynamic required multitask visual resume management opening interface
http,{E2M1-G4TQ09BK-8774DBEN},10/26/2010 09:11:13,AKR0057,PC-2879,http://craigslist.org/WboUhagvat1105403916.aspx,required skills starter management industry passion required contribute degree initiative develop starter skills expert starter multitask hours on-line expert multitask required responsibilities experience sales sales interface guidance team technologies starter initiative passion platform interface multitask degree experience passion resume industry required expert experience degree resume team benefits contribute industry technologies call concepts hours opening
http,{J8I8-S4PA14RK-3483ENSM},10/26/2010 09:22:23,AKR0057,PC-2879,http://job-hunt.org/WboUhagvat919122234.html,passion customer growth salary customer responsibilities develop concepts job platform resume multiple strong develop starter interface permanent on-time industry multiple starter resume contribute skills degree years experience on-line contribute hours multiple contribute report passion interface customer strong industry dynamic responsibilities industry concepts compensation initiative multitask salary technologies concepts required
http,{H1D7-V4UG52OH-7236GYSK},10/26/2010 09:55:34,AKR0057,PC-2879,http://raytheon.com/WboUhagvat343187784.jsp,platform sales experience growth required expert team technologies on-time resume concepts resume job hours multiple multiple on-line opening passion on-line experience starter passion interface management develop technologies customer required analyze management management permanent part-time customer report hours permanent strong
http,{E0E7-A4SR42MO-9822NNAU},10/26/2010 09:57:47,AKR0057,PC-2879,http://indeed.com/WboUhagvat1680703797.html,self part-time report team compensation multitask responsibilities relocation industry team permanent on-time hours technologies industry recruiter technologies people technologies relocation responsibilities multitask skills multitask multiple customer expert guidance benefits part-time multiple team responsibilities on-time years develop required degree benefits people recruiter part-time job experience customer expert call customer guidance opening sales resume multiple multitask industry industry multitask interface
http,{E4L9-F1XD17BS-3929EMXF},10/26/2010 14:52:50,AKR0057,PC-2879,http://harris.com/WboUhagvat1919385663.htm,hours concepts dynamic passion analyze compensation growth team compensation multitask customer customer multitask passion interface customer experience concepts initiative compensation expert self years benefits contribute passion resume responsibilities interface strong responsibilities equivalent experience multiple equivalent contribute platform start starter expert process passion customer
http,{L3D4-P9EA35LY-0609RGCQ},10/26/2010 15:47:54,AKR0057,PC-2879,http://harris.com/WboUhagvat1919385663.htm,develop report required contribute years industry start dynamic degree management concepts starter experience experience on-line skills multiple dynamic years report part-time responsibilities platform interface interface sales responsibilities required dynamic sales part-time years equivalent starter people team benefits technologies expert degree skills customer responsibilities responsibilities customer years customer years report opening responsibilities guidance process opening multiple experience customer benefits multitask expert contribute required responsibilities degree expert required customer on-time resume contribute
http,{F9T8-J0DD39PC-3835EMBF},10/27/2010 11:00:38,AKR0057,PC-2879,http://craigslist.org/WboUhagvat1105403916.aspx,degree passion people required team degree contribute resume permanent start experience multitask required report customer on-line salary years develop platform degree opening skills contribute opening interface concepts platform sales multitask multiple degree passion skills concepts management on-line degree guidance multiple contribute salary self initiative start develop process initiative analyze contribute responsibilities multitask process passion hours
http,{B3F4-T2RG55MN-8084QBYP},10/28/2010 09:47:48,AKR0057,PC-2879,http://aol.com/jobs/WboUhagvat1963819229.jsp,years start report years platform concepts opening dynamic customer develop equivalent expert experience equivalent strong customer report job team on-time industry benefits process job salary industry years resume team contribute people job salary responsibilities customer team multiple multitask multitask process resume job industry team management job benefits years team sales strong passion experience compensation permanent job contribute self growth contribute skills experience permanent start
http,{R3M0-J0YI95QT-6482QVKG},10/28/2010 13:15:44,AKR0057,PC-2879,http://aol.com/jobs/WboUhagvat1963819229.jsp,benefits industry expert skills skills guidance contribute start customer team people relocation contribute hours sales passion report salary permanent industry self degree permanent technologies engineer team report years guidance people required job technologies permanent interface expert strong dynamic
http,{U9C3-R5QF83QY-9305WAAQ},10/28/2010 15:06:00,AKR0057,PC-2879,http://monster.com/WboUhagvat1180707852.html,start multitask sales resume responsibilities start compensation analyze job multiple interface initiative salary opening initiative skills start dynamic dynamic initiative years required opening interface equivalent part-time multiple concepts degree years skills permanent guidance contribute degree strong expert visual visual expert team strong multitask strong dynamic technologies management years on-time passion technologies customer customer concepts technologies resume
http,{O2V6-A0CV60HA-4063WFFO},10/28/2010 18:47:04,AKR0057,PC-2879,http://aol.com/jobs/WboUhagvat1963819229.jsp,customer people permanent opening skills strong permanent resume team concepts multiple equivalent develop contribute concepts dynamic interface initiative required sales resume sales experience multitask people report degree responsibilities passion strong salary job experience years passion platform develop skills growth responsibilities responsibilities years years equivalent passion opening technologies multitask interface initiative management
http,{U4P8-B8LH29IY-9326KDBA},10/29/2010 10:57:21,AKR0057,PC-2879,http://simplyhired.com/WboUhagvat57469130.jsp,sales platform responsibilities customer skills job start resume equivalent passion responsibilities industry years skills experience industry required engineer sales skills customer technologies multiple concepts report team skills multiple responsibilities growth opening engineer starter team required
http,{C6A3-G4SI59KP-9856NJSM},10/29/2010 13:54:20,AKR0057,PC-2879,http://harris.com/WboUhagvat1919385663.htm,degree benefits self interface benefits equivalent concepts start self team analyze management responsibilities process develop sales guidance call resume degree benefits initiative skills guidance multitask dynamic sales degree industry strong experience self develop start strong sales initiative concepts sales analyze degree multiple years experience multiple industry
http,{N0E4-X6QB33AP-0649XDNL},10/29/2010 14:16:28,AKR0057,PC-2879,http://linkedin.com/WboUhagvat1479839504.aspx,degree technologies responsibilities salary start technologies on-line customer benefits benefits industry dynamic experience opening job people technologies interface equivalent sales start technologies permanent on-time team industry resume growth multiple sales contribute part-time responsibilities strong technologies management develop develop skills sales multitask initiative hours concepts experience platform required concepts required report years degree degree visual experience develop contribute dynamic resume equivalent opening team
http,{L3W1-C1PW16JY-2106DQMQ},10/29/2010 15:03:31,AKR0057,PC-2879,http://linkedin.com/WboUhagvat1479839504.aspx,benefits job degree on-time multitask interface initiative growth benefits sales expert on-time on-line starter expert people develop years permanent customer contribute growth management equivalent job degree engineer develop interface call growth resume technologies skills required initiative people develop experience people growth start platform equivalent on-time report skills customer part-time team
http,{R7V5-D5HJ12XU-1872ODEK},10/29/2010 16:02:52,AKR0057,PC-2879,http://job-hunt.org/WboUhagvat919122234.html,equivalent team skills expert responsibilities customer on-time customer multiple on-time contribute years customer concepts sales responsibilities guidance multiple guidance strong guidance experience opening concepts develop multitask team skills passion process on-line multitask resume contribute industry job develop hours skills industry benefits resume
http,{Z1X5-K5AL13AV-0963GKIZ},10/29/2010 16:09:19,AKR0057,PC-2879,http://lockheedmartin.com/WboUhagvat1636367808.htm,customer equivalent report concepts customer required recruiter platform people hours salary responsibilities strong customer concepts multiple team passion initiative process degree benefits permanent platform equivalent responsibilities technologies dynamic initiative sales initiative multiple industry years starter responsibilities develop initiative experience team years degree management degree
http,{G9O7-I5RS54NQ-5334AWYX},10/29/2010 17:38:04,AKR0057,PC-2879,http://monster.com/WboUhagvat1180707852.html,process multiple benefits industry responsibilities sales required multiple develop customer responsibilities dynamic skills report concepts interface management start on-time sales start sales process on-time passion multiple self growth industry required multiple required benefits years hours strong growth starter job growth initiative equivalent people salary multitask benefits experience equivalent concepts develop team multitask skills multiple
http,{B7O8-V6AI43LO-4471LGZL},10/29/2010 18:33:21,AKR0057,PC-2879,http://yahoo.com/hotjobs/WboUhagvat752138490.php,permanent process multiple experience dynamic growth degree degree start report industry experience years required multiple platform multitask experience multitask sales develop initiative team equivalent required degree opening process passion benefits sales multiple job industry guidance multiple years analyze degree skills resume initiative skills sales interface industry
http,{P3B2-M3TS47DH-0912RTOU},11/01/2010 08:08:47,AKR0057,PC-2879,http://aol.com/jobs/WboUhagvat1963819229.jsp,starter guidance dynamic dynamic expert strong interface growth analyze develop required equivalent sales equivalent multiple salary engineer management permanent hours team start concepts interface multiple experience opening multitask resume job start compensation contribute industry management years strong job team report
email,{W1G9-R2ZJ71RQ-0299TRWE},11/01/2010 09:01:58,AKR0057,PC-2879,Adrienne-Osborne@boeing.com,Aurora.Katell.Rhodes@dtaa.com,,Aurora.Katell.Rhodes@dtaa.com,21230,0,degree people compensation experience experience dynamic experience recruiter experience contribute sales sales contribute sales experience opening equivalent resume contribute develop salary strong responsibilities customer resume industry strong opening strong growth degree degree experience management team required self develop initiative passion hours skills opening technologies responsibilities degree
http,{M1C7-N5GF78PN-5178TMTN},11/01/2010 09:13:20,AKR0057,PC-2879,http://simplyhired.com/WboUhagvat57469130.jsp,strong interface growth permanent dynamic required resume expert compensation sales industry contribute platform interface benefits years platform benefits job industry contribute guidance develop visual required strong visual contribute contribute part-time passion job years report initiative growth on-line job permanent required required responsibilities responsibilities
http,{W5Y6-T3VH17LI-2183FBSO},11/01/2010 09:22:49,AKR0057,PC-2879,http://job-hunt.org/WboUhagvat919122234.html,experience opening compensation years equivalent benefits required responsibilities people compensation concepts management resume platform benefits responsibilities resume job required sales customer start contribute responsibilities contribute technologies required equivalent multiple multitask customer concepts platform resume contribute degree degree job responsibilities technologies concepts technologies people required concepts degree multiple report equivalent multitask
http,{M3P1-P4TI14JU-9030ZFGT},11/01/2010 09:34:55,AKR0057,PC-2879,http://northropgrumman.com/WboUhagvat572113271.aspx,process degree passion team dynamic sales required team start degree multitask contribute industry opening dynamic skills team equivalent management job develop customer develop passion sales skills management dynamic technologies experience strong required multiple industry interface management passion opening years required experience skills contribute required report start skills resume opening part-time experience management concepts skills management industry multitask visual
device,{E0N2-J8VK26RZ-3723LOWQ},11/01/2010 09:39:51,AKR0057,PC-2879,Connect
device,{X8J0-A2QP91PJ-9969WYLS},11/01/2010 09:54:02,AKR0057,PC-2879,Disconnect
device,{G8G7-V4RC46RE-9213ZASS},11/01/2010 11:51:20,AKR0057,PC-2879,Connect
device,{O6S6-U2DP41VG-2854FAON},11/01/2010 12:11:28,AKR0057,PC-2879,Disconnect
device,{I0V1-B7RS14CL-4769WAOS},11/01/2010 13:21:12,AKR0057,PC-2879,Connect
device,{S2V3-P0CI58HR-5929UJME},11/01/2010 13:30:12,AKR0057,PC-2879,Disconnect
device,{Z6S3-F1TT64SM-5270ZJRU},11/01/2010 14:15:39,AKR0057,PC-2879,Connect
device,{I2E4-U8JR48EP-2837PORB},11/01/2010 14:26:49,AKR0057,PC-2879,Disconnect
device,{S9G6-F2LA07NR-7855XIYV},11/01/2010 15:39:10,AKR0057,PC-2879,Connect
device,{D4R5-O6UA50QS-7188ENQB},11/01/2010 15:45:52,AKR0057,PC-2879,Disconnect
device,{J8D9-X3WE46BR-4690SPYE},11/01/2010 17:18:54,AKR0057,PC-2879,Connect
device,{K4G4-O4SY44FU-8202CBYU},11/01/2010 17:24:18,AKR0057,PC-2879,Disconnect
device,{H6H6-O9RJ14DE-4201ZRDX},11/01/2010 18:16:45,AKR0057,PC-2879,Connect
device,{F2Q6-W3OP39LT-7247PIYS},11/01/2010 18:33:43,AKR0057,PC-2879,Disconnect
device,{S0V8-M0SE16SJ-6982MWWJ},11/11/2010 08:14:39,AKR0057,PC-2879,Connect
device,{S2J3-Y4FT67YA-9180ULGM},11/11/2010 08:27:13,AKR0057,PC-2879,Disconnect
device,{X5U7-R8GE91XA-1389UHYI},11/11/2010 10:21:50,AKR0057,PC-2879,Connect
device,{C0S4-O1VD26GK-3544KAPD},11/11/2010 10:40:00,AKR0057,PC-2879,Disconnect
