http,{G5A2-B4YC37RR-5599TCZY},10/04/2010 08:48:26,AKR0057,PC-2879,http://jobhuntersbible.com/WboUhagvat1258877042.aspx,initiative sales industry start concepts guidance resume permanent develop analyze relocation job responsibilities equivalent team hours people develop dynamic interface start contribute industry technologies people industry strong hours strong strong visual growth degree expert sales dynamic required required technologies degree multitask expert dynamic resume interface sales concepts dynamic
http,{K9Z1-A6JS66EC-9570HHDM},10/04/2010 09:45:51,AKR0057,PC-2879,http://harris.com/WboUhagvat1919385663.htm,people multitask responsibilities start part-time start multitask technologies experience management customer contribute concepts industry team sales job growth degree hours sales strong years industry on-time multiple management permanent visual benefits job years required concepts multitask permanent management permanent develop resume people dynamic strong permanent team
http,{Q1C1-T6SA13SL-8158BMXF},10/04/2010 09:51:40,AKR0057,PC-2879,http://monster.com/WboUhagvat1180707852.html,responsibilities responsibilities experience contribute start skills management contribute required expert degree dynamic people interface sales management growth customer guidance start initiative self equivalent interface degree platform required experience benefits job responsibilities concepts permanent hours responsibilities concepts job responsibilities technologies salary customer
http,{D8P3-F0NL39QN-8813KGSL},10/04/2010 18:17:31,AKR0057,PC-2879,http://boeing.com/WboUhagvat1904327536.htm,management years salary guidance passion required concepts report people sales hours customer dynamic interface process required resume concepts skills develop benefits report analyze contribute responsibilities sales growth management management process contribute engineer initiative report engineer on-time on-time skills skills required experience on-line customer equivalent permanent develop customer experience technologies compensation multiple people technologies on-time degree growth concepts industry multitask years skills
http,{N4L0-K3CJ35XG-5446REOY},10/05/2010 09:09:11,AKR0057,PC-2879,http://monster.com/WboUhagvat1180707852.html,report equivalent on-time platform people degree hours experience strong concepts customer passion passion sales interface multiple opening develop interface resume initiative report job experience resume hours skills technologies job skills years required dynamic report years platform sales concepts process interface passion years dynamic multitask experience strong interface contribute job strong multitask compensation required equivalent degree initiative management sales
http,{N2S3-J0EX85UN-3706OQMR},10/05/2010 09:24:56,AKR0057,PC-2879,http://raytheon.com/WboUhagvat343187784.jsp,analyze required develop passion guidance platform report years required permanent industry equivalent contribute part-time process platform hours sales multiple sales years industry sales responsibilities growth interface analyze experience interface analyze skills report part-time multiple multiple experience resume opening responsibilities concepts job multiple degree
http,{P4D6-A7PA79SG-6738SRYK},10/05/2010 09:29:51,AKR0057,PC-2879,http://lockheedmartin.com/WboUhagvat1636367808.htm,multitask analyze experience team hours sales equivalent platform responsibilities hours resume guidance experience years team visual on-time develop self sales responsibilities required equivalent benefits start required compensation experience develop expert resume dynamic industry years responsibilities resume customer
http,{G5Q3-H6DN01MV-6395FWMX},10/05/2010 10:08:52,AKR0057,PC-2879,http://craigslist.org/WboUhagvat1105403916.aspx,skills expert develop experience years analyze contribute team analyze dynamic expert experience recruiter job customer equivalent part-time technologies opening compensation job management skills skills strong start guidance multitask develop multitask skills opening compensation equivalent industry industry start initiative benefits multiple skills concepts customer job growth dynamic visual opening people resume growth multitask analyze experience resume required analyze technologies experience resume part-time start responsibilities benefits required industry strong opening analyze develop team initiative management
http,{I3T0-C4EB22UR-6265TUNB},10/05/2010 10:14:41,AKR0057,PC-2879,http://lockheedmartin.com/WboUhagvat1636367808.htm,dynamic starter skills required experience on-time strong experience degree on-time degree required visual start benefits platform degree engineer skills technologies process concepts years initiative degree salary visual analyze required customer benefits guidance growth report contribute responsibilities required passion passion equivalent dynamic degree on-time start growth management on-line equivalent equivalent
http,{E8A8-C4TW40TE-1879HMHS},10/05/2010 12:43:53,AKR0057,PC-2879,http://indeed.com/WboUhagvat1680703797.html,concepts sales opening experience resume customer opening degree resume multiple management on-line dynamic compensation growth technologies interface people sales team concepts
http,{B8L4-H0RT64VY-3912UFIB},10/06/2010 11:17:40,AKR0057,PC-2879,http://monster.com/WboUhagvat1180707852.html,customer technologies part-time skills management responsibilities multiple compensation required experience platform start contribute initiative part-time analyze develop develop skills develop contribute starter degree concepts skills required experience years technologies passion years on-time customer growth team passion contribute analyze team multitask equivalent years multitask analyze multitask interface compensation initiative sales benefits platform passion technologies team process required multitask resume skills experience equivalent analyze multitask multitask process industry
http,{I5K3-N4GL36VJ-6564ZOMI},10/06/2010 14:03:48,AKR0057,PC-2879,http://linkedin.com/WboUhagvat1479839504.aspx,permanent permanent skills equivalent resume equivalent job expert industry opening expert team multitask platform technologies management part-time passion technologies customer dynamic people team report strong on-time part-time start start resume opening visual resume platform analyze experience benefits job analyze years on-time industry permanent years skills
http,{O9X3-H5RQ99YW-1729HMAH},10/06/2010 14:13:30,AKR0057,PC-2879,http://aol.com/jobs/WboUhagvat1963819229.jsp,equivalent start start part-time resume industry report analyze years equivalent skills benefits passion report report experience team management equivalent required start relocation initiative degree start experience growth salary strong develop contribute multitask management sales multitask analyze starter multitask team compensation guidance
http,{T0J4-Y4GE15FR-5526VZFJ},10/06/2010 14:37:27,AKR0057,PC-2879,http://yahoo.com/hotjobs/WboUhagvat752138490.php,salary resume customer multitask develop management opening guidance team start sales platform strong passion interface multiple interface team people skills degree technologies contribute customer strong experience compensation responsibilities contribute dynamic skills recruiter strong experience on-time skills process responsibilities team experience interface skills develop job initiative skills multitask management
http,{J7A3-H8JL21JZ-1449VVBL},10/06/2010 16:00:32,AKR0057,PC-2879,http://careerbuilder.com/WboUhagvat660170997.htm,process process benefits job experience industry resume initiative relocation growth customer sales multiple degree equivalent resume develop degree experience team resume experience concepts required opening resume responsibilities strong report equivalent visual on-time degree self growth required initiative responsibilities management team customer degree engineer strong team degree
http,{J8P8-F1YG24CH-1238HDSY},10/06/2010 16:40:48,AKR0057,PC-2879,http://raytheon.com/WboUhagvat343187784.jsp,technologies compensation self expert starter equivalent passion resume strong strong years contribute benefits skills develop salary people on-time benefits skills part-time job expert growth equivalent passion technologies compensation sales growth equivalent passion degree required years process sales team contribute multitask process years resume benefits interface skills job benefits report expert technologies job analyze permanent part-time resume
http,{X1Y3-M0TI40UX-0696DYWY},10/06/2010 17:49:33,AKR0057,PC-2879,http://lockheedmartin.com/WboUhagvat1636367808.htm,develop management job customer sales multiple analyze growth initiative skills sales concepts skills management industry required customer dynamic required multitask people self experience customer experience expert benefits years contribute self initiative customer relocation strong industry required call guidance skills management guidance start years guidance platform contribute dynamic degree resume customer dynamic people develop skills
http,{E4T7-I9TO13CO-3477YAHG},10/06/2010 18:44:57,AKR0057,PC-2879,http://careerbuilder.com/WboUhagvat660170997.htm,on-line industry permanent concepts initiative customer report contribute management interface degree multitask customer report analyze benefits benefits opening job management concepts experience degree multitask opening people start on-line technologies develop multitask degree platform skills on-time passion industry responsibilities customer sales job initiative self concepts interface start process team expert people years technologies skills guidance passion develop report technologies resume
email,{O5J6-M8HX99FV-0149IRKY},10/07/2010 09:10:24,AKR0057,PC-2879,Adrienne-Osborne@boeing.com,,Aurora.Katell.Rhodes@dtaa.com,Aurora.Katell.Rhodes@dtaa.com,32547,0,hours part-time technologies multiple interface years multiple multitask job resume resume multiple dynamic salary skills job salary resume guidance platform technologies job opening part-time benefits multitask years platform on-time initiative industry sales years job resume contribute equivalent dynamic compensation multiple
http,{D6Q6-W7MQ03HJ-1122RRTO},10/07/2010 12:41:32,AKR0057,PC-2879,http://simplyhired.com/WboUhagvat57469130.jsp,industry experience multitask develop technologies team permanent multiple growth start multiple experience permanent report process equivalent growth initiative recruiter concepts skills analyze job start team equivalent skills industry required job passion develop required required report report management job benefits skills equivalent customer contribute management analyze
http,{Y4L1-W7NC99DV-1702ZPNB},10/07/2010 13:25:13,AKR0057,PC-2879,http://yahoo.com/hotjobs/WboUhagvat752138490.php,skills equivalent opening sales multiple job dynamic dynamic dynamic part-time interface salary guidance multiple experience management equivalent compensation equivalent opening responsibilities people engineer platform years customer on-time sales required responsibilities years customer interface job hours experience sales experience develop guidance platform job resume responsibilities equivalent customer on-time years recruiter passion initiative customer guidance
http,{Y0F9-C3MI24UB-4701SZEL},10/07/2010 13:47:29,AKR0057,PC-2879,http://yahoo.com/hotjobs/WboUhagvat752138490.php,management analyze degree resume degree required technologies starter job degree experience technologies platform permanent concepts platform responsibilities multiple growth degree call multitask concepts dynamic team engineer concepts starter multitask equivalent experience dynamic relocation experience report passion people required report contribute required growth self resume benefits required required
http,{P3Y3-Z6HC48MG-7060JGSZ},10/07/2010 15:54:06,AKR0057,PC-2879,http://job-hunt.org/WboUhagvat919122234.html,dynamic skills starter dynamic skills job develop interface growth multitask opening required guidance degree years resume responsibilities dynamic report degree job platform salary contribute permanent team sales team years equivalent salary platform responsibilities experience benefits customer interface visual degree years resume opening start self resume years required passion
http,{T5V5-E5PF47BK-2442VJKV},10/07/2010 17:15:25,AKR0057,PC-2879,http://linkedin.com/WboUhagvat1479839504.aspx,develop experience customer initiative team passion management industry degree equivalent resume required guidance equivalent interface interface growth people resume platform team dynamic industry benefits multitask salary opening benefits experience required responsibilities contribute part-time initiative develop part-time equivalent guidance permanent skills contribute benefits report opening compensation team industry team multiple part-time concepts
http,{H1Z3-J0DN42JB-7531OTYV},10/07/2010 17:48:10,AKR0057,PC-2879,http://careerbuilder.com/WboUhagvat660170997.htm,experience report management start experience multitask management management concepts multitask management benefits technologies on-time equivalent industry develop interface multitask develop concepts recruiter report passion job technologies people multitask strong management skills benefits permanent starter salary responsibilities resume concepts contribute permanent equivalent develop compensation resume job equivalent
http,{G5P2-C6PK81GN-4328VFSJ},10/07/2010 18:04:45,AKR0057,PC-2879,http://job-hunt.org/WboUhagvat919122234.html,multiple initiative report engineer required management required degree contribute years on-line growth team sales start contribute call report visual resume on-time start required multitask technologies develop management platform dynamic management equivalent years opening people sales contribute multitask skills
http,{E3U1-Q3QY95KD-4376BMTK},10/08/2010 13:07:31,AKR0057,PC-2879,http://hp.com/WboUhagvat1944152218.jsp,required equivalent required on-time technologies growth on-time skills equivalent resume passion develop platform on-time permanent experience contribute sales salary industry sales develop sales hours multiple responsibilities industry platform responsibilities compensation develop visual expert salary concepts technologies concepts contribute industry contribute develop team strong opening
http,{F1F7-R1HU05VV-3230YSSQ},10/08/2010 13:58:36,AKR0057,PC-2879,http://linkedin.com/WboUhagvat1479839504.aspx,sales equivalent dynamic team team skills years team experience multitask years interface skills required sales dynamic platform technologies skills skills multiple part-time management team contribute technologies start team benefits technologies permanent multiple experience required opening contribute part-time multitask resume required people resume resume multitask people dynamic team resume team industry permanent sales equivalent engineer salary sales equivalent skills passion skills multiple years dynamic benefits responsibilities skills hours compensation growth growth platform multitask permanent dynamic start part-time report growth
http,{X0B9-R8ZZ69WZ-6507LYZK},10/08/2010 14:27:48,AKR0057,PC-2879,http://lockheedmartin.com/WboUhagvat1636367808.htm,degree self required growth equivalent resume growth part-time growth part-time concepts technologies years salary opening part-time team multiple strong years concepts dynamic develop people multitask job interface analyze resume people responsibilities concepts years team equivalent multitask industry management resume sales equivalent equivalent skills on-time multiple customer multitask resume recruiter management customer starter salary
http,{Y5R6-Y8BI10QD-7207PHTO},10/08/2010 15:52:50,AKR0057,PC-2879,http://harris.com/WboUhagvat1919385663.htm,customer passion report skills permanent management equivalent job permanent concepts strong compensation years management years process strong call sales responsibilities resume develop permanent multitask sales team resume expert opening resume on-time on-line experience expert passion management responsibilities self multiple benefits experience experience required
http,{Z9S3-T8EL81EF-9198CDOK},10/08/2010 17:14:59,AKR0057,PC-2879,http://northropgrumman.com/WboUhagvat572113271.aspx,multiple contribute multiple start visual initiative platform multiple platform required starter concepts team responsibilities required compensation platform interface technologies years multiple develop sales platform sales multiple resume dynamic interface years years initiative equivalent technologies platform expert develop contribute strong visual concepts job relocation multiple people job required
http,{H9N6-K7QR17KC-8659VSKL},10/08/2010 17:24:22,AKR0057,PC-2879,http://simplyhired.com/WboUhagvat57469130.jsp,recruiter process degree concepts self required multitask people customer experience part-time expert resume sales skills growth benefits industry initiative develop job required customer dynamic equivalent guidance dynamic dynamic management passion passion start growth
http,{N0T6-L6DD04WJ-3956IOJZ},10/08/2010 17:27:26,AKR0057,PC-2879,http://monster.com/WboUhagvat1180707852.html,equivalent industry years experience platform equivalent customer self years contribute skills degree sales industry multitask resume interface technologies guidance industry multitask opening contribute industry process resume technologies team dynamic customer dynamic platform initiative skills platform required team skills multiple interface equivalent platform industry compensation people benefits industry sales
http,{B6A5-H9WQ01TG-6929TTGI},10/08/2010 18:54:43,AKR0057,PC-2879,http://craigslist.org/WboUhagvat1105403916.aspx,years initiative dynamic skills contribute people permanent strong team process opening sales start skills customer relocation compensation team resume recruiter permanent team strong management skills customer initiative responsibilities equivalent benefits develop hours job job multiple skills process responsibilities skills passion responsibilities on-line responsibilities team benefits years dynamic management platform develop team degree people multiple required
http,{S0K8-Z0PM93XE-8331BXMV},10/11/2010 09:14:42,AKR0057,PC-2879,http://raytheon.com/WboUhagvat343187784.jsp,interface concepts visual degree contribute develop team industry starter degree sales opening dynamic develop process part-time opening dynamic industry on-time develop responsibilities job process skills team multiple multiple multiple start initiative people industry equivalent growth contribute equivalent guidance strong multiple guidance concepts start salary passion skills growth expert sales passion
http,{C9A7-H3XH90JJ-4846UVJL},10/11/2010 09:30:51,AKR0057,PC-2879,http://craigslist.org/WboUhagvat1105403916.aspx,platform strong concepts guidance start experience benefits concepts start degree growth contribute degree report opening platform equivalent benefits recruiter people strong interface management permanent equivalent process initiative growth on-time contribute engineer experience benefits customer growth sales develop customer develop strong expert opening multiple resume dynamic required interface management required team
http,{E0Q7-S5HV75RG-2658QBSP},10/11/2010 11:23:56,AKR0057,PC-2879,http://careerbuilder.com/WboUhagvat660170997.htm,degree sales start hours management technologies responsibilities responsibilities skills skills responsibilities growth process starter guidance experience resume interface call concepts experience starter interface required growth multiple job visual contribute people years dynamic degree experience responsibilities required skills guidance strong required dynamic skills guidance responsibilities skills required job experience part-time resume concepts sales analyze skills resume
http,{M9A7-T3ZM96DL-8909GOMR},10/11/2010 13:50:20,AKR0057,PC-2879,http://harris.com/WboUhagvat1919385663.htm,on-line multiple people initiative multiple customer permanent resume analyze sales expert passion analyze benefits experience expert skills job years multiple self opening skills equivalent benefits salary interface self job growth analyze start expert required people industry opening concepts required management industry passion experience permanent analyze multitask call analyze self process visual equivalent multitask growth concepts interface develop equivalent
http,{T7T5-V5XF72NZ-8287WPXR},10/11/2010 16:48:32,AKR0057,PC-2879,http://aol.com/jobs/WboUhagvat1963819229.jsp,growth team contribute expert required required process resume develop job call technologies degree multitask skills multitask resume responsibilities opening hours permanent passion management benefits required dynamic initiative expert interface opening passion permanent sales starter growth report responsibilities permanent customer team multitask skills concepts job strong industry contribute call technologies responsibilities salary multiple strong concepts expert strong permanent benefits resume required industry years people years permanent required years multitask management responsibilities job on-time degree
http,{D2N4-Z6OU51LL-2213CAWY},10/11/2010 18:02:37,AKR0057,PC-2879,http://yahoo.com/hotjobs/WboUhagvat752138490.php,required on-time equivalent contribute experience industry process responsibilities customer initiative engineer degree expert process start on-time multitask equivalent job dynamic growth initiative job on-time multiple permanent team degree initiative initiative management passion hours on-time equivalent develop team permanent degree job benefits equivalent process process resume team sales engineer sales job customer
http,{K4T8-Q4NL00CG-5892VPBI},10/12/2010 09:33:59,AKR0057,PC-2879,http://lockheedmartin.com/WboUhagvat1636367808.htm,skills years self growth job opening degree develop responsibilities skills degree guidance sales opening engineer growth skills concepts expert job customer multitask industry resume management years team multitask industry contribute industry visual passion job multitask degree management multitask concepts develop years job degree team skills equivalent resume responsibilities team responsibilities interface
http,{X0I9-L0AH47MD-4519OBQW},10/12/2010 10:48:28,AKR0057,PC-2879,http://hp.com/WboUhagvat1944152218.jsp,strong team analyze technologies job part-time required experience experience experience responsibilities guidance passion expert industry people team degree analyze equivalent passion interface resume customer job strong part-time customer equivalent start multiple guidance resume dynamic multiple job required guidance platform process
http,{O4O4-P2AZ52RP-3952FBOU},10/12/2010 15:21:19,AKR0057,PC-2879,http://job-hunt.org/WboUhagvat919122234.html,technologies contribute job hours concepts strong process report responsibilities skills technologies self hours process initiative team skills degree multitask report start sales industry growth contribute permanent experience responsibilities industry job equivalent team skills report growth develop
email,{D7W8-L9ZZ14QG-5418JKIH},10/12/2010 16:42:31,AKR0057,PC-2879,Adrienne-Osborne@boeing.com,,Aurora.Katell.Rhodes@dtaa.com,Aurora.Katell.Rhodes@dtaa.com,25610,0,sales resume required concepts on-line multiple job sales call platform growth team dynamic develop skills permanent years develop multiple management resume management years skills experience benefits growth degree part-time concepts benefits
http,{W3R3-T8CU71RR-5624BMRG},10/12/2010 17:09:16,AKR0057,PC-2879,http://boeing.com/WboUhagvat1904327536.htm,job hours management report contribute degree growth multitask permanent develop analyze benefits opening visual self required start visual hours management develop skills initiative initiative analyze multiple multitask start initiative contribute opening multiple compensation on-time growth expert responsibilities multiple management sales experience customer hours skills relocation industry interface responsibilities sales technologies platform equivalent opening skills platform sales people technologies on-time platform contribute passion
email,{J5Y7-U5LO02GP-3545TJKI},10/12/2010 17:42:12,AKR0057,PC-2879,Adrienne-Osborne@boeing.com,Aurora.Katell.Rhodes@dtaa.com,,Aurora.Katell.Rhodes@dtaa.com,32181,1,skills customer growth experience skills required job compensation resume guidance years technologies customer multitask team required equivalent experience customer experience benefits salary multitask guidance job opening interface people expert engineer degree experience concepts customer resume dynamic compensation start visual growth multiple self people sales growth growth sales people growth years dynamic customer strong contribute responsibilities process process on-time compensation
http,{D6Q4-V2MZ19MO-2253PXED},10/12/2010 18:25:46,AKR0057,PC-2879,http://job-hunt.org/WboUhagvat919122234.html,develop initiative required degree equivalent concepts start passion concepts required resume industry contribute platform required team experience multitask equivalent platform skills multitask concepts resume resume visual multitask strong experience multitask responsibilities years skills initiative degree
http,{U9X7-U0ZX12FU-9499YCVL},10/13/2010 08:07:13,AKR0057,PC-2879,http://yahoo.com/hotjobs/WboUhagvat752138490.php,concepts team strong responsibilities starter resume multitask platform opening initiative visual technologies responsibilities part-time permanent growth responsibilities management customer job resume interface skills develop experience team resume multitask multiple on-time passion industry skills skills team management starter degree skills initiative people on-line degree concepts contribute engineer industry
