email,{X2E8-B6IN44LL-8247DOCP},09/13/2010 15:45:07,HXL0968,PC-0623,BLG798@raytheon.com,,,Holly.Xerxes.Lara@dtaa.com,17594,0,on-time process passion sales years platform experience equivalent skills benefits sales develop team resume sales resume customer contribute analyze initiative benefits team growth people hours visual skills sales relocation contribute on-time degree people experience benefits skills required contribute required expert multiple multitask develop skills interface management sales required responsibilities
http,{K0F8-Y3UQ67ZO-8189NEQJ},09/13/2010 16:00:22,HXL0968,PC-0623,http://yahoo.com/hotjobs/WboUhagvat752138490.php,opening degree skills sales team multitask visual equivalent contribute process concepts guidance develop visual dynamic interface degree process sales resume process develop report concepts management on-time benefits equivalent multitask permanent analyze passion team people compensation permanent process benefits strong interface years report experience
http,{C5R0-H2MU21XS-7771WJTZ},09/14/2010 07:06:27,HXL0968,PC-0623,http://aol.com/jobs/WboUhagvat1963819229.jsp,customer technologies industry strong visual management sales contribute analyze on-time permanent opening permanent skills part-time responsibilities passion resume recruiter skills technologies skills sales experience contribute customer analyze customer skills start industry degree report initiative multitask industry customer passion opening engineer passion customer responsibilities strong years concepts multiple interface degree multitask concepts opening responsibilities develop experience platform sales growth opening
http,{N4I8-F8LK52GP-1050ENHE},09/14/2010 07:22:12,HXL0968,PC-0623,http://indeed.com/WboUhagvat1680703797.html,team skills resume responsibilities self people job on-time self multiple years recruiter growth industry management required part-time contribute dynamic required passion technologies relocation dynamic degree experience multiple multiple technologies job platform years initiative people concepts passion responsibilities customer customer multitask visual industry customer experience opening permanent required skills people growth skills on-time customer passion on-time strong guidance customer degree expert
http,{D5L3-F4DX07NC-0623DRKC},09/14/2010 07:42:36,HXL0968,PC-0623,http://linkedin.com/WboUhagvat1479839504.aspx,opening people self years growth job multiple interface starter responsibilities salary visual start resume initiative develop guidance contribute concepts benefits initiative concepts people people start team guidance interface develop experience concepts degree resume skills years salary hours report initiative growth experience experience guidance on-line customer growth resume responsibilities responsibilities customer resume on-time engineer passion recruiter equivalent on-line industry sales customer process guidance experience starter guidance
http,{Q0Y1-F1FZ19WP-3594VICZ},09/14/2010 07:58:03,HXL0968,PC-0623,http://boeing.com/WboUhagvat1904327536.htm,start visual platform dynamic required people degree platform required dynamic customer technologies required concepts interface sales opening process growth strong degree multitask self required years responsibilities years growth contribute skills required years responsibilities on-time relocation part-time resume opening growth experience benefits multitask degree initiative experience skills strong technologies dynamic platform management equivalent required multitask years opening skills multitask degree technologies process interface develop
http,{V2J3-Y2LN98XK-2439PCZE},09/14/2010 08:42:24,HXL0968,PC-0623,http://simplyhired.com/WboUhagvat57469130.jsp,analyze multiple experience permanent dynamic sales permanent on-time report job hours customer benefits benefits permanent resume degree report multitask experience report industry opening opening opening customer skills multitask platform opening strong degree develop job benefits passion resume years contribute initiative develop multitask benefits years dynamic job
http,{R8D4-D1PG16DF-6555UGLU},09/14/2010 09:14:49,HXL0968,PC-0623,http://simplyhired.com/WboUhagvat57469130.jsp,benefits starter customer team platform customer skills opening contribute salary passion benefits customer guidance interface degree skills interface initiative benefits equivalent required expert concepts on-time job resume experience starter multiple self initiative recruiter degree multitask multitask interface develop initiative experience responsibilities report required part-time resume job sales passion analyze concepts
http,{T1E0-Q8JT88TO-7727SKXV},09/14/2010 11:03:38,HXL0968,PC-0623,http://lockheedmartin.com/WboUhagvat1636367808.htm,expert part-time concepts customer report skills team passion strong management develop analyze job platform years hours management technologies platform interface start concepts industry develop industry call recruiter analyze report contribute compensation on-time customer equivalent technologies resume on-time responsibilities multitask skills resume multitask salary on-time years team skills required recruiter job contribute compensation
http,{O6T1-B1TD57JP-0447ZHRV},09/14/2010 13:11:54,HXL0968,PC-0623,http://indeed.com/WboUhagvat1680703797.html,multiple job opening benefits starter analyze platform platform experience start years analyze concepts strong degree multitask visual multitask expert degree self customer growth passion contribute guidance experience opening platform benefits team process
http,{M9N8-Y3TQ94IR-7330LZHO},09/14/2010 15:16:54,HXL0968,PC-0623,http://harris.com/WboUhagvat1919385663.htm,responsibilities years management visual multitask analyze multitask dynamic self degree years degree management salary part-time team initiative strong start industry contribute analyze degree required contribute team interface industry compensation industry technologies years passion required technologies job people initiative multitask contribute resume people dynamic people on-time concepts interface benefits permanent technologies start salary required equivalent
http,{P9J7-K4EV40NH-9535OIXU},09/14/2010 15:29:35,HXL0968,PC-0623,http://jobhuntersbible.com/WboUhagvat1258877042.aspx,compensation required platform concepts customer responsibilities job people growth start engineer team industry experience on-line customer customer starter required people guidance hours people on-line process strong develop platform passion customer analyze strong strong management on-time contribute expert call degree engineer job permanent industry technologies resume skills self dynamic resume opening part-time experience platform team
http,{Z3U4-P5QM24SZ-8408QDFV},09/15/2010 08:08:28,HXL0968,PC-0623,http://harris.com/WboUhagvat1919385663.htm,team platform guidance sales management degree interface team responsibilities process guidance required years required required strong compensation dynamic on-time team industry self people guidance management on-line team platform sales responsibilities experience develop concepts skills management on-time required technologies contribute part-time technologies dynamic resume technologies start multiple passion customer technologies dynamic degree hours develop job start
http,{C0Q0-C2AD42CT-4216HMNC},09/15/2010 13:10:09,HXL0968,PC-0623,http://jobhuntersbible.com/WboUhagvat1258877042.aspx,multiple engineer develop degree resume starter engineer industry permanent process platform resume compensation equivalent process industry resume degree team team required equivalent engineer strong people multitask benefits required people contribute industry initiative start multitask job sales experience expert develop passion industry job opening compensation skills equivalent permanent analyze years years
http,{S9P3-X1MJ94WL-2152ESPE},09/15/2010 13:23:31,HXL0968,PC-0623,http://indeed.com/WboUhagvat1680703797.html,interface customer required experience report platform resume industry strong opening resume experience skills start contribute opening guidance multiple years guidance resume opening permanent equivalent job skills platform equivalent resume report part-time degree recruiter years
http,{U1E6-H9YP82KR-5492ZYPK},09/15/2010 13:34:42,HXL0968,PC-0623,http://craigslist.org/WboUhagvat1105403916.aspx,on-time sales team multiple equivalent start start multitask team technologies management skills benefits degree hours resume start guidance contribute strong platform people develop years technologies self management concepts contribute on-time team develop strong contribute initiative experience customer concepts skills hours guidance engineer technologies platform degree responsibilities on-time experience job initiative interface degree passion concepts multitask skills concepts develop management experience call starter start on-line concepts on-line dynamic equivalent responsibilities sales
http,{J6B0-L5GK04BO-2948IPTG},09/15/2010 14:40:47,HXL0968,PC-0623,http://job-hunt.org/WboUhagvat919122234.html,team experience multiple dynamic experience required expert benefits management sales hours customer customer compensation responsibilities required concepts platform degree multitask develop experience concepts multiple report technologies concepts develop start job hours responsibilities develop management report degree multiple opening benefits recruiter
http,{M1N7-N6JQ76PJ-9469JGDE},09/15/2010 15:33:41,HXL0968,PC-0623,http://hp.com/WboUhagvat1944152218.jsp,team benefits skills multitask opening job equivalent dynamic guidance multiple develop experience expert industry customer equivalent sales strong skills platform passion equivalent industry team responsibilities resume contribute multiple multitask multiple multitask resume technologies years skills self resume people growth benefits platform start multitask strong opening required skills multiple technologies
http,{E2W8-S0PF03SO-8374QYCS},09/15/2010 15:38:09,HXL0968,PC-0623,http://hp.com/WboUhagvat1944152218.jsp,responsibilities guidance experience equivalent multitask develop interface expert on-line platform opening starter on-time platform technologies skills contribute customer start develop years skills concepts analyze strong responsibilities people management expert team concepts management benefits skills industry required people management multiple start strong management initiative team equivalent responsibilities resume sales experience develop opening sales resume
email,{L1J5-X7VK88SA-0646WVQE},09/15/2010 15:52:30,HXL0968,PC-0623,BLG798@raytheon.com,,,Holly.Xerxes.Lara@dtaa.com,15471,1,industry required contribute years equivalent experience resume team relocation passion on-time hours on-time self management equivalent concepts starter responsibilities management benefits concepts opening job platform multiple develop multitask on-time on-time concepts start on-time on-time responsibilities multiple people experience degree industry
http,{M9X3-T5FZ50ZP-1352AOMG},09/16/2010 11:12:01,HXL0968,PC-0623,http://raytheon.com/WboUhagvat343187784.jsp,years benefits degree start resume team report customer experience years permanent skills initiative technologies degree benefits interface equivalent industry visual self report contribute job multitask skills start contribute part-time growth initiative strong responsibilities skills years job guidance customer customer years equivalent
http,{W6I5-I9GR83GN-3657JTSP},09/16/2010 15:16:45,HXL0968,PC-0623,http://job-hunt.org/WboUhagvat919122234.html,dynamic job customer resume part-time initiative interface people analyze multiple customer people multitask start management team responsibilities resume dynamic job contribute growth visual passion report multitask develop guidance people opening compensation start concepts growth strong required salary degree required skills dynamic on-time people visual resume experience contribute required starter salary multitask sales
http,{Z1X2-Y6RI99HZ-8236IEVV},09/16/2010 15:52:46,HXL0968,PC-0623,http://hp.com/WboUhagvat1944152218.jsp,multiple passion management process sales skills resume skills sales engineer responsibilities develop growth concepts required concepts recruiter concepts experience report on-time multitask passion passion required resume interface customer job customer start self degree resume sales multiple team degree multitask job resume contribute equivalent contribute analyze team develop technologies degree multitask management technologies initiative platform years on-time permanent multiple benefits
http,{H6X0-F6EN59YP-1902LBUD},09/17/2010 07:19:18,HXL0968,PC-0623,http://boeing.com/WboUhagvat1904327536.htm,job management relocation multiple experience technologies hours experience platform resume required on-time opening job starter sales equivalent opening contribute analyze concepts contribute multitask years degree recruiter experience guidance concepts team start growth degree expert analyze years report start platform opening customer
http,{S9X7-Z3YC95EX-1010XNCK},09/17/2010 08:27:20,HXL0968,PC-0623,http://careerbuilder.com/WboUhagvat660170997.htm,starter contribute salary platform sales report customer industry required people passion skills sales benefits management opening responsibilities passion management skills growth benefits skills skills report growth degree job sales engineer people experience industry strong analyze degree years required resume experience multiple strong strong skills part-time contribute job concepts degree resume industry skills technologies start industry multitask degree multiple industry concepts part-time growth
http,{U8O5-Z8PK13RV-5715JTDW},09/17/2010 11:05:56,HXL0968,PC-0623,http://monster.com/WboUhagvat1180707852.html,passion platform develop engineer job concepts customer develop equivalent strong years opening self industry people skills process management guidance technologies skills dynamic skills initiative contribute platform skills team engineer customer required starter skills team team opening skills resume dynamic contribute resume job team guidance team dynamic develop salary contribute
http,{Z9Z4-J9IA69BS-5717GBSI},09/17/2010 12:01:30,HXL0968,PC-0623,http://careerbuilder.com/WboUhagvat660170997.htm,team responsibilities customer opening required years starter team team resume benefits report team job required resume visual people compensation degree team on-time equivalent analyze part-time initiative dynamic contribute strong concepts skills resume technologies sales skills passion team industry platform industry responsibilities resume required analyze concepts starter
http,{B1H4-E1HH93YH-7130DLJA},09/17/2010 13:58:23,HXL0968,PC-0623,http://raytheon.com/WboUhagvat343187784.jsp,benefits self expert analyze equivalent responsibilities guidance multitask skills multitask analyze permanent self people expert start dynamic responsibilities job required concepts years platform management degree guidance experience people required salary job multitask required initiative multitask interface degree resume dynamic engineer benefits opening years required
http,{Y8P7-F9AZ94WR-7844MXVY},09/17/2010 14:06:18,HXL0968,PC-0623,http://northropgrumman.com/WboUhagvat572113271.aspx,permanent responsibilities start contribute years process required concepts multiple job responsibilities resume guidance develop process job passion required develop growth compensation dynamic call hours benefits develop salary platform concepts multiple concepts self management responsibilities people call resume hours industry resume skills report develop guidance required passion sales experience develop management people resume develop team report people experience people interface degree
http,{Z2Y6-X2VG63TG-2532ETWM},09/17/2010 15:38:29,HXL0968,PC-0623,http://monster.com/WboUhagvat1180707852.html,equivalent passion degree opening start multiple growth degree platform responsibilities team people growth contribute years experience people dynamic start opening industry dynamic platform team opening contribute self process interface degree guidance opening equivalent job responsibilities report growth process contribute resume skills sales skills experience start multitask responsibilities technologies job sales degree technologies team process experience
http,{Z3R6-Q5GI79VU-8156NIMB},09/17/2010 15:46:49,HXL0968,PC-0623,http://careerbuilder.com/WboUhagvat660170997.htm,people dynamic guidance people job job years degree skills on-time analyze skills technologies required resume job passion management passion strong relocation experience platform report concepts report on-time experience degree management team growth experience passion permanent contribute initiative contribute management part-time initiative self
http,{T7B4-Z3LJ29TN-2910ONHE},09/20/2010 07:27:59,HXL0968,PC-0623,http://job-hunt.org/WboUhagvat919122234.html,resume platform multitask initiative customer contribute salary people expert years opening sales management team multiple report opening resume guidance develop resume multitask start start sales multitask platform opening experience opening strong visual multitask job job platform contribute process concepts growth experience years process platform dynamic dynamic multiple people concepts
email,{Z9O4-U7HU05HS-3071NPPY},09/20/2010 10:29:32,HXL0968,PC-0623,BLG798@raytheon.com,,,Holly.Xerxes.Lara@dtaa.com,22999,0,develop job interface passion passion experience concepts start analyze customer team experience report required platform skills guidance opening resume opening contribute team growth responsibilities visual concepts equivalent job management management opening responsibilities strong experience analyze opening job years skills
http,{X8K7-Q7HM92TQ-2634DYJM},09/20/2010 11:34:02,HXL0968,PC-0623,http://monster.com/WboUhagvat1180707852.html,hours industry customer analyze growth start industry years growth management team responsibilities management technologies dynamic experience concepts degree concepts resume salary benefits hours growth develop people degree develop concepts experience part-time dynamic skills strong guidance process people industry customer management responsibilities visual contribute required benefits report permanent equivalent permanent people
email,{R5H1-P2IL70OQ-7029QZSI},09/20/2010 12:22:29,HXL0968,PC-0623,BLG798@raytheon.com,,,Holly.Xerxes.Lara@dtaa.com,40578,1,visual salary years equivalent growth visual platform sales responsibilities analyze technologies strong experience hours team platform salary start on-time equivalent resume multiple salary customer people passion responsibilities experience resume job job management experience responsibilities team multitask experience permanent benefits dynamic develop customer strong degree degree dynamic permanent
http,{N5Y2-T2HL08MQ-1460AIFO},09/20/2010 12:24:54,HXL0968,PC-0623,http://monster.com/WboUhagvat1180707852.html,process platform industry industry customer technologies experience customer strong multiple develop responsibilities job start interface equivalent multitask required strong develop process platform concepts industry initiative job customer job experience dynamic concepts
http,{G5O5-C8PK85MH-6889DIFL},09/20/2010 14:58:06,HXL0968,PC-0623,http://indeed.com/WboUhagvat1680703797.html,dynamic benefits platform benefits people growth skills industry skills guidance management interface process growth required part-time start dynamic responsibilities years self interface start concepts experience hours team equivalent on-time job develop technologies sales skills sales required experience team multitask team visual
http,{D8Q8-C2IO37CX-7269POYY},09/20/2010 15:12:08,HXL0968,PC-0623,http://linkedin.com/WboUhagvat1479839504.aspx,concepts strong job management strong years technologies technologies multitask concepts concepts sales experience concepts management job required responsibilities team team concepts initiative on-line industry team required customer engineer years required resume on-time sales multitask technologies equivalent contribute industry process opening customer interface job
http,{R1I8-D5SB64OY-7390INDC},09/21/2010 09:29:19,HXL0968,PC-0623,http://northropgrumman.com/WboUhagvat572113271.aspx,people resume team management responsibilities strong years team customer hours benefits team responsibilities equivalent guidance guidance passion strong years experience self customer report team responsibilities starter experience years part-time develop develop resume salary guidance experience compensation starter initiative years degree multiple years team opening initiative equivalent opening salary job customer develop dynamic resume team analyze degree on-time multitask strong multitask management responsibilities responsibilities responsibilities
http,{M5T4-K1VO35ET-1278UVGT},09/21/2010 09:54:01,HXL0968,PC-0623,http://lockheedmartin.com/WboUhagvat1636367808.htm,opening strong years compensation resume guidance skills passion analyze technologies required relocation multiple technologies dynamic dynamic customer compensation call required team start responsibilities skills interface opening multiple dynamic passion growth contribute multitask customer industry dynamic degree start required degree part-time start resume platform sales required growth expert platform resume skills platform equivalent strong team resume
http,{L8P8-V3YF76WT-1982DMKW},09/21/2010 11:49:43,HXL0968,PC-0623,http://simplyhired.com/WboUhagvat57469130.jsp,guidance report start degree process resume interface concepts industry report sales salary permanent sales process team experience guidance contribute years starter years starter opening industry sales dynamic passion resume on-line years required on-time multitask years passion job experience call platform develop growth opening skills people people interface skills opening report develop platform on-time
http,{K7W5-C3JQ00OU-4842ECNK},09/21/2010 13:23:43,HXL0968,PC-0623,http://jobhuntersbible.com/WboUhagvat1258877042.aspx,benefits sales team report resume guidance concepts opening concepts develop guidance management multiple dynamic passion management initiative multitask expert platform industry permanent growth interface required visual skills on-time initiative degree interface team sales concepts concepts contribute team process degree concepts resume team technologies contribute salary resume industry develop compensation job passion
http,{U5M4-O0KF46TS-9978BIBL},09/21/2010 13:36:50,HXL0968,PC-0623,http://jobhuntersbible.com/WboUhagvat1258877042.aspx,interface sales team permanent report people experience customer report concepts visual contribute growth skills management years skills customer guidance industry hours process people years people start develop industry dynamic benefits growth equivalent sales growth required benefits multiple analyze equivalent industry degree compensation initiative opening resume compensation years people engineer experience team guidance platform on-time required required sales
http,{H5H9-R6JD98CW-2484ZBTQ},09/21/2010 13:52:08,HXL0968,PC-0623,http://linkedin.com/WboUhagvat1479839504.aspx,initiative degree responsibilities customer resume experience platform opening passion dynamic degree dynamic technologies report equivalent dynamic experience team opening develop passion experience process dynamic responsibilities responsibilities concepts team opening technologies skills platform years job experience job degree salary job on-line responsibilities on-time management strong required multitask technologies
http,{E5W8-F2GK71MY-7604YLJU},09/21/2010 14:11:01,HXL0968,PC-0623,http://jobhuntersbible.com/WboUhagvat1258877042.aspx,growth hours visual report responsibilities part-time management responsibilities multitask opening multitask develop dynamic guidance starter dynamic interface start on-time job team equivalent multiple team concepts growth customer compensation required degree interface benefits permanent contribute compensation multitask dynamic sales skills multiple responsibilities job salary years team management dynamic people industry required customer benefits develop experience years job contribute report responsibilities process dynamic recruiter
http,{V8G6-I9LX13SD-4457IBRJ},09/21/2010 14:52:23,HXL0968,PC-0623,http://monster.com/WboUhagvat1180707852.html,call management starter multitask initiative on-line experience contribute interface develop years develop benefits required required benefits develop experience on-time multiple years growth develop initiative opening dynamic experience required degree years platform multitask interface people required contribute experience dynamic years team concepts experience
http,{I5W0-E0HX93KA-1788NLJA},09/21/2010 14:53:42,HXL0968,PC-0623,http://jobhuntersbible.com/WboUhagvat1258877042.aspx,required dynamic engineer concepts develop analyze required start growth industry passion degree platform years contribute industry salary industry hours skills salary passion years growth report analyze equivalent degree team permanent equivalent customer develop management report benefits report resume job customer responsibilities
http,{X5J0-E8ZL70FQ-2352FNLY},09/22/2010 07:50:04,HXL0968,PC-0623,http://harris.com/WboUhagvat1919385663.htm,resume opening technologies responsibilities develop multitask dynamic resume report passion equivalent part-time team strong opening self industry resume team years responsibilities interface required report team passion salary required degree technologies resume resume technologies passion sales start guidance passion experience start report multiple process growth self multiple industry experience required report years initiative interface
