http,{M1O3-K8EE49TF-2121RTWY},10/13/2010 08:49:42,AKR0057,PC-2879,http://raytheon.com/WboUhagvat343187784.jsp,expert customer permanent people analyze opening compensation job report start dynamic permanent experience multitask passion degree resume analyze hours resume guidance growth passion permanent resume expert opening visual job industry guidance contribute contribute self responsibilities multitask guidance industry skills required technologies on-time people customer customer process platform guidance years guidance permanent start people hours opening industry equivalent responsibilities interface compensation starter resume responsibilities resume
http,{E5V5-T5MN27UF-7374QDYE},10/13/2010 09:13:09,AKR0057,PC-2879,http://aol.com/jobs/WboUhagvat1963819229.jsp,passion on-time develop multiple technologies skills self technologies develop years team contribute process strong platform experience responsibilities engineer industry equivalent team process multiple develop skills team opening team years degree opening responsibilities management multiple multitask industry dynamic customer multitask
http,{S6F6-Q1NW48ON-0116LJEO},10/13/2010 10:07:15,AKR0057,PC-2879,http://job-hunt.org/WboUhagvat919122234.html,required permanent develop permanent start analyze strong required resume multitask dynamic strong multiple responsibilities opening platform permanent interface growth experience expert dynamic resume develop start growth engineer develop strong opening job management multiple contribute on-line technologies sales years industry self concepts resume initiative contribute passion
http,{K6U4-E9NY94KM-4793TRUK},10/13/2010 13:24:38,AKR0057,PC-2879,http://yahoo.com/hotjobs/WboUhagvat752138490.php,team team degree process growth equivalent engineer skills call team required resume dynamic required guidance growth required customer resume degree resume experience team growth multitask people start skills guidance multiple technologies responsibilities degree required opening engineer required resume responsibilities contribute contribute contribute required develop platform concepts team hours customer multiple customer contribute initiative equivalent people call job skills passion passion hours
http,{O3W5-A2GG67RD-0280SDXJ},10/13/2010 14:27:34,AKR0057,PC-2879,http://harris.com/WboUhagvat1919385663.htm,job experience report degree equivalent resume analyze technologies people interface required platform management passion multiple self degree guidance analyze years dynamic technologies responsibilities industry report engineer platform resume report opening passion multitask resume platform interface initiative experience on-time experience dynamic guidance on-time resume required people skills
http,{X3W9-L5CY01DS-0632MMFY},10/13/2010 14:30:32,AKR0057,PC-2879,http://lockheedmartin.com/WboUhagvat1636367808.htm,skills on-time customer interface sales contribute guidance degree contribute years develop technologies years multitask years experience resume relocation process team technologies people opening opening strong
http,{L9W6-C6EZ53GZ-7822OKBT},10/13/2010 15:59:15,AKR0057,PC-2879,http://northropgrumman.com/WboUhagvat572113271.aspx,degree required analyze industry strong growth self technologies degree job growth report interface people benefits strong on-time opening multiple dynamic dynamic management degree strong degree team benefits required start platform degree contribute experience degree interface responsibilities interface required resume sales report required on-time required concepts years sales passion start job platform industry industry self technologies management dynamic equivalent
http,{T6E6-J5YP24CB-4105UOND},10/13/2010 18:30:29,AKR0057,PC-2879,http://craigslist.org/WboUhagvat1105403916.aspx,guidance multiple develop responsibilities opening interface responsibilities sales equivalent people customer growth part-time customer equivalent degree degree on-time skills analyze multiple team responsibilities opening develop experience initiative hours develop dynamic on-time degree required analyze on-line responsibilities multitask technologies responsibilities
http,{W3J7-U3RC51PW-8800QKNH},10/14/2010 07:57:41,AKR0057,PC-2879,http://careerbuilder.com/WboUhagvat660170997.htm,passion job team concepts multitask benefits technologies process engineer self job industry on-line opening skills report self years resume on-time required responsibilities multiple technologies resume report opening equivalent job develop industry sales part-time growth permanent guidance team degree starter multiple interface years years multitask responsibilities process experience skills interface technologies sales dynamic guidance management responsibilities degree guidance interface dynamic degree resume responsibilities multiple start opening responsibilities degree equivalent
email,{B6Q8-G9DA77WW-4161UDFF},10/15/2010 08:29:11,AKR0057,PC-2879,Adrienne-Osborne@boeing.com,,Aurora.Katell.Rhodes@dtaa.com,Aurora.Katell.Rhodes@dtaa.com,32235,0,required report experience passion equivalent multitask required guidance passion dynamic customer growth contribute skills growth customer industry people team strong salary multitask dynamic team team interface responsibilities develop experience resume management interface start customer years responsibilities experience starter industry management hours contribute resume skills equivalent salary required benefits
email,{R9J6-V8GC73MT-4420PMCR},10/15/2010 09:40:22,AKR0057,PC-2879,Adrienne-Osborne@boeing.com,,Aurora.Katell.Rhodes@dtaa.com,Aurora.Katell.Rhodes@dtaa.com,27309,1,opening start resume multitask industry degree years analyze platform responsibilities strong experience growth develop resume sales strong recruiter people degree process responsibilities contribute team multitask platform years technologies skills industry initiative analyze process contribute self customer develop customer permanent required benefits opening growth start equivalent sales develop multitask concepts multitask develop required dynamic
http,{E0V1-H6UX82ZC-6922BVQD},10/15/2010 13:40:09,AKR0057,PC-2879,http://craigslist.org/WboUhagvat1105403916.aspx,responsibilities interface growth multitask technologies multitask sales responsibilities dynamic process skills process experience experience interface responsibilities expert multitask team team benefits responsibilities equivalent people people passion sales people benefits equivalent strong people guidance people industry opening develop multitask expert technologies on-time compensation team analyze initiative team passion expert years people responsibilities relocation industry contribute report opening initiative customer equivalent people
http,{U2F8-Z6MV86NV-3750IIRZ},10/15/2010 13:45:13,AKR0057,PC-2879,http://yahoo.com/hotjobs/WboUhagvat752138490.php,required equivalent growth management strong growth starter required start years expert years contribute equivalent salary years responsibilities contribute resume required required starter skills degree opening recruiter part-time start passion multitask experience contribute process required team team people contribute customer
http,{D1B6-E1QC53TM-1918LYMA},10/15/2010 14:06:06,AKR0057,PC-2879,http://lockheedmartin.com/WboUhagvat1636367808.htm,multitask concepts industry start salary skills multiple skills expert degree degree platform experience start resume develop permanent benefits resume salary expert on-line experience years management multitask degree management benefits team team permanent contribute permanent multiple interface
http,{K0G1-T0RA61TX-9258WANT},10/15/2010 15:53:48,AKR0057,PC-2879,http://aol.com/jobs/WboUhagvat1963819229.jsp,guidance analyze report passion platform management part-time initiative benefits required experience management industry experience part-time team part-time concepts develop visual contribute job contribute technologies expert strong growth sales on-time degree industry report strong on-time customer passion team team analyze responsibilities sales on-line responsibilities people multitask growth job expert analyze interface compensation expert required resume concepts growth skills skills
http,{O0Z2-P5EB17GW-1178PPWT},10/15/2010 16:32:52,AKR0057,PC-2879,http://monster.com/WboUhagvat1180707852.html,benefits benefits hours engineer report industry people industry multiple resume sales dynamic contribute experience resume resume starter start start interface team years multitask management degree team interface develop responsibilities strong passion degree contribute multitask strong part-time degree responsibilities management industry multiple visual expert required passion resume on-time platform degree develop experience people multiple resume industry visual growth benefits required technologies years report passion
http,{U7A9-R5FP87LI-1212ERGG},10/15/2010 17:04:30,AKR0057,PC-2879,http://harris.com/WboUhagvat1919385663.htm,responsibilities strong sales passion multitask growth report resume multitask people sales benefits required management interface customer management analyze start benefits resume contribute recruiter technologies dynamic interface relocation responsibilities multiple customer customer contribute permanent job industry industry multiple expert develop resume skills multitask expert industry technologies team years job expert degree passion concepts starter multiple resume industry equivalent initiative passion passion report develop required on-line
http,{K2N5-M5ZD91PC-7151AHQF},10/15/2010 17:26:46,AKR0057,PC-2879,http://careerbuilder.com/WboUhagvat660170997.htm,responsibilities degree contribute customer growth guidance multiple management visual contribute self benefits interface team skills guidance growth develop salary skills compensation customer engineer strong concepts degree on-line responsibilities multiple on-time multiple visual experience contribute skills start experience
http,{A3R7-L0XT89JY-9714YQMV},10/15/2010 17:30:14,AKR0057,PC-2879,http://jobhuntersbible.com/WboUhagvat1258877042.aspx,job develop responsibilities compensation years responsibilities team interface equivalent analyze process growth platform experience required dynamic management resume job equivalent degree dynamic resume equivalent responsibilities customer required growth team permanent multitask management multitask dynamic degree degree management responsibilities salary
http,{F6F9-J4UD79OO-5828SXHB},10/15/2010 18:18:03,AKR0057,PC-2879,http://boeing.com/WboUhagvat1904327536.htm,contribute degree multiple technologies benefits on-time customer experience contribute hours passion responsibilities self team platform opening resume process degree experience platform years responsibilities skills passion self passion job experience required growth team hours benefits technologies required years required concepts customer report call multitask self degree experience process
http,{Y0V0-E1OQ53GA-9472SGVC},10/15/2010 18:37:56,AKR0057,PC-2879,http://simplyhired.com/WboUhagvat57469130.jsp,start develop compensation relocation sales sales strong management people platform experience start resume people responsibilities multitask skills job years start benefits on-time team initiative salary management develop job sales interface concepts skills customer self guidance growth skills self initiative skills on-time equivalent expert
http,{H3A0-L9DH87HX-7422TYEX},10/18/2010 08:28:17,AKR0057,PC-2879,http://yahoo.com/hotjobs/WboUhagvat752138490.php,team technologies part-time skills concepts skills people technologies responsibilities equivalent start dynamic initiative multitask degree analyze team team management self equivalent passion required passion resume multitask resume growth skills resume technologies skills sales responsibilities permanent expert start interface people industry skills skills passion interface skills resume passion equivalent team people on-time process resume team contribute
http,{A2O7-J4VN75XG-7120DDPM},10/18/2010 08:41:49,AKR0057,PC-2879,http://simplyhired.com/WboUhagvat57469130.jsp,years years responsibilities initiative interface sales develop skills platform strong required contribute dynamic passion develop technologies process skills resume resume contribute required skills report benefits relocation management people team required dynamic interface team sales opening degree experience interface multiple relocation management interface permanent experience self technologies multitask
http,{D3Z2-X6HZ96NF-1437QZDZ},10/18/2010 08:49:27,AKR0057,PC-2879,http://harris.com/WboUhagvat1919385663.htm,permanent team benefits industry resume growth starter platform management engineer on-time multiple experience technologies concepts dynamic benefits analyze skills industry concepts degree resume call opening benefits call permanent job concepts
http,{Z4U1-V5UH23NI-0360BHNI},10/18/2010 08:57:48,AKR0057,PC-2879,http://careerbuilder.com/WboUhagvat660170997.htm,hours call part-time equivalent skills concepts permanent on-time analyze strong strong experience degree call self required permanent technologies sales industry benefits process team degree opening interface technologies start technologies report responsibilities starter skills skills technologies years benefits degree management start self initiative management initiative strong benefits years experience dynamic initiative job
http,{N2J0-F3GJ38LH-2328TMUH},10/18/2010 09:05:40,AKR0057,PC-2879,http://simplyhired.com/WboUhagvat57469130.jsp,opening responsibilities job years sales growth industry degree concepts strong growth sales multiple years team skills required opening customer resume multiple people concepts resume degree required initiative required opening benefits contribute job degree management passion technologies degree benefits team passion technologies start resume
http,{E2I2-E6SZ50VD-8012IOEK},10/18/2010 09:30:35,AKR0057,PC-2879,http://job-hunt.org/WboUhagvat919122234.html,technologies customer required resume guidance develop team develop permanent multitask interface multiple concepts start skills salary starter benefits responsibilities passion team experience salary multitask permanent team experience resume job dynamic compensation years responsibilities initiative compensation degree job industry resume concepts
email,{B7V0-G9VD00YA-6896MHZI},10/18/2010 14:02:59,AKR0057,PC-2879,Adrienne-Osborne@boeing.com,Aurora.Katell.Rhodes@dtaa.com,,Aurora.Katell.Rhodes@dtaa.com,37743,0,team concepts develop degree technologies customer opening people equivalent growth growth concepts salary growth start interface degree sales passion strong develop experience management years compensation benefits concepts compensation analyze expert analyze sales technologies benefits resume resume equivalent starter concepts initiative sales recruiter
http,{I8Z6-F1XF89BS-0360EWPI},10/18/2010 14:34:00,AKR0057,PC-2879,http://monster.com/WboUhagvat1180707852.html,customer experience customer people technologies skills compensation multitask permanent passion sales multitask management resume dynamic management job industry technologies expert growth sales customer responsibilities opening interface experience multiple multitask growth strong passion required years resume multitask passion strong benefits skills on-line permanent people guidance dynamic contribute customer industry degree skills analyze develop passion initiative growth start responsibilities analyze starter management contribute benefits interface dynamic strong expert self expert compensation degree
http,{N1L2-C4ZV56KD-6011NAIV},10/18/2010 17:29:07,AKR0057,PC-2879,http://monster.com/WboUhagvat1180707852.html,industry experience analyze process required degree experience degree interface multiple contribute growth required resume resume skills permanent permanent guidance start people industry starter degree industry visual platform interface self job report expert years interface concepts
email,{Q9A5-B6AC17SY-4511QRBV},10/18/2010 18:50:37,AKR0057,PC-2879,Adrienne-Osborne@boeing.com,,Aurora.Katell.Rhodes@dtaa.com,Aurora.Katell.Rhodes@dtaa.com,30209,0,experience required passion expert self multitask dynamic years experience years multitask starter report strong platform team sales required starter job job degree report experience experience passion opening customer responsibilities customer degree experience start strong platform multiple experience platform customer required responsibilities years skills responsibilities salary skills people interface contribute guidance
http,{F8C6-B5BD20YY-4592YZFT},10/19/2010 09:01:10,AKR0057,PC-2879,http://yahoo.com/hotjobs/WboUhagvat752138490.php,people develop initiative degree concepts engineer on-time industry on-line industry experience years start multiple responsibilities job years dynamic permanent equivalent management responsibilities technologies responsibilities passion opening concepts platform degree multiple report years analyze skills customer process self technologies required job sales guidance industry
http,{R6T3-A6EP39UI-7414PPWO},10/19/2010 11:48:34,AKR0057,PC-2879,http://northropgrumman.com/WboUhagvat572113271.aspx,contribute skills passion team industry platform opening responsibilities platform industry self engineer develop develop opening on-time on-time visual interface resume initiative opening customer team equivalent benefits degree industry interface
http,{K9T6-W0FS58WV-3588DSUV},10/19/2010 13:32:29,AKR0057,PC-2879,http://monster.com/WboUhagvat1180707852.html,multiple start job resume part-time guidance resume initiative multiple concepts multiple benefits resume contribute responsibilities years benefits customer on-time industry opening self required equivalent multitask initiative passion multitask engineer required responsibilities management management job responsibilities hours required sales sales contribute required required people years degree passion degree platform compensation multitask contribute permanent required growth
http,{P8S1-Y8WJ41CY-1662UNSD},10/19/2010 14:00:42,AKR0057,PC-2879,http://job-hunt.org/WboUhagvat919122234.html,customer process growth job process resume self experience team technologies resume resume team years management job equivalent interface customer hours required contribute multiple expert on-line dynamic resume responsibilities degree skills skills guidance growth concepts people multitask initiative team analyze resume resume degree part-time multiple starter required management team responsibilities customer platform benefits concepts responsibilities guidance
http,{F8B3-W7XA27TT-3416CCXL},10/20/2010 13:22:04,AKR0057,PC-2879,http://linkedin.com/WboUhagvat1479839504.aspx,passion management responsibilities salary on-time guidance years multiple team opening platform call management benefits responsibilities analyze required multiple develop sales analyze skills passion visual strong starter platform sales people experience equivalent industry customer required opening dynamic hours strong responsibilities benefits years industry team engineer concepts guidance benefits strong dynamic concepts people
http,{R3S2-J7AD55KN-7455DVPZ},10/20/2010 17:17:52,AKR0057,PC-2879,http://raytheon.com/WboUhagvat343187784.jsp,team passion start experience multiple job team experience starter responsibilities required contribute dynamic job develop skills analyze experience part-time initiative dynamic starter people platform part-time team analyze degree develop permanent degree opening start platform opening strong team equivalent team multitask resume resume experience dynamic visual resume multitask initiative job years develop platform
http,{M7H2-C4XR17OG-8550OZJR},10/21/2010 10:03:18,AKR0057,PC-2879,http://craigslist.org/WboUhagvat1105403916.aspx,opening multitask multitask salary start job required sales skills multitask multitask team permanent responsibilities part-time technologies responsibilities management degree degree on-time required equivalent visual team contribute dynamic process develop develop multiple interface
http,{K4M4-F2HD60NF-5906HGJW},10/21/2010 13:42:38,AKR0057,PC-2879,http://boeing.com/WboUhagvat1904327536.htm,process multiple process customer process job resume degree start opening dynamic skills resume guidance passion platform multiple people equivalent passion visual contribute expert opening opening passion equivalent strong on-time years compensation guidance contribute contribute starter team degree resume required equivalent equivalent develop dynamic years opening multitask customer growth on-line
http,{I6A9-Q4AU43EO-0194IENO},10/21/2010 14:07:13,AKR0057,PC-2879,http://hp.com/WboUhagvat1944152218.jsp,benefits report contribute guidance on-time dynamic contribute skills start report degree contribute sales concepts visual hours process contribute expert responsibilities experience passion technologies
http,{G7D3-L3EP53LV-0773VBSB},10/21/2010 14:52:46,AKR0057,PC-2879,http://job-hunt.org/WboUhagvat919122234.html,degree contribute develop self on-time people degree technologies responsibilities customer concepts permanent required years multitask part-time skills skills responsibilities develop industry skills technologies engineer opening customer growth people experience experience required self team experience skills hours team skills responsibilities start experience compensation growth benefits compensation sales responsibilities growth equivalent required guidance
http,{F7Z5-Q6VM61CD-8954ZFOH},10/21/2010 15:32:17,AKR0057,PC-2879,http://indeed.com/WboUhagvat1680703797.html,visual contribute visual multiple initiative skills management degree team concepts process permanent compensation develop industry platform industry growth job customer responsibilities process multitask dynamic resume start customer years experience multiple develop experience strong industry guidance passion skills degree multiple customer platform dynamic experience growth skills resume industry hours
http,{Y3O1-B1DR70EJ-3224XSFS},10/21/2010 15:47:17,AKR0057,PC-2879,http://hp.com/WboUhagvat1944152218.jsp,degree develop customer platform multiple technologies platform sales multiple required years opening growth report degree starter start customer develop dynamic multiple strong concepts responsibilities interface dynamic sales job technologies required passion team skills required analyze management multitask team years people industry multiple process technologies
email,{U8Y9-L3DE30BL-4524TDRA},10/21/2010 16:11:58,AKR0057,PC-2879,Adrienne-Osborne@boeing.com,,Aurora.Katell.Rhodes@dtaa.com,Aurora.Katell.Rhodes@dtaa.com,20883,0,team required salary management people job required resume experience required years years contribute required multitask sales benefits strong multiple required develop equivalent experience interface permanent opening responsibilities contribute customer recruiter multiple people technologies report required multiple on-time job job permanent responsibilities degree part-time responsibilities part-time industry concepts required strong job on-line opening analyze resume sales experience report initiative skills start
http,{T7Q7-H5TL68MH-4502FJOB},10/21/2010 18:32:08,AKR0057,PC-2879,http://raytheon.com/WboUhagvat343187784.jsp,management management industry analyze equivalent required contribute dynamic skills skills strong management required guidance customer opening responsibilities responsibilities initiative passion report people starter team required multiple
http,{L1F7-J9WX27IW-9764VVWC},10/22/2010 08:25:12,AKR0057,PC-2879,http://simplyhired.com/WboUhagvat57469130.jsp,management salary permanent interface multitask dynamic on-time people develop start passion team part-time industry multiple on-time dynamic responsibilities interface required interface contribute multitask responsibilities management years contribute report develop guidance resume platform required team management contribute self technologies on-time growth years relocation permanent multitask skills strong team sales platform platform equivalent engineer required sales technologies
email,{B9X7-W2WV42DN-5367MUPI},10/22/2010 08:33:16,AKR0057,PC-2879,Adrienne-Osborne@boeing.com,Aurora.Katell.Rhodes@dtaa.com,,Aurora.Katell.Rhodes@dtaa.com,22276,0,equivalent starter compensation analyze team permanent equivalent dynamic on-time develop platform benefits dynamic analyze opening start multitask strong customer develop job compensation years opening benefits passion develop responsibilities hours skills growth platform skills degree customer strong skills required degree process opening job benefits industry salary on-time team passion experience passion resume industry experience benefits industry degree recruiter strong job concepts multitask
http,{V5K9-Q1DB75IH-1412BGQJ},10/22/2010 09:04:58,AKR0057,PC-2879,http://northropgrumman.com/WboUhagvat572113271.aspx,contribute responsibilities equivalent team multitask interface job process permanent degree strong guidance multitask customer hours passion analyze job skills interface concepts experience benefits multiple contribute expert multiple multiple contribute part-time multitask permanent required team responsibilities multiple resume on-time start multitask guidance strong responsibilities people job responsibilities concepts people resume guidance interface analyze strong visual report visual equivalent multitask
email,{G4M6-U3HV15PR-2907JCOC},10/22/2010 09:20:12,AKR0057,PC-2879,Adrienne-Osborne@boeing.com,,Aurora.Katell.Rhodes@dtaa.com,Aurora.Katell.Rhodes@dtaa.com,56686,0,part-time benefits contribute permanent team skills call platform initiative hours interface sales initiative job resume multiple required management opening analyze
