http,{E9B2-B2HG36NT-2605FSAF},09/22/2010 07:58:37,HXL0968,PC-0623,http://aol.com/jobs/WboUhagvat1963819229.jsp,contribute concepts team multiple job on-time multitask passion sales experience salary opening growth skills multitask resume develop expert years skills expert multitask on-line starter analyze permanent platform contribute expert multitask initiative customer responsibilities initiative on-time skills required degree multiple interface industry customer start multiple compensation passion customer sales opening responsibilities contribute responsibilities
http,{J8O0-B4DB40BK-3314WQVS},09/22/2010 10:36:16,HXL0968,PC-0623,http://lockheedmartin.com/WboUhagvat1636367808.htm,growth team multiple concepts team benefits analyze visual degree visual passion permanent equivalent customer benefits required multiple report responsibilities experience resume experience hours years permanent contribute management dynamic skills relocation responsibilities required concepts starter years permanent on-time initiative starter passion process platform analyze equivalent equivalent self resume equivalent responsibilities platform hours dynamic
http,{Z0F5-K6LY14HG-9738RLPN},09/22/2010 12:34:23,HXL0968,PC-0623,http://careerbuilder.com/WboUhagvat660170997.htm,develop self part-time benefits multitask dynamic platform visual technologies skills salary people years multitask report equivalent management years years job strong degree passion analyze required develop required experience required concepts job concepts guidance on-line interface benefits customer experience resume multiple experience initiative interface
http,{G5E2-R8QW48PK-9729VYBQ},09/22/2010 13:21:17,HXL0968,PC-0623,http://careerbuilder.com/WboUhagvat660170997.htm,strong opening analyze strong multitask guidance years strong permanent platform multiple opening report part-time resume customer self resume customer job degree passion people skills interface strong experience multiple team technologies customer sales process platform customer process process
http,{Q8G9-T5XY24OD-5787SRIX},09/22/2010 13:37:49,HXL0968,PC-0623,http://lockheedmartin.com/WboUhagvat1636367808.htm,responsibilities report experience interface years degree sales customer experience initiative years self required skills multiple initiative equivalent responsibilities expert customer passion benefits skills required dynamic hours industry develop management interface management platform sales permanent responsibilities platform initiative hours people degree analyze team initiative customer develop benefits report equivalent part-time opening develop growth opening growth degree opening degree responsibilities engineer people multiple
http,{L6A3-D9CO99WS-3666JCHF},09/22/2010 14:33:08,HXL0968,PC-0623,http://northropgrumman.com/WboUhagvat572113271.aspx,benefits industry passion compensation permanent multiple responsibilities platform part-time initiative sales call report strong required platform growth degree multitask multiple platform on-time skills growth analyze required concepts opening opening strong expert people degree management skills start job years multitask interface team contribute hours management multiple skills platform customer responsibilities required
http,{B5Q6-V2NE89LA-7669BMCA},09/23/2010 09:04:50,HXL0968,PC-0623,http://job-hunt.org/WboUhagvat919122234.html,benefits customer develop opening passion skills people guidance on-line sales strong responsibilities visual degree concepts compensation develop responsibilities experience sales sales expert team growth interface management job multitask contribute industry management passion skills platform on-time responsibilities multitask compensation expert platform responsibilities team years strong job team report
http,{A6E1-S9LH92CC-7248OPDK},09/23/2010 09:09:37,HXL0968,PC-0623,http://monster.com/WboUhagvat1180707852.html,customer skills initiative strong process develop interface initiative opening part-time contribute self report degree develop platform expert expert industry hours years required customer resume equivalent expert job platform initiative degree passion people dynamic passion experience hours skills passion sales contribute passion sales years experience degree starter passion on-line multiple benefits sales sales growth resume interface platform sales benefits opening report years
http,{A2Y2-X5IP15DA-6698LTGD},09/23/2010 09:34:39,HXL0968,PC-0623,http://jobhuntersbible.com/WboUhagvat1258877042.aspx,job required strong multitask equivalent platform on-time job self technologies develop responsibilities industry skills degree experience people growth resume opening required multitask multitask dynamic years experience engineer platform develop job years technologies benefits technologies start resume years job management resume people industry opening years
http,{M2R5-E5GP83QO-2407PYYJ},09/23/2010 09:45:10,HXL0968,PC-0623,http://job-hunt.org/WboUhagvat919122234.html,required hours resume resume hours expert required expert experience compensation platform job industry responsibilities on-time permanent visual required platform hours multitask strong responsibilities resume develop growth team required analyze platform customer industry resume resume job platform customer dynamic multiple initiative years interface interface salary on-line industry analyze required initiative platform
http,{H2K6-L9HO86RQ-4556BODG},09/23/2010 11:46:24,HXL0968,PC-0623,http://raytheon.com/WboUhagvat343187784.jsp,process experience management required multiple process responsibilities benefits dynamic multitask platform degree team permanent guidance years initiative hours dynamic expert experience dynamic report guidance sales contribute dynamic industry benefits experience strong responsibilities passion platform part-time analyze concepts platform contribute experience people industry benefits growth platform resume contribute customer on-line relocation
http,{J7A0-F8KY00LJ-0224QHZF},09/24/2010 07:44:16,HXL0968,PC-0623,http://jobhuntersbible.com/WboUhagvat1258877042.aspx,guidance experience degree customer technologies sales people self salary people degree sales experience analyze management years resume industry team industry multitask job initiative years job required customer responsibilities guidance initiative multitask degree on-time expert interface resume equivalent required equivalent growth required technologies initiative multitask
http,{C3F4-H4AT64BA-2861MPKS},09/24/2010 07:50:40,HXL0968,PC-0623,http://linkedin.com/WboUhagvat1479839504.aspx,relocation engineer multiple multiple dynamic process skills part-time multiple passion degree management years start initiative dynamic skills platform develop responsibilities job skills contribute skills on-time platform multiple experience on-time strong growth dynamic years customer years team sales develop years passion responsibilities people analyze customer equivalent initiative growth multitask interface on-time industry skills passion starter interface
http,{U3Q9-K2QV42OK-0819BAXV},09/24/2010 07:54:48,HXL0968,PC-0623,http://boeing.com/WboUhagvat1904327536.htm,required technologies on-time concepts contribute multiple management multitask skills platform team multiple compensation develop benefits starter interface part-time years on-line resume equivalent report resume degree initiative sales experience contribute report resume hours report benefits interface part-time people sales experience hours industry team report team salary contribute
http,{F4G9-B4JP35YZ-8789MRWD},09/24/2010 08:20:13,HXL0968,PC-0623,http://raytheon.com/WboUhagvat343187784.jsp,responsibilities strong degree develop passion management technologies equivalent benefits responsibilities report responsibilities multiple job dynamic resume multiple guidance start team analyze expert dynamic passion growth benefits equivalent customer on-time responsibilities required benefits self multitask industry required process equivalent opening sales benefits
http,{R0A6-V3JP20YO-1923VKYA},09/24/2010 11:26:26,HXL0968,PC-0623,http://indeed.com/WboUhagvat1680703797.html,permanent required initiative multiple develop experience skills job salary required start compensation management strong sales platform resume part-time team salary hours multitask platform industry years permanent responsibilities responsibilities dynamic growth concepts sales people expert initiative opening
http,{I9R5-I4OA07EA-4783EYVA},09/24/2010 12:09:48,HXL0968,PC-0623,http://careerbuilder.com/WboUhagvat660170997.htm,experience strong job opening dynamic multiple years job concepts visual interface growth concepts permanent management platform start degree years skills start team degree dynamic call customer industry passion responsibilities team experience dynamic self required concepts on-time technologies concepts on-time initiative job multiple process multiple growth interface multitask resume start dynamic report responsibilities sales expert starter job opening process
http,{R2F3-H4ZX27GT-8074PVIG},09/24/2010 12:12:13,HXL0968,PC-0623,http://harris.com/WboUhagvat1919385663.htm,team develop contribute strong degree start responsibilities benefits job dynamic growth benefits passion industry start platform management required initiative dynamic team job expert degree growth develop industry opening experience contribute salary job resume job starter growth sales opening starter multitask customer passion years compensation interface degree start equivalent responsibilities recruiter industry part-time call start opening management initiative on-time benefits experience customer dynamic resume years
http,{J7J1-U3JH67LT-3326JWBO},09/24/2010 13:07:36,HXL0968,PC-0623,http://indeed.com/WboUhagvat1680703797.html,responsibilities customer required benefits passion initiative relocation skills expert multitask passion responsibilities years concepts passion strong skills platform interface contribute years multiple develop guidance responsibilities technologies degree customer develop interface degree permanent multitask experience visual experience team responsibilities responsibilities
http,{T7U8-Z8WW21LW-8996OWJE},09/24/2010 13:52:20,HXL0968,PC-0623,http://raytheon.com/WboUhagvat343187784.jsp,skills job resume years develop concepts engineer hours responsibilities people required resume sales on-time analyze develop process required industry skills multiple benefits team job engineer permanent experience sales equivalent part-time management opening self recruiter platform engineer compensation engineer multitask required resume visual starter platform job people multiple starter degree skills initiative experience responsibilities multiple concepts develop
http,{M5G0-A2FZ59SN-5139AEOF},09/27/2010 14:46:05,HXL0968,PC-0623,http://monster.com/WboUhagvat1180707852.html,required multiple responsibilities develop degree management growth self resume technologies required equivalent growth platform responsibilities multitask self resume platform skills interface responsibilities contribute contribute growth contribute platform sales on-time technologies expert engineer dynamic analyze job multitask responsibilities resume years initiative guidance multiple resume experience degree
http,{V1P8-Y2WF25FU-9290AVUD},09/28/2010 07:33:10,HXL0968,PC-0623,http://job-hunt.org/WboUhagvat919122234.html,contribute sales customer develop skills equivalent start team years interface platform equivalent passion engineer multiple develop skills part-time required on-time sales experience experience degree benefits resume experience concepts self multiple contribute platform job management degree skills sales passion growth customer
http,{T4N9-D1LF41YX-7683SBNQ},09/28/2010 07:33:22,HXL0968,PC-0623,http://simplyhired.com/WboUhagvat57469130.jsp,strong expert self develop analyze compensation industry team platform engineer responsibilities initiative sales permanent job responsibilities on-time customer report process sales skills multitask visual platform opening responsibilities platform required industry salary people degree team responsibilities years growth sales multitask initiative industry resume technologies management people expert expert years platform contribute visual part-time team
http,{I8N8-F6EJ47BS-6502TPHS},09/28/2010 08:37:09,HXL0968,PC-0623,http://indeed.com/WboUhagvat1680703797.html,opening degree opening skills required on-time guidance process experience strong start experience engineer strong required starter management equivalent contribute multiple start engineer contribute skills initiative dynamic starter relocation start responsibilities years people years process start multitask concepts team passion initiative team skills start part-time compensation initiative process team interface
http,{Q8L6-X4ZQ21PC-0714XWLJ},09/28/2010 09:25:43,HXL0968,PC-0623,http://linkedin.com/WboUhagvat1479839504.aspx,strong industry process multiple contribute start platform dynamic analyze years interface multiple develop technologies experience skills permanent customer customer customer resume hours permanent resume platform multitask opening develop visual years start years develop responsibilities process resume degree multitask opening on-time starter years years compensation start concepts dynamic resume people skills start resume expert required experience degree on-line concepts degree part-time experience team
http,{C3J0-W4TL45QW-6731XION},09/28/2010 13:47:51,HXL0968,PC-0623,http://careerbuilder.com/WboUhagvat660170997.htm,on-time management sales process people analyze job customer engineer technologies technologies management interface multiple people management permanent develop degree on-line report passion develop resume on-time multitask on-time dynamic on-time contribute experience benefits guidance multitask recruiter dynamic initiative job sales permanent strong responsibilities platform degree interface skills compensation part-time report on-time salary contribute degree engineer opening team industry start permanent team equivalent start growth equivalent management years develop on-time equivalent job resume responsibilities process
http,{E6Q2-T6AB12ZG-4028NYZS},09/28/2010 15:32:15,HXL0968,PC-0623,http://monster.com/WboUhagvat1180707852.html,interface develop relocation part-time on-time opening recruiter permanent opening degree develop industry growth responsibilities people interface team concepts required passion permanent contribute guidance passion opening resume industry team industry permanent guidance engineer skills growth people contribute resume experience resume expert start job analyze on-time skills industry industry resume multitask
http,{I0F7-B5ZL26ZM-8446KKPL},09/28/2010 16:19:17,HXL0968,PC-0623,http://indeed.com/WboUhagvat1680703797.html,team team platform initiative degree analyze dynamic job management equivalent permanent expert multiple passion initiative degree develop required develop starter passion growth strong years develop start management multiple compensation experience multiple dynamic degree opening salary years skills skills management self experience interface degree dynamic job opening engineer opening start responsibilities required growth multitask start responsibilities
http,{K1Z0-O0MW31LU-5284XEXI},09/29/2010 08:23:30,HXL0968,PC-0623,http://yahoo.com/hotjobs/WboUhagvat752138490.php,on-line contribute concepts guidance visual visual benefits responsibilities people customer develop on-line responsibilities platform sales degree years permanent skills technologies compensation multitask on-line customer experience skills dynamic technologies degree multiple experience people starter dynamic years concepts salary years multitask resume management develop people dynamic people dynamic report multitask expert engineer permanent skills team degree opening concepts strong
http,{J5J6-X2DA52QC-1821RLWA},09/29/2010 10:48:18,HXL0968,PC-0623,http://indeed.com/WboUhagvat1680703797.html,process guidance permanent degree permanent multitask dynamic growth starter report guidance customer industry experience years industry management multiple expert interface compensation degree report technologies start start multitask start skills benefits salary platform process degree platform interface hours benefits skills starter experience develop job multitask develop required experience job contribute
http,{M7E4-Y3WE38ZZ-4308HCCS},09/29/2010 14:48:47,HXL0968,PC-0623,http://careerbuilder.com/WboUhagvat660170997.htm,concepts benefits people responsibilities job contribute concepts degree management experience contribute strong sales visual customer industry multitask contribute technologies job growth experience experience on-time guidance on-time responsibilities permanent team strong start concepts platform dynamic skills customer degree opening years years team multiple skills required opening self multitask required report years degree responsibilities analyze hours job recruiter team customer contribute compensation team resume concepts start customer customer concepts years
http,{N4U5-J6PU57WL-8557DAQC},09/29/2010 14:53:55,HXL0968,PC-0623,http://boeing.com/WboUhagvat1904327536.htm,skills process people recruiter on-line opening contribute years years passion hours team expert interface visual degree experience benefits compensation on-time resume growth start platform report contribute people benefits growth equivalent interface team opening strong report dynamic growth on-time multiple resume years strong resume initiative start industry years self call
http,{J7M8-F2AS38WE-7886NIKB},09/29/2010 16:07:59,HXL0968,PC-0623,http://aol.com/jobs/WboUhagvat1963819229.jsp,contribute technologies growth engineer hours people required job people starter report people growth interface resume growth platform years years management strong skills self management multitask platform years multiple years technologies analyze develop job responsibilities platform on-time engineer on-time platform platform experience sales skills resume multiple analyze on-time passion self degree job resume contribute contribute platform opening contribute dynamic
device,{K6F0-Y4GW81PM-4552AIMP},09/30/2010 07:29:17,HXL0968,PC-0623,Connect
device,{Q4V8-M2YZ96PC-5411ACPX},09/30/2010 07:31:55,HXL0968,PC-0623,Disconnect
device,{L3E2-Y9BE70LZ-8989UAHM},09/30/2010 08:38:44,HXL0968,PC-0623,Connect
email,{O9X6-K6NV15DJ-0303RFUT},09/30/2010 08:52:16,HXL0968,PC-0623,BLG798@raytheon.com,,,Holly.Xerxes.Lara@dtaa.com,50994,0,customer interface initiative team team job engineer engineer responsibilities develop skills start contribute responsibilities experience technologies management hours skills experience growth develop customer contribute permanent skills contribute passion multitask passion interface develop required years on-line analyze permanent report process management process on-time opening part-time experience platform customer guidance on-line salary start growth develop technologies process passion passion multiple multitask on-line required management start benefits
device,{Z4E6-E6YA85WT-4033IUJF},09/30/2010 08:57:40,HXL0968,PC-0623,Disconnect
http,{C7D2-G9HB20WZ-7454QCYQ},09/30/2010 10:39:50,HXL0968,PC-0623,http://lockheedmartin.com/WboUhagvat1636367808.htm,sales on-time responsibilities resume sales interface initiative strong degree visual opening strong required develop concepts passion report part-time salary people develop experience sales report sales report experience team multiple responsibilities sales interface technologies experience platform customer degree initiative required degree benefits required on-line initiative industry start develop industry required skills customer benefits
device,{O0L2-O4RZ40UX-3015XOTS},09/30/2010 11:10:14,HXL0968,PC-0623,Connect
device,{D2C5-D3WX07UI-8194IXJD},09/30/2010 11:11:56,HXL0968,PC-0623,Disconnect
http,{Q7S4-I7LV25UL-9098GNWC},09/30/2010 11:24:11,HXL0968,PC-0623,http://linkedin.com/WboUhagvat1479839504.aspx,guidance relocation experience guidance experience contribute resume team develop job report engineer passion initiative degree platform recruiter strong permanent team permanent develop people industry multitask skills growth initiative experience job report passion experience people initiative job benefits job degree technologies multitask benefits contribute responsibilities technologies growth guidance passion dynamic develop sales strong team
device,{W7X2-F1PX46OD-6291ONFQ},09/30/2010 11:59:50,HXL0968,PC-0623,Connect
device,{N1D7-K4ED13IO-4480UVRC},09/30/2010 12:03:46,HXL0968,PC-0623,Disconnect
email,{W1H8-R2QH85BP-3059BUWT},09/30/2010 12:20:50,HXL0968,PC-0623,BLG798@raytheon.com,,,Holly.Xerxes.Lara@dtaa.com,25239,0,relocation multitask resume permanent start benefits multiple experience multitask team years technologies guidance part-time customer sales permanent team platform contribute technologies skills develop start experience
device,{R3K2-H7KQ79LX-4114GLHQ},09/30/2010 13:12:45,HXL0968,PC-0623,Connect
device,{A4X8-Q5HJ97MV-6046WPYD},09/30/2010 13:35:11,HXL0968,PC-0623,Disconnect
device,{R6P0-H1CC95WU-5259DODC},09/30/2010 13:47:44,HXL0968,PC-0623,Connect
device,{K0H3-N2GA30QZ-8627MDMX},09/30/2010 14:23:00,HXL0968,PC-0623,Disconnect
http,{I1D0-A5UO96VP-7176DQTX},09/30/2010 15:12:07,HXL0968,PC-0623,http://jobhuntersbible.com/WboUhagvat1258877042.aspx,industry guidance sales multitask passion initiative contribute expert part-time experience develop customer team required growth starter job interface dynamic skills technologies resume contribute required benefits develop growth interface required multitask starter sales skills responsibilities management multiple start responsibilities
device,{I7U8-Q0CQ24VD-5769WSUL},09/30/2010 15:19:58,HXL0968,PC-0623,Connect
device,{R0K6-W6TI58IV-3986JTCT},09/30/2010 15:33:57,HXL0968,PC-0623,Disconnect
email,{G5R8-A1DS96BN-5728EFRF},09/30/2010 15:46:59,HXL0968,PC-0623,BLG798@raytheon.com,,,Holly.Xerxes.Lara@dtaa.com,34543,2,required on-line engineer develop degree contribute compensation passion job degree concepts technologies resume on-time people required growth multiple hours visual passion team customer skills required industry customer call contribute report industry interface equivalent strong years strong interface strong growth opening compensation compensation responsibilities job technologies management visual process develop required platform permanent
device,{V2M6-P6RV63JT-4349MKJD},10/05/2010 07:41:05,HXL0968,PC-0623,Connect
device,{M4A7-V6AN72YP-2027HMPM},10/05/2010 07:41:13,HXL0968,PC-0623,Disconnect
device,{L8W6-T3YO57QO-1435BPBG},10/05/2010 07:58:59,HXL0968,PC-0623,Connect
device,{F6Y2-Z6VX23MO-2302YGHJ},10/05/2010 09:14:43,HXL0968,PC-0623,Disconnect
device,{N5E0-Q4LO82OP-3878XWYE},10/05/2010 09:47:25,HXL0968,PC-0623,Connect
device,{V1C8-Z6KH10FP-9411THCA},10/05/2010 10:02:33,HXL0968,PC-0623,Disconnect
device,{R3N3-G8WM31AJ-3178HFUQ},10/05/2010 12:01:26,HXL0968,PC-0623,Connect
device,{J7O8-F1JW14JY-4587VUBN},10/05/2010 12:22:48,HXL0968,PC-0623,Disconnect
device,{C8H4-G4YR26UH-6695JSJT},10/05/2010 12:43:28,HXL0968,PC-0623,Connect
device,{H7T8-Z6KD67AC-5096VXYV},10/05/2010 13:17:17,HXL0968,PC-0623,Disconnect
device,{W5E6-E3QI96MB-6752HIRS},10/06/2010 07:50:03,HXL0968,PC-0623,Connect
device,{V2E7-S8FC78LV-9401PPNY},10/06/2010 08:09:42,HXL0968,PC-0623,Disconnect
device,{N3Q2-B7WG59MA-4637NMFE},10/06/2010 09:01:23,HXL0968,PC-0623,Connect
device,{M4B4-U8TO00CL-1041HLOG},10/06/2010 09:12:07,HXL0968,PC-0623,Disconnect
device,{T9M7-K1YN65MX-5824BBCJ},10/06/2010 10:10:38,HXL0968,PC-0623,Connect
device,{F9U3-P5AY04EH-0918YZGW},10/06/2010 10:15:28,HXL0968,PC-0623,Disconnect
device,{R0Y4-S3YI77UK-4629GCNF},10/06/2010 12:29:47,HXL0968,PC-0623,Connect
device,{F2O7-J2YO46PT-5008NAOU},10/06/2010 13:00:40,HXL0968,PC-0623,Disconnect
device,{M5A3-Y8GB74XB-1285DSHK},10/06/2010 13:11:52,HXL0968,PC-0623,Connect
device,{E5R3-M0AH55LO-9002MMIG},10/06/2010 13:12:01,HXL0968,PC-0623,Disconnect
device,{M3A2-O3EQ07XI-2851DPWC},10/06/2010 13:14:41,HXL0968,PC-0623,Connect
device,{X8Y6-D6FD99UM-9474CBJT},10/06/2010 14:36:51,HXL0968,PC-0623,Disconnect
device,{J5M6-X5KY43UK-4023LQLL},10/06/2010 14:59:31,HXL0968,PC-0623,Connect
device,{L1T5-V9UJ74XT-8163GORF},10/06/2010 15:08:44,HXL0968,PC-0623,Disconnect
device,{A6M0-D3RT14GP-9219OOGK},10/08/2010 09:14:33,HXL0968,PC-0623,Connect
device,{I6Y4-O5BR42UC-1199JHMJ},10/08/2010 09:19:22,HXL0968,PC-0623,Disconnect
device,{X8W2-P7NV71SL-5851EKRL},10/08/2010 09:24:12,HXL0968,PC-0623,Connect
device,{C4Z0-N5RK88KM-8374KHBZ},10/08/2010 09:41:49,HXL0968,PC-0623,Disconnect
device,{I1S7-Y7UM16HB-3662NKVR},10/08/2010 10:39:21,HXL0968,PC-0623,Connect
device,{M4R9-O5CV37QI-9234ADEU},10/08/2010 10:43:07,HXL0968,PC-0623,Disconnect
device,{H8F8-C4AU17XW-9268CVOD},10/08/2010 11:09:37,HXL0968,PC-0623,Connect
device,{M6U9-J2KH23OL-5553ZRLQ},10/08/2010 12:02:44,HXL0968,PC-0623,Disconnect
device,{U5F0-Y0DN63BJ-9629FGNT},10/08/2010 12:07:58,HXL0968,PC-0623,Connect
device,{L3S8-M4OM85JO-6250YVJR},10/08/2010 12:21:50,HXL0968,PC-0623,Disconnect
device,{L5M8-K7EL61JI-8021VBUQ},10/08/2010 13:29:52,HXL0968,PC-0623,Connect
device,{O5O9-E5WJ37VN-1951UZRT},10/08/2010 13:37:31,HXL0968,PC-0623,Disconnect
device,{T6W2-B8DR19PB-4639LRFI},10/08/2010 15:06:06,HXL0968,PC-0623,Connect
device,{K2T8-Z6FR87KD-4307LHGK},10/08/2010 15:19:30,HXL0968,PC-0623,Disconnect
device,{F9M8-M5LH64XY-6739OKPD},10/11/2010 07:53:45,HXL0968,PC-0623,Connect
device,{N6T0-V9KJ53YH-7495LWHK},10/11/2010 08:25:04,HXL0968,PC-0623,Disconnect
device,{I8S7-U5BX46DF-9927QRMM},10/11/2010 09:58:44,HXL0968,PC-0623,Connect
device,{G2N9-B0OZ91SA-5270UKSL},10/11/2010 10:15:14,HXL0968,PC-0623,Disconnect
device,{V4V0-L3WJ32AK-1828OZZV},10/11/2010 12:02:48,HXL0968,PC-0623,Connect
device,{F0A3-G0VP65CW-0674GLZR},10/11/2010 12:04:55,HXL0968,PC-0623,Disconnect
