http,{V5G2-Y9YC09WH-1903YPSQ},11/16/2010 11:28:02,ABC0174,PC-5156,http://raytheon.com/WboUhagvat343187784.jsp,contribute multitask analyze hours experience passion technologies technologies equivalent start equivalent analyze hours degree industry skills responsibilities job start sales skills develop process job dynamic equivalent technologies contribute multitask concepts multitask multiple analyze sales equivalent report growth industry technologies sales guidance management degree skills skills report contribute skills interface multitask hours experience degree concepts degree concepts customer degree dynamic resume team hours skills team start technologies growth customer start years permanent report people
http,{B3C4-K1NL71VU-3498AFDE},11/16/2010 15:25:55,ABC0174,PC-5156,http://yahoo.com/hotjobs/WboUhagvat752138490.php,concepts resume required degree interface customer benefits sales multiple growth passion start technologies resume passion customer required contribute years recruiter required sales management skills expert sales opening industry growth industry industry multiple equivalent opening technologies expert equivalent
http,{G1G8-O7YF86FC-7214BKVA},11/17/2010 07:48:02,ABC0174,PC-5156,http://linkedin.com/WboUhagvat1479839504.aspx,visual contribute responsibilities opening opening analyze degree benefits management contribute interface part-time guidance develop team customer people expert initiative industry platform industry job interface start customer interface years passion on-time dynamic dynamic develop management people report opening people team skills hours degree sales years team
http,{O9M9-Y9EA37HE-4991QMNY},11/17/2010 07:56:21,ABC0174,PC-5156,http://careerbuilder.com/WboUhagvat660170997.htm,required process process resume benefits multitask multiple start team analyze multitask skills starter multiple opening concepts industry degree people skills multitask years resume concepts technologies team develop skills required industry passion customer opening report recruiter hours skills compensation skills report engineer on-line dynamic process responsibilities multiple equivalent responsibilities skills people part-time required experience people contribute resume multitask self team analyze expert years visual dynamic report required permanent hours skills multiple
http,{W4D5-J3JQ34DV-1373UCDI},11/17/2010 08:01:02,ABC0174,PC-5156,http://lockheedmartin.com/WboUhagvat1636367808.htm,sales dynamic team interface industry passion responsibilities multiple resume skills strong initiative required people customer hours equivalent team degree passion part-time job
http,{G7D4-V7VW82KP-6041CVLF},11/17/2010 08:14:28,ABC0174,PC-5156,http://aol.com/jobs/WboUhagvat1963819229.jsp,years required permanent opening part-time industry customer customer multitask experience experience multiple required equivalent growth relocation permanent start platform permanent responsibilities report sales salary opening years start sales compensation customer management sales opening experience customer start process start resume industry contribute develop experience interface initiative resume multiple required visual multiple salary industry process growth management passion growth benefits strong guidance analyze report initiative
http,{M9O1-I4AD05OT-2701ONTG},11/17/2010 08:30:13,ABC0174,PC-5156,http://yahoo.com/hotjobs/WboUhagvat752138490.php,multiple start opening passion interface initiative platform management customer self guidance required engineer sales passion growth required strong interface permanent team on-time interface resume team customer years benefits equivalent multiple team visual multiple job resume customer platform job hours team multiple required sales dynamic salary team
http,{M3B5-F2GU07JS-7279LZYS},11/17/2010 08:32:39,ABC0174,PC-5156,http://hp.com/WboUhagvat1944152218.jsp,platform opening responsibilities passion opening initiative platform industry sales interface technologies guidance opening industry growth customer passion equivalent initiative team years job contribute growth platform start concepts experience equivalent industry technologies report contribute passion guidance multiple strong team skills interface strong part-time platform management multiple strong benefits job opening years develop
http,{C3P9-N3FP85CE-5485VXRG},11/17/2010 09:18:10,ABC0174,PC-5156,http://northropgrumman.com/WboUhagvat572113271.aspx,report strong years required develop team customer start required job responsibilities concepts concepts degree experience management multitask years engineer visual hours contribute strong team passion experience compensation growth platform multitask start industry team people required degree customer multitask multitask platform contribute resume visual years starter
http,{X2A0-C6BH12GO-7770XYYO},11/17/2010 15:06:36,ABC0174,PC-5156,http://careerbuilder.com/WboUhagvat660170997.htm,expert multitask opening multitask skills skills multitask multitask engineer strong report skills growth analyze experience equivalent responsibilities contribute industry team responsibilities opening required years people initiative responsibilities recruiter degree skills team management contribute compensation customer required job expert process contribute technologies on-time opening people on-time passion engineer growth on-time required strong people on-time self sales sales dynamic compensation
http,{Q5Y6-W3OY67GN-4297UMSX},11/17/2010 15:38:43,ABC0174,PC-5156,http://linkedin.com/WboUhagvat1479839504.aspx,equivalent contribute team concepts develop multiple multitask growth experience experience equivalent develop hours multitask interface experience on-time resume strong required multiple years technologies team industry part-time management salary people starter contribute part-time initiative customer multitask job dynamic salary concepts resume salary industry resume management interface responsibilities develop hours job report skills starter customer guidance industry initiative starter
email,{D6L2-A1GK24WU-6709WZHK},11/18/2010 08:34:07,ABC0174,PC-5156,Stephanie_C_Wells@raytheon.com,Allegra.Bree.Coffey@dtaa.com,,Allegra.Bree.Coffey@dtaa.com,24256,0,experience job multiple skills contribute interface team skills compensation process concepts compensation required equivalent skills degree job opening management growth start initiative initiative job strong interface industry job customer report growth platform skills years customer report passion interface technologies strong people job skills expert skills degree passion
http,{W6L6-E9MH87UP-8201YJBV},11/18/2010 09:52:45,ABC0174,PC-5156,http://monster.com/WboUhagvat1180707852.html,equivalent interface strong expert concepts process sales experience team responsibilities degree multitask start expert dynamic equivalent starter equivalent job salary resume compensation management job salary
http,{V6C1-N5KP05UR-3937QFNJ},11/18/2010 13:52:14,ABC0174,PC-5156,http://harris.com/WboUhagvat1919385663.htm,salary experience equivalent initiative years interface resume skills compensation skills permanent degree strong concepts passion team experience sales contribute experience interface concepts industry responsibilities develop start equivalent resume platform contribute concepts platform degree people salary multiple dynamic concepts start growth growth
email,{B8X2-E1TW56HY-4763ZQCB},11/18/2010 13:58:27,ABC0174,PC-5156,Stephanie_C_Wells@raytheon.com,,Allegra.Bree.Coffey@dtaa.com,Allegra.Bree.Coffey@dtaa.com,34961,0,passion people permanent degree multitask develop technologies sales customer on-time people team platform self responsibilities resume job customer report contribute benefits experience management responsibilities equivalent recruiter expert start team develop responsibilities initiative platform resume multiple dynamic equivalent contribute on-time multitask dynamic equivalent skills required initiative years compensation customer equivalent on-time experience job responsibilities responsibilities
email,{N3F8-W5JA33NG-2648FCVS},11/18/2010 14:35:44,ABC0174,PC-5156,Stephanie_C_Wells@raytheon.com,,Allegra.Bree.Coffey@dtaa.com,Allegra.Bree.Coffey@dtaa.com,37619,0,people customer expert contribute guidance equivalent customer equivalent platform years relocation dynamic initiative experience interface degree report concepts industry opening equivalent opening dynamic people starter team on-line customer start customer strong industry multitask degree management interface years years industry customer multiple opening experience opening industry required multitask customer concepts degree responsibilities contribute management years required industry
http,{P1B7-U0ZY61AA-0408UCMM},11/18/2010 15:06:06,ABC0174,PC-5156,http://hp.com/WboUhagvat1944152218.jsp,process guidance team responsibilities growth platform self required on-line growth skills skills compensation skills starter experience expert team equivalent develop part-time skills starter experience experience sales degree benefits multiple opening technologies guidance team experience on-line responsibilities resume multiple years process concepts job interface management resume passion contribute team multiple platform responsibilities responsibilities multiple start
http,{F6H0-Z3SO27KV-9281JSWW},11/18/2010 15:19:25,ABC0174,PC-5156,http://boeing.com/WboUhagvat1904327536.htm,customer years sales customer industry degree required passion develop required visual team benefits opening responsibilities skills industry team passion expert responsibilities multitask analyze experience technologies multitask technologies compensation job recruiter analyze industry platform multitask on-line job strong team develop experience equivalent management report equivalent experience concepts responsibilities concepts analyze equivalent self benefits opening opening report
http,{A3O3-T8FK08FI-1356JACM},11/18/2010 15:27:10,ABC0174,PC-5156,http://harris.com/WboUhagvat1919385663.htm,report start starter multitask platform on-time hours starter process initiative permanent technologies job develop degree passion part-time develop multiple guidance skills start develop years sales management compensation contribute salary required expert required part-time responsibilities compensation strong report skills concepts skills team report concepts develop technologies contribute years engineer resume contribute degree compensation
http,{B9N0-Y1HK66GL-5859TSWF},11/19/2010 07:49:19,ABC0174,PC-5156,http://aol.com/jobs/WboUhagvat1963819229.jsp,passion required resume sales sales skills required technologies technologies team hours multiple degree resume job contribute guidance hours benefits equivalent report industry people required job guidance passion team strong team job report customer management degree responsibilities resume job platform concepts develop develop guidance resume growth customer start customer compensation skills growth salary customer resume resume team
http,{Z3R4-I1NJ88OH-1881PUKZ},11/19/2010 08:36:34,ABC0174,PC-5156,http://aol.com/jobs/WboUhagvat1963819229.jsp,industry resume growth analyze degree degree degree opening skills on-time passion starter strong experience technologies permanent part-time platform develop expert report industry required dynamic customer experience management technologies customer report platform resume responsibilities expert platform team on-time initiative years recruiter industry contribute develop on-time sales job years
http,{M1R3-G8BD32MN-7372MNTM},11/19/2010 11:39:37,ABC0174,PC-5156,http://raytheon.com/WboUhagvat343187784.jsp,passion hours growth people part-time platform growth visual initiative platform develop resume initiative experience benefits required equivalent equivalent concepts process develop sales contribute technologies multitask experience on-time years resume part-time growth multitask contribute guidance resume multiple multitask starter technologies degree job multitask interface analyze responsibilities degree experience platform multiple concepts passion sales years on-line permanent visual multiple strong on-time experience experience report technologies salary skills develop call experience required multitask engineer equivalent management job opening equivalent contribute guidance initiative years process hours sales
http,{C7Q0-P3BK11CF-3177NDDM},11/19/2010 12:14:49,ABC0174,PC-5156,http://hp.com/WboUhagvat1944152218.jsp,technologies salary equivalent industry sales required engineer people industry opening expert starter sales expert years technologies salary responsibilities management analyze initiative interface strong benefits job dynamic start job required initiative degree skills benefits customer process hours permanent resume hours expert multitask required resume concepts visual industry experience management responsibilities sales starter technologies sales starter
http,{B3Z2-N3AD35SK-1443RECC},11/19/2010 15:42:56,ABC0174,PC-5156,http://indeed.com/WboUhagvat1680703797.html,sales platform technologies required experience resume dynamic report skills guidance salary years benefits industry self required opening degree start resume industry resume growth customer people guidance benefits team report develop start self job initiative required growth expert interface compensation job concepts start equivalent growth guidance job analyze contribute hours multitask concepts technologies benefits
http,{A8M5-G8NS61IJ-3173CFDN},11/20/2010 07:57:53,ABC0174,PC-5156,http://indeed.com/WboUhagvat1680703797.html,multitask technologies develop industry guidance required sales degree start interface part-time degree sales multiple team growth initiative multitask experience resume technologies start start opening hours growth guidance multitask multiple process resume technologies skills growth opening visual starter develop on-time skills dynamic sales on-time growth on-time required resume technologies
http,{Z0R7-T5BT11GC-1356KMUZ},11/20/2010 08:42:29,ABC0174,PC-5156,http://northropgrumman.com/WboUhagvat572113271.aspx,initiative responsibilities start growth analyze opening permanent call years strong platform platform responsibilities expert concepts platform benefits develop opening skills concepts skills years compensation resume responsibilities initiative dynamic years technologies strong required customer responsibilities management multitask experience management platform years part-time dynamic management permanent responsibilities concepts guidance
http,{Y2D9-I0QW29LB-5103SVJW},11/20/2010 08:42:44,ABC0174,PC-5156,http://craigslist.org/WboUhagvat1105403916.aspx,salary self required part-time customer years management platform benefits multiple contribute opening analyze years concepts multitask strong platform experience multitask multitask required process sales start platform sales customer experience contribute multiple salary passion growth multiple multitask experience equivalent
http,{P8O8-H2FY81YC-8398OMML},11/20/2010 08:47:46,ABC0174,PC-5156,http://jobhuntersbible.com/WboUhagvat1258877042.aspx,self guidance technologies responsibilities resume job resume skills multitask report management technologies experience years sales resume responsibilities hours multiple interface growth self required on-time passion starter technologies experience starter resume dynamic start hours contribute skills report platform resume strong resume benefits report job multiple expert process opening experience degree management report contribute platform initiative job years multiple growth develop permanent multitask
http,{S4O4-V1IR18GV-3502DOEC},11/20/2010 10:09:41,ABC0174,PC-5156,http://indeed.com/WboUhagvat1680703797.html,concepts contribute degree expert degree equivalent industry years customer industry sales people process required equivalent interface opening responsibilities develop expert degree contribute people experience industry resume resume dynamic benefits equivalent engineer resume interface experience industry
http,{O0L5-O8PH02YL-7571ZKAJ},11/20/2010 15:33:30,ABC0174,PC-5156,http://craigslist.org/WboUhagvat1105403916.aspx,concepts opening multitask starter resume team hours resume part-time customer required concepts required technologies resume permanent technologies experience process skills customer years expert multitask permanent required resume multiple contribute guidance skills process expert required multiple start part-time experience process management growth passion process platform compensation years equivalent benefits equivalent years resume platform sales degree experience industry
http,{P0H2-U3CR10BQ-6022TKDH},11/21/2010 08:28:09,ABC0174,PC-5156,http://hp.com/WboUhagvat1944152218.jsp,responsibilities develop multitask strong analyze passion analyze resume customer required multitask initiative multiple team develop management multiple engineer permanent growth industry develop concepts interface multitask compensation job required responsibilities years sales passion process skills degree start report call develop job multiple responsibilities permanent initiative
http,{L4Q5-X4HC67TI-8716DLNL},11/21/2010 08:39:03,ABC0174,PC-5156,http://linkedin.com/WboUhagvat1479839504.aspx,develop industry multiple management multitask team degree on-time starter sales job degree on-time contribute years responsibilities contribute skills benefits required platform resume equivalent on-time report benefits platform multiple dynamic responsibilities opening dynamic degree technologies opening analyze multitask on-time degree experience team team sales develop compensation resume multitask contribute years required develop start equivalent growth required
http,{W6V3-E4WF67PN-7089QOCE},11/21/2010 09:05:28,ABC0174,PC-5156,http://lockheedmartin.com/WboUhagvat1636367808.htm,report dynamic experience sales start responsibilities part-time technologies concepts customer technologies expert concepts customer degree years resume salary sales develop people opening dynamic resume years salary required concepts management passion multiple visual people experience salary degree hours develop years passion opening responsibilities benefits technologies resume multitask report
http,{J1X9-S3PU13EX-1714RFDT},11/21/2010 09:10:49,ABC0174,PC-5156,http://raytheon.com/WboUhagvat343187784.jsp,multitask equivalent strong expert interface on-time responsibilities process experience concepts responsibilities equivalent contribute responsibilities interface guidance team degree responsibilities on-line hours multitask compensation multitask benefits years team expert on-line technologies sales growth multitask platform engineer team required years develop multitask platform process on-time concepts part-time multiple initiative sales resume dynamic on-line responsibilities multitask platform degree responsibilities strong skills multitask
http,{H1J9-E2JI04HV-5348TRHO},11/21/2010 09:55:17,ABC0174,PC-5156,http://job-hunt.org/WboUhagvat919122234.html,experience people guidance contribute contribute strong growth passion customer skills responsibilities years process years equivalent resume visual multitask salary report team salary contribute concepts multiple multiple hours contribute salary resume people years initiative multitask skills opening required opening resume responsibilities experience contribute initiative salary compensation visual contribute dynamic start people skills customer multiple required customer years team
http,{F2W1-Q7BW28WM-9471PCBX},11/21/2010 10:26:12,ABC0174,PC-5156,http://boeing.com/WboUhagvat1904327536.htm,develop team equivalent experience technologies experience contribute contribute job skills team team multiple team benefits on-time job skills customer experience recruiter degree start opening expert opening industry years years develop strong start expert interface required contribute customer compensation growth industry visual opening permanent concepts experience required salary strong develop team multitask sales report years
http,{R1Z3-N0VC69QM-8171QDTA},11/21/2010 10:39:44,ABC0174,PC-5156,http://hp.com/WboUhagvat1944152218.jsp,initiative responsibilities team call part-time relocation report platform hours contribute equivalent interface opening contribute concepts team develop experience growth resume industry analyze required benefits guidance skills on-time part-time strong responsibilities opening equivalent resume report report technologies team customer part-time salary people customer passion start process multitask starter technologies interface required years experience technologies equivalent platform team expert relocation team required customer
http,{S7P1-R0VB32XU-5995NRDA},11/21/2010 10:47:05,ABC0174,PC-5156,http://boeing.com/WboUhagvat1904327536.htm,job degree concepts develop equivalent growth expert initiative dynamic degree people skills degree job multiple self starter customer passion passion skills hours industry report skills on-time responsibilities skills management customer experience job people resume customer degree required people people team
email,{I9T1-P6NI19NI-2300SWDT},11/21/2010 12:22:13,ABC0174,PC-5156,Stephanie_C_Wells@raytheon.com,,Allegra.Bree.Coffey@dtaa.com,Allegra.Bree.Coffey@dtaa.com,26332,0,initiative analyze dynamic degree sales technologies guidance job skills people start permanent skills customer compensation management people develop passion experience analyze self passion start part-time sales platform on-time multitask interface responsibilities analyze report experience on-time management management years engineer customer management multiple passion growth benefits resume opening sales develop dynamic sales opening responsibilities concepts strong
http,{L2S7-I8UQ12JK-4600EMEZ},11/21/2010 14:31:26,ABC0174,PC-5156,http://jobhuntersbible.com/WboUhagvat1258877042.aspx,job passion concepts degree responsibilities management start growth passion strong equivalent job part-time multitask experience industry industry part-time years multitask experience responsibilities team strong team customer report industry multitask multitask customer interface customer team required interface multitask degree develop technologies concepts resume interface dynamic team permanent
http,{D6Y3-K7WK24ZB-8057CHVX},11/21/2010 14:57:26,ABC0174,PC-5156,http://job-hunt.org/WboUhagvat919122234.html,equivalent report interface multiple customer customer experience develop guidance team relocation strong passion multitask self industry expert years required platform equivalent self interface industry growth passion permanent passion sales growth experience responsibilities management customer on-time resume develop expert responsibilities skills experience platform years on-time degree equivalent required strong part-time years process skills degree responsibilities equivalent opening customer
email,{P1D6-H5JW03YX-5659LAQK},11/21/2010 15:30:00,ABC0174,PC-5156,Stephanie_C_Wells@raytheon.com,Allegra.Bree.Coffey@dtaa.com,,Allegra.Bree.Coffey@dtaa.com,29369,0,customer resume multiple on-line initiative develop dynamic benefits equivalent initiative industry growth technologies on-time skills degree on-time passion required benefits job years dynamic sales years starter multitask starter sales dynamic degree report equivalent degree team benefits resume technologies concepts equivalent required job starter develop equivalent customer develop self job industry industry interface technologies industry required analyze multiple on-time required visual resume multitask passion experience technologies salary industry
http,{J8K0-J9ZN61XK-9596KCPJ},11/22/2010 10:44:07,ABC0174,PC-5156,http://northropgrumman.com/WboUhagvat572113271.aspx,resume dynamic years platform contribute strong hours strong resume opening years multiple growth years multitask initiative customer self industry customer skills contribute develop customer team resume customer technologies process growth start interface required required technologies starter degree self resume hours required start guidance report industry
http,{N4L5-A0YG55CS-5775DHTR},11/22/2010 13:07:52,ABC0174,PC-5156,http://boeing.com/WboUhagvat1904327536.htm,compensation degree growth platform passion report growth starter customer degree relocation industry job people sales multiple recruiter sales customer industry strong engineer industry start required years platform on-time responsibilities benefits resume people strong responsibilities experience opening growth platform passion required responsibilities skills initiative develop develop growth sales permanent opening start job responsibilities experience compensation
http,{S5N4-F8TX27OY-2348FWGR},11/22/2010 13:23:17,ABC0174,PC-5156,http://hp.com/WboUhagvat1944152218.jsp,process multitask contribute analyze develop expert multitask benefits strong industry job concepts concepts contribute salary team benefits degree guidance people people management technologies required call people skills experience report skills responsibilities degree multitask technologies experience customer resume team hours resume management
http,{Y6I6-G6ZP08ZP-7157DOWC},11/22/2010 13:44:31,ABC0174,PC-5156,http://boeing.com/WboUhagvat1904327536.htm,multitask customer multitask expert management industry industry experience responsibilities management initiative multiple required contribute resume years contribute concepts customer resume guidance concepts years initiative required team contribute analyze benefits growth years equivalent engineer people skills compensation multiple growth start initiative degree concepts opening
