http,{I7E3-V6IA02ZA-6810AUTU},08/05/2010 14:25:07,MOS0047,PC-5820,http://linkedin.com/WboUhagvat1479839504.aspx,customer benefits develop management starter salary responsibilities required develop required responsibilities customer opening passion responsibilities expert start equivalent team initiative resume dynamic degree on-time people report degree people skills years on-time concepts engineer people resume experience part-time resume contribute permanent years interface guidance opening concepts report team develop report benefits concepts industry years permanent experience hours guidance analyze growth salary years
http,{Z5V1-W5GL33HL-2250KIGW},08/06/2010 08:09:42,MOS0047,PC-5820,http://aol.com/jobs/WboUhagvat1963819229.jsp,multiple equivalent degree contribute job interface equivalent dynamic experience hours strong degree multitask part-time job skills opening technologies resume responsibilities required opening job skills dynamic platform experience equivalent people multitask relocation management multiple compensation passion job guidance benefits industry salary permanent on-line start multitask experience contribute customer team equivalent skills
email,{E2B2-F9MT68CB-6469SJHG},08/06/2010 13:48:12,MOS0047,PC-5820,Fiona.C.Parrish@lockheedmartin.com,,,Mariko.Olga.Snyder@dtaa.com,21227,0,team experience multiple team job degree develop years sales analyze team people part-time years platform sales on-line required start relocation start multitask industry degree job benefits team equivalent experience
http,{V1G3-J7SS19CR-5152LMIQ},08/06/2010 14:07:01,MOS0047,PC-5820,http://raytheon.com/WboUhagvat343187784.jsp,degree contribute skills people years platform multiple industry degree years multitask customer resume opening develop experience team sales experience platform salary skills part-time platform start permanent permanent technologies contribute skills hours strong industry degree contribute analyze resume skills part-time team customer permanent report visual team contribute people start start people industry technologies responsibilities develop report resume technologies
http,{Q2K8-V2HH93AR-8456NICI},08/09/2010 08:27:58,MOS0047,PC-5820,http://raytheon.com/WboUhagvat343187784.jsp,management job industry opening responsibilities start years skills responsibilities on-time benefits platform expert concepts responsibilities develop sales resume dynamic engineer platform management customer contribute resume growth analyze team team concepts industry hours resume concepts platform opening passion team benefits required growth report sales years contribute customer benefits industry initiative multitask industry sales salary develop sales opening multitask degree growth on-time degree growth
http,{C1L9-H6HX79BU-3599AVKQ},08/09/2010 09:30:49,MOS0047,PC-5820,http://simplyhired.com/WboUhagvat57469130.jsp,concepts initiative required compensation degree develop team interface develop report strong hours interface customer report degree contribute develop concepts opening skills process permanent skills degree compensation initiative start passion customer experience required dynamic responsibilities industry guidance job opening initiative years
http,{Z5B0-J5WX55HZ-8925QLLW},08/09/2010 10:20:35,MOS0047,PC-5820,http://careerbuilder.com/WboUhagvat660170997.htm,industry strong resume industry experience team required start expert opening responsibilities contribute on-time years resume customer experience degree passion contribute multiple people dynamic skills multiple responsibilities growth contribute experience resume resume multitask skills develop experience platform permanent management years skills resume platform growth management initiative experience growth responsibilities interface resume sales
http,{V1P9-Z0IT06II-1670FWDS},08/09/2010 12:09:00,MOS0047,PC-5820,http://jobhuntersbible.com/WboUhagvat1258877042.aspx,years initiative sales degree industry management management degree experience growth multiple hours platform experience platform self benefits on-time develop on-time customer concepts required resume engineer compensation equivalent benefits multitask equivalent develop experience analyze multitask equivalent experience interface expert customer contribute equivalent visual management experience job starter starter skills platform multiple benefits industry compensation
http,{N6Y2-C8KT10HC-1443DVWO},08/09/2010 13:52:53,MOS0047,PC-5820,http://jobhuntersbible.com/WboUhagvat1258877042.aspx,visual required growth required passion customer years interface growth customer skills multiple strong multiple industry platform sales part-time required contribute salary equivalent start concepts benefits platform degree dynamic required growth equivalent contribute job permanent years expert responsibilities skills team opening equivalent passion part-time years experience sales visual years platform sales people responsibilities resume customer resume skills start sales report compensation on-line job compensation passion technologies multitask team
http,{O5U1-L7OX22FK-7842BNDW},08/09/2010 15:29:08,MOS0047,PC-5820,http://hp.com/WboUhagvat1944152218.jsp,initiative team skills benefits responsibilities team management people sales growth benefits degree strong responsibilities process skills dynamic report benefits hours job interface equivalent required experience management resume process management management start dynamic dynamic benefits multitask strong platform resume responsibilities team sales report analyze team management multitask interface compensation
http,{P9B8-L4XC57PV-8271ZTPK},08/10/2010 13:45:52,MOS0047,PC-5820,http://hp.com/WboUhagvat1944152218.jsp,permanent initiative job benefits relocation multitask multitask industry contribute skills engineer develop develop skills passion passion experience salary management concepts multitask benefits permanent initiative required resume benefits part-time technologies customer strong recruiter resume degree call
http,{S4M7-N7VK60PZ-3058KRWB},08/10/2010 13:56:58,MOS0047,PC-5820,http://monster.com/WboUhagvat1180707852.html,growth opening technologies multiple required passion analyze develop develop customer self compensation responsibilities team required responsibilities dynamic job skills people expert equivalent interface platform growth opening years growth self multiple recruiter job resume resume growth growth passion responsibilities dynamic benefits contribute hours opening guidance starter report call contribute industry resume customer years years passion
http,{W0N9-B1PJ23KO-5402UICY},08/10/2010 14:02:30,MOS0047,PC-5820,http://simplyhired.com/WboUhagvat57469130.jsp,resume skills responsibilities skills platform hours management interface initiative team experience customer job people job skills team experience dynamic team self degree compensation strong resume benefits benefits years self management equivalent resume interface years resume opening multitask interface strong multitask develop skills permanent skills on-time self team experience required job job develop platform develop start
http,{L3D3-G9IZ53SP-8055DJIL},08/10/2010 14:14:13,MOS0047,PC-5820,http://northropgrumman.com/WboUhagvat572113271.aspx,starter report contribute passion develop years guidance call years multitask responsibilities sales start years growth growth customer passion permanent strong guidance job on-time equivalent expert platform analyze equivalent multiple job on-line develop skills initiative contribute customer years interface strong initiative management people
http,{O7J3-G3WG69CL-1261AHFB},08/10/2010 14:17:55,MOS0047,PC-5820,http://lockheedmartin.com/WboUhagvat1636367808.htm,team resume interface team required contribute starter analyze report resume expert develop multiple interface self people contribute multitask report customer sales job people platform growth multitask job passion start equivalent multiple team sales team customer strong degree relocation expert contribute experience growth responsibilities growth job required opening recruiter experience permanent process industry degree strong
http,{T1F9-L3ZN28UB-3590BIJK},08/10/2010 14:34:43,MOS0047,PC-5820,http://hp.com/WboUhagvat1944152218.jsp,permanent resume years on-line degree responsibilities responsibilities multitask self permanent develop passion responsibilities sales relocation develop responsibilities multiple analyze industry platform people equivalent dynamic develop dynamic experience initiative multiple required initiative benefits multiple growth starter compensation resume resume team passion
http,{Z2H0-X1HR64AR-1798WTHE},08/10/2010 15:06:42,MOS0047,PC-5820,http://craigslist.org/WboUhagvat1105403916.aspx,on-time sales customer management benefits platform benefits call growth start customer industry strong people dynamic permanent resume expert opening benefits multiple multiple multitask relocation responsibilities interface initiative experience develop team required years required resume report self years dynamic skills management team compensation job skills develop visual on-time people years experience hours experience contribute multiple permanent multitask starter
http,{C9R0-N0HM87WP-0615SGMK},08/11/2010 07:42:17,MOS0047,PC-5820,http://harris.com/WboUhagvat1919385663.htm,resume platform engineer experience team equivalent customer start engineer sales customer equivalent responsibilities permanent guidance team management required responsibilities analyze skills opening permanent start passion years growth guidance concepts responsibilities self degree dynamic management degree initiative multiple guidance contribute team platform customer team recruiter resume on-line multiple on-line platform concepts opening benefits starter analyze
http,{H6M6-C0TE23SV-8403IZJY},08/11/2010 07:54:29,MOS0047,PC-5820,http://raytheon.com/WboUhagvat343187784.jsp,contribute equivalent people platform guidance responsibilities self contribute experience multitask relocation years on-time contribute start develop required relocation industry sales report experience contribute people passion process analyze report engineer develop develop analyze team benefits team concepts passion growth experience experience process concepts resume growth report multitask develop hours degree develop team years equivalent experience guidance team
http,{G5P4-S7JQ90JM-4769RZVA},08/11/2010 08:00:48,MOS0047,PC-5820,http://simplyhired.com/WboUhagvat57469130.jsp,salary engineer visual resume industry recruiter years team concepts sales multiple benefits analyze interface develop on-time job management develop platform passion benefits customer initiative team initiative salary required resume job start skills responsibilities team multitask analyze experience start contribute years develop technologies platform process
http,{M5M2-N8IY93MV-1089LFDX},08/11/2010 09:08:31,MOS0047,PC-5820,http://simplyhired.com/WboUhagvat57469130.jsp,concepts self technologies resume resume dynamic benefits benefits contribute people customer permanent dynamic starter opening develop customer growth multiple responsibilities opening degree part-time responsibilities concepts responsibilities sales part-time multiple management technologies multiple develop passion people experience degree management initiative required experience expert self multiple experience job initiative on-line experience required guidance resume on-line years people dynamic team
http,{I1L5-T9OM32QX-1731MOIZ},08/11/2010 09:49:48,MOS0047,PC-5820,http://simplyhired.com/WboUhagvat57469130.jsp,platform customer skills industry multiple interface concepts concepts interface years skills benefits on-time degree customer guidance technologies multitask on-time responsibilities required strong engineer initiative start interface self customer resume responsibilities resume concepts initiative concepts sales multiple sales salary skills contribute multiple passion team sales management
http,{T3D8-T4XX97UH-5559JXSC},08/11/2010 10:24:41,MOS0047,PC-5820,http://craigslist.org/WboUhagvat1105403916.aspx,years on-time people people required expert opening on-time concepts initiative strong opening years guidance guidance benefits experience management hours resume sales expert years resume process responsibilities interface skills part-time management industry multitask required concepts contribute equivalent responsibilities benefits required strong degree expert sales benefits contribute
http,{X5A2-X5NH66UF-4794IDAB},08/11/2010 10:32:21,MOS0047,PC-5820,http://indeed.com/WboUhagvat1680703797.html,develop develop experience experience expert engineer years on-line multitask years report on-time experience resume people dynamic passion compensation technologies team industry salary people start self years expert skills guidance required responsibilities resume management call interface on-line years benefits concepts technologies equivalent passion years degree required multitask analyze platform concepts multitask interface expert permanent
http,{V0Z7-A2HU98HY-1356CBIQ},08/11/2010 10:43:27,MOS0047,PC-5820,http://simplyhired.com/WboUhagvat57469130.jsp,people sales benefits on-time required interface team industry customer equivalent guidance multiple growth skills job contribute multiple technologies job opening develop relocation team sales experience people opening multiple dynamic concepts responsibilities multitask opening sales salary job platform report report initiative management industry strong team growth expert platform initiative experience team job benefits degree hours opening industry opening interface
http,{M3Q9-L8SU65MI-8494ZJRB},08/11/2010 15:22:01,MOS0047,PC-5820,http://northropgrumman.com/WboUhagvat572113271.aspx,start contribute on-time visual opening recruiter experience salary skills resume job job contribute interface responsibilities dynamic develop multitask visual salary develop skills equivalent contribute industry resume industry technologies platform experience experience technologies develop experience years benefits experience multiple management customer
http,{E6U2-E0NG40LA-3578SPWU},08/12/2010 07:56:59,MOS0047,PC-5820,http://job-hunt.org/WboUhagvat919122234.html,experience start starter sales resume team on-time resume growth degree benefits management resume multitask permanent strong people interface platform skills on-time multiple years strong resume skills team growth required sales sales hours passion analyze multitask salary expert passion responsibilities growth team opening start dynamic required passion multitask
http,{F4X3-I4GC47UQ-7506VTXJ},08/12/2010 08:32:57,MOS0047,PC-5820,http://harris.com/WboUhagvat1919385663.htm,strong visual management years customer platform skills relocation degree visual degree report degree responsibilities compensation skills on-time guidance resume report people job resume permanent people degree growth on-time resume years growth interface multitask job experience team responsibilities platform analyze customer report years sales industry opening technologies years strong opening required self develop benefits skills guidance customer process sales on-time platform concepts dynamic opening salary benefits
http,{D6S2-T2DM67KM-9846HKGE},08/12/2010 09:18:50,MOS0047,PC-5820,http://simplyhired.com/WboUhagvat57469130.jsp,job report people technologies develop equivalent contribute guidance management required process passion permanent call responsibilities growth opening dynamic equivalent concepts platform analyze responsibilities experience start on-line team equivalent responsibilities multiple years multiple multiple initiative self people degree contribute experience
http,{U8R8-F7TY37XJ-0266BHNU},08/12/2010 09:43:17,MOS0047,PC-5820,http://craigslist.org/WboUhagvat1105403916.aspx,on-time concepts contribute report platform degree platform passion starter required concepts opening management degree degree multiple industry responsibilities expert industry job multitask report degree years degree permanent process start passion growth dynamic customer compensation contribute experience growth required contribute people customer required platform industry on-line part-time start job multitask multiple team technologies
http,{D0P7-J2FK40ZR-0572NHFF},08/12/2010 09:50:09,MOS0047,PC-5820,http://yahoo.com/hotjobs/WboUhagvat752138490.php,initiative dynamic dynamic compensation customer strong resume growth required passion skills platform strong people platform engineer management degree opening opening platform years required responsibilities required skills hours concepts multitask benefits experience on-time
http,{K4F6-M2TW14GS-7073XKTG},08/12/2010 10:01:09,MOS0047,PC-5820,http://craigslist.org/WboUhagvat1105403916.aspx,multitask strong experience on-time years expert multitask required hours process expert strong report interface technologies growth sales benefits multitask responsibilities contribute contribute compensation required technologies equivalent recruiter responsibilities sales initiative years passion process contribute passion sales start job resume permanent develop growth skills passion management
http,{F2O9-Z8NB53DN-7840ZGTT},08/12/2010 10:25:10,MOS0047,PC-5820,http://harris.com/WboUhagvat1919385663.htm,resume multiple multitask permanent on-time people engineer passion people customer sales sales experience dynamic equivalent salary multitask guidance resume opening interface years permanent guidance on-time strong call benefits skills multiple job dynamic initiative develop customer self management resume contribute concepts opening management multitask skills degree resume compensation passion initiative strong on-time technologies equivalent experience benefits interface
http,{M4Z3-Q9MU95GP-7620STDC},08/12/2010 12:36:40,MOS0047,PC-5820,http://linkedin.com/WboUhagvat1479839504.aspx,degree people customer platform experience resume opening report multitask equivalent start management start self skills passion degree report engineer platform responsibilities team passion relocation responsibilities starter technologies required start technologies report opening concepts benefits passion platform develop years customer people experience growth years required industry report team skills responsibilities passion people growth recruiter strong benefits compensation resume
http,{P2Q0-J1KX35BF-4231AOMB},08/12/2010 15:22:06,MOS0047,PC-5820,http://hp.com/WboUhagvat1944152218.jsp,customer equivalent equivalent skills multiple industry growth skills benefits team analyze concepts platform customer responsibilities interface required years job skills interface skills years growth skills years resume sales start develop salary customer multiple responsibilities concepts years multitask on-time initiative permanent
http,{Q0D2-O7YP44KL-5661EUZU},08/13/2010 08:52:10,MOS0047,PC-5820,http://harris.com/WboUhagvat1919385663.htm,multiple concepts skills years required salary customer dynamic equivalent people resume platform permanent job equivalent multitask growth required required sales contribute management customer years contribute develop contribute hours equivalent responsibilities job process report years opening on-time multitask hours industry sales people on-time sales sales growth growth multiple required growth opening customer industry platform team customer years part-time sales sales experience develop experience skills on-time
http,{V7I8-M6GN89VC-4932ASYA},08/13/2010 09:14:14,MOS0047,PC-5820,http://aol.com/jobs/WboUhagvat1963819229.jsp,report years required self expert required on-time self develop responsibilities contribute team guidance develop growth opening multitask equivalent passion equivalent job permanent salary passion passion required opening sales compensation initiative required initiative strong technologies industry strong interface starter management on-time salary guidance team visual process concepts equivalent skills management experience relocation passion degree industry growth analyze permanent
email,{A0W2-K9KX02DF-3484QWYI},08/13/2010 10:00:56,MOS0047,PC-5820,Fiona.C.Parrish@lockheedmartin.com,,,Mariko.Olga.Snyder@dtaa.com,33876,0,initiative platform start passion multiple sales degree contribute process sales customer experience required sales multitask dynamic multitask salary opening responsibilities industry contribute benefits technologies process part-time relocation develop permanent recruiter experience job passion team resume permanent platform develop technologies experience hours resume dynamic sales growth compensation dynamic platform platform degree experience equivalent contribute concepts multitask strong
http,{H8O4-S0AX83ZB-1611NQJV},08/13/2010 12:07:27,MOS0047,PC-5820,http://indeed.com/WboUhagvat1680703797.html,process contribute multitask growth multiple skills concepts sales opening compensation salary management contribute develop industry on-time platform concepts initiative process develop degree passion required contribute self customer team industry concepts industry equivalent years equivalent initiative people process industry team process experience develop develop experience years interface required initiative
http,{M1D3-J3SO01AI-9905FFTQ},08/13/2010 12:31:05,MOS0047,PC-5820,http://boeing.com/WboUhagvat1904327536.htm,permanent team process hours starter equivalent opening permanent industry management salary years required benefits resume resume analyze team contribute permanent develop starter team opening passion years contribute self equivalent experience skills contribute degree responsibilities industry resume dynamic report management equivalent platform interface opening required develop report opening expert industry dynamic analyze multiple equivalent job passion contribute required
http,{L3U6-O1OZ84EZ-8560WPQD},08/13/2010 13:52:11,MOS0047,PC-5820,http://raytheon.com/WboUhagvat343187784.jsp,engineer passion skills engineer people process analyze equivalent equivalent concepts industry guidance dynamic resume start opening management job opening salary growth skills hours skills customer strong platform equivalent part-time visual skills responsibilities permanent equivalent customer process degree skills required
email,{S9R1-M7RN95WG-9698HEKI},08/13/2010 13:54:44,MOS0047,PC-5820,Fiona.C.Parrish@lockheedmartin.com,,,Mariko.Olga.Snyder@dtaa.com,50859,1,develop management benefits required develop multiple start benefits experience hours compensation contribute concepts team responsibilities industry required degree job customer part-time report concepts permanent technologies team process resume customer growth growth engineer responsibilities platform team team multitask responsibilities guidance report on-line equivalent management hours equivalent on-time develop expert customer team salary technologies years
email,{W0Y1-U9IK49IR-0840QGKD},08/13/2010 14:56:39,MOS0047,PC-5820,Fiona.C.Parrish@lockheedmartin.com,,,Mariko.Olga.Snyder@dtaa.com,46540,1,required engineer self multiple responsibilities call equivalent benefits guidance strong required develop initiative opening opening guidance multiple initiative initiative required technologies multiple strong opening job contribute multiple interface interface passion benefits multitask years job analyze equivalent equivalent multitask responsibilities team on-time experience years process dynamic people develop multitask start
device,{J9J9-D3ZT83MU-0085FRFF},08/16/2010 03:06:22,MOS0047,PC-4256,Connect
device,{E1N1-T6WO73KP-4159VKZB},08/16/2010 03:09:14,MOS0047,PC-4256,Disconnect
device,{X2G2-I0JU42KE-1976IZDZ},08/16/2010 08:42:06,MOS0047,PC-5820,Connect
device,{C7Q6-P3VT79DZ-0190NKNV},08/16/2010 09:36:08,MOS0047,PC-5820,Disconnect
device,{H9H6-N4CU17FH-6080RBWH},08/16/2010 09:37:16,MOS0047,PC-5820,Connect
device,{H4E2-G2TC53WK-8306CFDV},08/16/2010 10:14:53,MOS0047,PC-5820,Disconnect
device,{H9F5-C3ZY81ZT-5615GJNC},08/16/2010 10:19:36,MOS0047,PC-5820,Connect
device,{T5W1-U3MQ50SM-0132ZVYU},08/16/2010 10:35:37,MOS0047,PC-5820,Disconnect
device,{J2Y0-I5GO66OR-1762DVNC},08/16/2010 12:21:16,MOS0047,PC-5820,Connect
device,{Y6B5-Z2UL11YO-0040ZSGD},08/16/2010 12:45:24,MOS0047,PC-5820,Disconnect
device,{F2W2-K2YL31QQ-9885OMYY},08/16/2010 12:52:12,MOS0047,PC-5820,Connect
device,{R6J6-M0FF34YY-1868TNEI},08/16/2010 13:48:32,MOS0047,PC-5820,Disconnect
device,{X3G4-B5WI68YD-9019GRWG},08/16/2010 18:52:49,MOS0047,PC-7343,Connect
device,{L2W3-R0DO76OJ-0479AYOY},08/16/2010 18:54:29,MOS0047,PC-7343,Disconnect
device,{B5L7-J4EC27XK-5829PDOK},08/16/2010 20:14:24,MOS0047,PC-8632,Connect
device,{K0T2-Y2SO45JY-0991OKZL},08/16/2010 20:15:26,MOS0047,PC-8632,Disconnect
device,{B8S4-R0FK91YV-9500MWUS},08/16/2010 22:32:01,MOS0047,PC-8396,Connect
device,{V9W8-B6SW26RY-3141GIVF},08/16/2010 22:33:51,MOS0047,PC-8396,Disconnect
device,{N9B6-K6JT45XX-5336WAGA},08/16/2010 23:18:57,MOS0047,PC-0427,Connect
device,{W0X8-C3VC21LD-4029IPHF},08/16/2010 23:19:05,MOS0047,PC-0427,Disconnect
device,{W2L9-C1KT32SG-0754BHQR},08/19/2010 01:17:20,MOS0047,PC-9840,Connect
device,{T4A2-D2VB87HJ-7352QASM},08/19/2010 01:20:00,MOS0047,PC-9840,Disconnect
device,{E6S8-M6IV28SF-1880ZNRH},08/19/2010 02:13:45,MOS0047,PC-8758,Connect
device,{V5O7-Y1QU39VA-6957CGCS},08/19/2010 02:14:06,MOS0047,PC-8758,Disconnect
device,{E7A8-T9VK96ZJ-2154RHOY},08/19/2010 08:25:14,MOS0047,PC-5820,Connect
device,{D9P6-I9QN28UG-2596GIDL},08/19/2010 09:12:33,MOS0047,PC-5820,Disconnect
device,{A2K0-V2RZ01VT-1607QHDK},08/19/2010 09:15:05,MOS0047,PC-5820,Connect
device,{R2Y1-Z1NA56LR-0230UYTK},08/19/2010 09:35:22,MOS0047,PC-5820,Disconnect
device,{N6W1-Q3CY99JN-8329PXGN},08/19/2010 10:07:00,MOS0047,PC-5820,Connect
device,{X7Z0-C3QD53SB-7147OZRO},08/19/2010 10:29:43,MOS0047,PC-5820,Disconnect
device,{K6K4-N6QX21UP-5135IYEL},08/19/2010 11:55:29,MOS0047,PC-5820,Connect
device,{O8N4-H0SO24PN-0326SGUL},08/19/2010 11:58:57,MOS0047,PC-5820,Disconnect
