http,{W9F2-N1PK88MI-9505QHZC},08/31/2010 07:51:41,HXL0968,PC-0623,http://craigslist.org/WboUhagvat1105403916.aspx,responsibilities experience degree compensation growth multiple responsibilities resume years start report passion report platform interface resume multiple experience process report process contribute degree equivalent sales develop team people experience compensation responsibilities initiative people required degree multitask develop dynamic report engineer technologies interface experience experience contribute experience engineer years permanent people report skills
http,{A1F3-Q1DW79KA-2237BLEF},08/31/2010 09:01:51,HXL0968,PC-0623,http://northropgrumman.com/WboUhagvat572113271.aspx,experience experience technologies opening analyze initiative degree passion customer permanent platform platform people concepts management permanent job multitask equivalent permanent equivalent responsibilities contribute on-time guidance dynamic job multitask degree experience degree contribute starter on-time management degree skills dynamic concepts growth customer years experience team concepts years years degree team opening
http,{Q6F4-A8YC22OS-8800UYJS},08/31/2010 12:02:40,HXL0968,PC-0623,http://jobhuntersbible.com/WboUhagvat1258877042.aspx,analyze dynamic required report concepts responsibilities degree resume required start industry years people experience on-time people multitask customer technologies dynamic multiple skills years team growth management people responsibilities contribute develop contribute required multiple report equivalent skills recruiter develop start strong experience salary customer contribute engineer
http,{F2I6-Y2LC43VS-0439XINT},08/31/2010 14:02:40,HXL0968,PC-0623,http://hp.com/WboUhagvat1944152218.jsp,guidance multiple strong management process dynamic on-time equivalent degree responsibilities skills responsibilities people degree skills sales degree multitask management responsibilities years equivalent start starter platform resume responsibilities hours passion contribute multitask start on-line multitask initiative analyze required develop multiple analyze degree develop process job team industry growth job experience process permanent skills interface
http,{E4L2-D6LN68MF-7195ECTI},09/01/2010 07:39:25,HXL0968,PC-0623,http://boeing.com/WboUhagvat1904327536.htm,experience skills passion responsibilities experience team multiple resume start degree responsibilities engineer job experience management required benefits degree sales expert experience passion guidance customer develop multiple contribute part-time responsibilities required management passion interface required experience multitask responsibilities contribute concepts industry strong compensation part-time industry opening opening concepts resume technologies customer management analyze dynamic contribute customer equivalent technologies multiple resume technologies years relocation resume report technologies guidance
http,{X6D2-C8PH16DD-5948YLFF},09/01/2010 07:49:53,HXL0968,PC-0623,http://northropgrumman.com/WboUhagvat572113271.aspx,years skills skills industry dynamic passion job hours years multiple experience sales permanent expert analyze start process job growth permanent years skills multitask salary guidance customer multitask resume experience
http,{L0Z2-E5YD69EM-9443YFLO},09/01/2010 08:33:27,HXL0968,PC-0623,http://job-hunt.org/WboUhagvat919122234.html,dynamic analyze skills start people customer technologies interface required team technologies required contribute contribute multiple skills analyze dynamic customer customer job multitask expert resume degree required job expert benefits resume skills interface years benefits multitask required passion sales management
http,{N5B3-X0RY96MI-4064PYKK},09/01/2010 11:17:20,HXL0968,PC-0623,http://linkedin.com/WboUhagvat1479839504.aspx,customer contribute develop strong dynamic process required benefits team multiple people recruiter strong responsibilities initiative equivalent growth sales multiple experience responsibilities experience multiple required salary responsibilities on-time concepts equivalent resume start interface sales required experience years passion benefits guidance passion on-time contribute degree required
http,{T9D4-S0LG71VS-0292PQNM},09/01/2010 11:31:20,HXL0968,PC-0623,http://aol.com/jobs/WboUhagvat1963819229.jsp,industry permanent interface technologies develop strong passion part-time resume interface multiple management job people passion interface platform multiple degree equivalent contribute process concepts experience required platform passion on-line required guidance resume initiative customer dynamic experience degree contribute on-line customer passion concepts resume years required
http,{U6K5-S7BX63NY-7433AWVV},09/01/2010 12:36:53,HXL0968,PC-0623,http://indeed.com/WboUhagvat1680703797.html,permanent permanent people interface job dynamic skills initiative management platform platform team multiple visual strong skills develop required equivalent customer industry compensation customer interface passion expert years management report team dynamic sales sales opening start interface passion required degree responsibilities hours passion skills multiple benefits skills team experience team required start technologies resume responsibilities management multitask job team dynamic
http,{S1D5-L2OK02AU-9666IOLS},09/01/2010 13:36:37,HXL0968,PC-0623,http://aol.com/jobs/WboUhagvat1963819229.jsp,industry degree on-time degree technologies passion concepts strong experience team equivalent degree concepts multitask sales process resume process platform passion multitask contribute strong growth years growth initiative opening years multitask permanent multitask starter skills interface resume dynamic strong hours concepts technologies engineer skills start contribute required initiative multitask start develop interface expert permanent degree
http,{W1F7-I6BU32TI-2720WBOY},09/02/2010 08:04:18,HXL0968,PC-0623,http://boeing.com/WboUhagvat1904327536.htm,report platform interface multitask responsibilities opening responsibilities interface customer experience contribute guidance equivalent responsibilities growth years required initiative dynamic technologies multiple industry platform resume required required benefits start start people hours expert technologies passion salary permanent team resume years degree opening customer required degree permanent responsibilities responsibilities on-time start required
http,{X1D0-P8GU17YG-9893BJNO},09/02/2010 09:04:09,HXL0968,PC-0623,http://indeed.com/WboUhagvat1680703797.html,team guidance skills process permanent initiative multiple resume dynamic responsibilities management dynamic concepts technologies on-time team strong start start benefits engineer job passion required analyze years contribute concepts dynamic resume responsibilities equivalent multitask team resume resume years
http,{R6W4-S2YT98EI-0362OIJA},09/02/2010 12:03:52,HXL0968,PC-0623,http://monster.com/WboUhagvat1180707852.html,guidance years salary growth job skills multitask technologies strong customer on-time visual experience develop interface develop sales job responsibilities expert start team equivalent sales sales resume required management hours job develop required on-time sales opening customer platform skills develop people start customer job platform resume technologies
http,{E5O0-M2CI64DD-9791ANKB},09/02/2010 16:07:01,HXL0968,PC-0623,http://careerbuilder.com/WboUhagvat660170997.htm,multitask required start equivalent sales concepts concepts job contribute customer responsibilities visual experience multitask develop customer experience years resume platform required industry start job process concepts contribute develop part-time experience guidance platform dynamic strong skills experience multitask people required resume industry industry job guidance passion years passion dynamic permanent start on-line concepts resume expert degree self benefits technologies equivalent benefits management customer
http,{J1X6-E0UZ41SP-6536ILGW},09/03/2010 07:39:22,HXL0968,PC-0623,http://yahoo.com/hotjobs/WboUhagvat752138490.php,resume part-time multitask customer job passion years skills resume sales multiple relocation permanent starter strong years resume skills customer concepts expert permanent analyze growth part-time degree responsibilities resume people multiple degree analyze resume hours platform dynamic develop required technologies platform skills platform
http,{J4E6-T9NK51ZL-3328VFJG},09/03/2010 08:28:47,HXL0968,PC-0623,http://careerbuilder.com/WboUhagvat660170997.htm,people people required initiative contribute interface opening dynamic on-time sales management degree sales opening growth compensation multitask resume experience industry growth responsibilities responsibilities years contribute skills industry experience self benefits contribute platform equivalent process on-time benefits on-time team years analyze compensation industry skills equivalent call multiple passion team industry customer hours benefits visual degree
http,{M1V9-K4UD39OA-3036NEND},09/03/2010 10:43:29,HXL0968,PC-0623,http://raytheon.com/WboUhagvat343187784.jsp,job on-time start multitask job years experience passion people resume analyze initiative experience call start job dynamic skills required team job report experience industry customer job management self degree years growth start team platform contribute contribute interface analyze opening on-time required growth responsibilities team equivalent develop technologies benefits guidance interface salary years growth customer compensation years team engineer guidance permanent
http,{E6C7-K4XD74PB-4909OEWG},09/07/2010 08:59:52,HXL0968,PC-0623,http://linkedin.com/WboUhagvat1479839504.aspx,on-time multitask customer start visual passion permanent team required report contribute guidance develop degree analyze contribute customer concepts required technologies dynamic develop report initiative equivalent concepts salary sales years required platform on-line visual technologies report guidance sales resume permanent passion sales develop starter concepts years benefits years job industry analyze passion opening
email,{U1Z1-N0LL23DF-8707TGGV},09/07/2010 09:30:41,HXL0968,PC-0623,BLG798@raytheon.com,,,Holly.Xerxes.Lara@dtaa.com,30471,0,skills on-line starter customer develop customer required multiple management equivalent develop multiple contribute customer years degree interface resume start skills passion benefits hours multitask guidance analyze years customer salary multitask hours management required industry expert team report equivalent interface start resume multiple analyze multitask dynamic people compensation strong equivalent team required people growth equivalent interface concepts part-time technologies start process contribute concepts benefits customer required
http,{Y7M8-L6YP38BH-7869UHPL},09/07/2010 09:48:00,HXL0968,PC-0623,http://careerbuilder.com/WboUhagvat660170997.htm,passion opening multiple customer degree develop start responsibilities develop interface interface multitask job experience develop dynamic management starter guidance years multitask analyze passion develop contribute skills passion interface responsibilities people concepts contribute equivalent salary visual benefits growth multiple self compensation passion develop growth passion resume management analyze growth self multiple benefits guidance sales develop experience
http,{C7A1-Q0KG95TY-0844KHOO},09/07/2010 10:47:51,HXL0968,PC-0623,http://northropgrumman.com/WboUhagvat572113271.aspx,passion sales salary resume years multiple analyze skills management required required required develop team interface skills engineer concepts multiple responsibilities call permanent interface guidance contribute strong on-time customer contribute interface degree resume degree benefits strong team analyze team degree years years develop resume relocation salary management multiple job passion experience develop contribute
http,{C6N7-X8ZT17KV-9364YUWX},09/07/2010 11:45:42,HXL0968,PC-0623,http://aol.com/jobs/WboUhagvat1963819229.jsp,job people benefits management skills passion equivalent benefits degree starter job industry report responsibilities multiple degree process platform required contribute multitask technologies strong required required experience resume job skills management team experience passion industry sales start equivalent people process on-time strong management self report years people concepts process team develop skills guidance responsibilities customer
http,{J3V6-Q4OC84FH-6021VYZW},09/07/2010 12:10:40,HXL0968,PC-0623,http://job-hunt.org/WboUhagvat919122234.html,multitask technologies team part-time customer sales years growth industry multiple management years multitask strong responsibilities experience resume on-time job resume experience call self customer multiple permanent multiple hours develop benefits benefits skills salary degree years growth customer job permanent compensation required hours expert skills team report engineer recruiter skills initiative dynamic management relocation
http,{R2S8-B5AM09BS-4990JUTW},09/07/2010 12:15:35,HXL0968,PC-0623,http://lockheedmartin.com/WboUhagvat1636367808.htm,years start job responsibilities job resume concepts team experience benefits industry years benefits dynamic platform team contribute expert contribute permanent management benefits multiple team start guidance growth concepts years industry management customer technologies job responsibilities years recruiter
http,{X3H8-Y5PD95SK-2205TYBJ},09/07/2010 16:19:52,HXL0968,PC-0623,http://harris.com/WboUhagvat1919385663.htm,technologies experience on-line job multitask opening platform permanent develop responsibilities benefits technologies customer start interface report contribute hours self required self dynamic recruiter contribute required develop skills passion degree responsibilities strong opening responsibilities multiple process multiple platform
http,{A7N2-Z2NO44BU-8019XXZD},09/08/2010 14:30:27,HXL0968,PC-0623,http://harris.com/WboUhagvat1919385663.htm,skills opening benefits process degree growth technologies equivalent team management start opening degree multitask multitask start technologies resume interface opening opening team resume concepts permanent on-time degree initiative people resume multiple passion multiple skills growth job years concepts platform equivalent years report process contribute sales job hours responsibilities benefits visual
http,{E1G5-W5NT36ED-5101ECNC},09/08/2010 14:36:16,HXL0968,PC-0623,http://harris.com/WboUhagvat1919385663.htm,multitask passion job platform on-time resume team analyze expert report passion customer concepts degree years guidance growth strong industry process permanent degree concepts expert concepts job technologies industry initiative passion customer compensation skills responsibilities expert concepts on-line responsibilities analyze years equivalent passion team analyze job process required permanent dynamic responsibilities responsibilities degree resume resume
http,{J1F8-D3FC02VS-3849LXIH},09/09/2010 07:33:46,HXL0968,PC-0623,http://raytheon.com/WboUhagvat343187784.jsp,opening resume expert concepts contribute report multitask opening skills hours skills multitask years start interface technologies part-time hours self report resume job team job skills job initiative responsibilities degree multitask report responsibilities strong passion benefits industry dynamic on-line on-time customer people strong part-time visual responsibilities platform equivalent
http,{I3N4-W8SC40SS-3037DHLW},09/09/2010 07:37:36,HXL0968,PC-0623,http://hp.com/WboUhagvat1944152218.jsp,multitask skills experience starter multiple contribute recruiter customer degree experience starter years start skills multitask develop years customer responsibilities hours platform initiative responsibilities on-time resume strong hours benefits responsibilities on-time opening responsibilities strong concepts concepts part-time management responsibilities self on-time growth resume hours dynamic people customer experience opening skills contribute years contribute concepts skills sales team experience concepts salary interface opening degree team start permanent technologies starter years on-time salary customer contribute equivalent
http,{L8C2-Q0VU81KQ-4267OBYV},09/09/2010 07:42:03,HXL0968,PC-0623,http://lockheedmartin.com/WboUhagvat1636367808.htm,compensation visual sales self starter required skills job concepts multiple responsibilities technologies multitask multiple guidance develop degree report years resume skills interface skills interface on-time degree multitask technologies concepts platform sales strong guidance customer benefits opening guidance years resume on-time industry develop team management platform team experience concepts salary self
http,{Y0X7-Y3IX28UE-2365IDMK},09/09/2010 09:32:00,HXL0968,PC-0623,http://yahoo.com/hotjobs/WboUhagvat752138490.php,degree passion call technologies job responsibilities hours initiative people required strong industry passion analyze required contribute permanent passion report degree strong multiple skills growth develop permanent visual management platform develop sales required visual permanent engineer years process passion experience resume team start team growth required experience growth platform responsibilities start platform on-line years interface years skills people years technologies multitask visual starter develop customer self experience multiple years technologies strong sales on-line analyze
http,{M5L5-M6RF21GF-9194XKQN},09/09/2010 10:22:55,HXL0968,PC-0623,http://careerbuilder.com/WboUhagvat660170997.htm,years interface degree growth benefits hours start people sales resume permanent multiple responsibilities skills passion process required growth equivalent team report responsibilities strong equivalent self multitask initiative hours multiple customer multiple years part-time dynamic years contribute technologies job years permanent guidance growth develop dynamic sales experience growth self people years responsibilities permanent concepts responsibilities multitask degree equivalent start sales customer responsibilities industry industry guidance technologies concepts platform analyze process dynamic concepts team initiative required benefits dynamic skills
http,{V4S1-W9WF63GX-0891JPQN},09/09/2010 12:32:40,HXL0968,PC-0623,http://indeed.com/WboUhagvat1680703797.html,benefits expert multiple growth guidance initiative job concepts self compensation passion report job start multiple industry strong guidance required permanent team concepts concepts multitask start industry on-time on-line concepts expert passion platform job job technologies report strong job years permanent job required engineer report resume equivalent job hours compensation expert people
http,{Q7N5-S1UV26WC-2105PNBU},09/09/2010 13:51:47,HXL0968,PC-0623,http://monster.com/WboUhagvat1180707852.html,team part-time multitask multitask equivalent interface growth years hours permanent customer multitask growth skills growth starter initiative resume sales start expert experience industry team degree salary process job report passion multitask hours passion process responsibilities passion degree resume team strong passion on-time recruiter degree compensation customer management
http,{I4B8-J2BB27DT-6329IMMM},09/09/2010 13:54:10,HXL0968,PC-0623,http://raytheon.com/WboUhagvat343187784.jsp,skills required salary required start salary contribute expert benefits resume customer opening passion experience required concepts growth platform job experience dynamic responsibilities equivalent multitask opening on-time multiple platform multiple platform concepts benefits responsibilities guidance process years years sales
http,{M9E5-C4ZC52XB-8018OXNW},09/09/2010 15:35:08,HXL0968,PC-0623,http://lockheedmartin.com/WboUhagvat1636367808.htm,customer technologies degree guidance industry strong skills develop strong customer sales degree resume skills team responsibilities responsibilities multiple resume multitask degree strong permanent self sales growth multitask platform analyze responsibilities customer people
http,{R1K5-D5GT64VF-5526MZLF},09/10/2010 07:53:33,HXL0968,PC-0623,http://northropgrumman.com/WboUhagvat572113271.aspx,guidance on-time skills hours contribute team dynamic years years people part-time hours salary permanent engineer technologies report contribute opening interface interface required people expert opening develop responsibilities experience team people people contribute initiative multitask expert degree start contribute platform resume responsibilities years resume dynamic platform start multitask growth permanent dynamic interface skills sales sales dynamic experience call people
http,{S5E2-D9UM51PA-5057ULBK},09/10/2010 07:59:28,HXL0968,PC-0623,http://northropgrumman.com/WboUhagvat572113271.aspx,multitask strong hours platform report analyze dynamic interface degree degree management skills contribute resume report starter sales on-time multiple develop hours required job initiative on-time multiple passion develop dynamic multiple start contribute people resume years dynamic interface analyze interface report growth engineer responsibilities degree on-time skills customer self management responsibilities hours initiative resume degree
http,{F3Z2-L2TY04UR-7733RXLF},09/10/2010 08:05:24,HXL0968,PC-0623,http://job-hunt.org/WboUhagvat919122234.html,job customer starter part-time skills equivalent skills multiple concepts expert interface self resume self degree hours report platform responsibilities call responsibilities resume guidance dynamic degree guidance industry sales experience customer initiative experience growth start experience years permanent job develop multitask initiative team
http,{R1Q0-R4JO71QV-7689LTQP},09/10/2010 08:18:45,HXL0968,PC-0623,http://northropgrumman.com/WboUhagvat572113271.aspx,opening experience growth degree required industry skills required job passion years opening equivalent industry starter self management team team years years interface permanent team recruiter sales skills degree passion compensation team opening part-time analyze process starter degree on-time opening multiple starter experience platform compensation call required visual resume on-time benefits contribute start salary resume team analyze interface industry resume people
http,{O3Q6-W9AU07FY-7582MSCW},09/10/2010 09:21:20,HXL0968,PC-0623,http://northropgrumman.com/WboUhagvat572113271.aspx,platform skills part-time equivalent resume required process strong permanent call equivalent skills team visual expert sales permanent growth degree multiple report equivalent report develop dynamic contribute initiative degree team responsibilities required initiative experience on-time contribute experience sales required industry responsibilities degree strong contribute technologies contribute equivalent customer start process sales resume people
http,{B1O5-O7ZX57ON-9982CUMK},09/10/2010 10:09:36,HXL0968,PC-0623,http://hp.com/WboUhagvat1944152218.jsp,permanent start responsibilities required required multiple opening on-time people growth people team multiple technologies customer call degree strong develop benefits hours engineer team hours multitask skills self people industry responsibilities contribute expert strong initiative industry dynamic guidance self equivalent skills responsibilities team
http,{W4P5-T8NX63RZ-5500SPKO},09/10/2010 10:49:58,HXL0968,PC-0623,http://linkedin.com/WboUhagvat1479839504.aspx,strong develop interface develop develop multitask visual call report job degree resume sales contribute experience contribute multitask skills contribute responsibilities years visual contribute platform develop industry develop compensation team visual opening salary industry part-time skills interface growth team industry call passion degree engineer strong years people on-line skills initiative skills responsibilities customer required management multitask responsibilities team opening multiple benefits benefits years growth contribute benefits develop multitask develop
http,{X8O0-G9AL02AT-4479NXFP},09/10/2010 13:48:32,HXL0968,PC-0623,http://craigslist.org/WboUhagvat1105403916.aspx,contribute opening interface required passion job degree multiple contribute customer required contribute visual technologies on-time analyze responsibilities equivalent benefits industry resume experience benefits sales permanent part-time required customer technologies self resume develop job concepts contribute start degree technologies platform concepts start multiple hours
http,{F3B3-K5ZS51EI-2869SVZP},09/10/2010 14:13:19,HXL0968,PC-0623,http://simplyhired.com/WboUhagvat57469130.jsp,experience people on-time start salary team skills salary expert report self benefits passion experience team guidance industry relocation start report multitask growth years degree permanent responsibilities multiple concepts process contribute skills experience interface concepts analyze years self start resume experience analyze required start multitask degree required experience years strong team degree people process customer
email,{J3C3-S3SK82RJ-5995PYAK},09/13/2010 11:03:38,HXL0968,PC-0623,BLG798@raytheon.com,,,Holly.Xerxes.Lara@dtaa.com,23797,0,start guidance on-time start report resume engineer degree customer people management guidance technologies opening contribute passion on-time job degree interface multiple relocation degree customer skills passion resume technologies permanent industry skills equivalent interface growth industry benefits hours experience degree passion resume required strong guidance expert industry job responsibilities job opening part-time initiative initiative opening customer
