http,{D1O4-W0OK21QY-6388FXTB},07/27/2010 13:06:46,MOS0047,PC-5820,http://simplyhired.com/WboUhagvat57469130.jsp,benefits years multiple required concepts industry sales concepts develop analyze develop team process industry concepts years job growth sales platform years skills experience process salary customer contribute technologies customer develop contribute initiative resume strong start platform team customer compensation strong part-time concepts relocation years interface required interface
http,{X3W5-F4SV32QZ-8325CVYJ},07/27/2010 13:15:01,MOS0047,PC-5820,http://job-hunt.org/WboUhagvat919122234.html,permanent responsibilities customer guidance passion experience job sales customer multiple report growth customer engineer equivalent passion strong resume years passion salary develop engineer report skills opening platform call equivalent years passion required team guidance multiple interface contribute customer responsibilities expert team equivalent benefits concepts platform
http,{W1B3-F4HJ70HK-2799ISBJ},07/27/2010 13:46:23,MOS0047,PC-5820,http://boeing.com/WboUhagvat1904327536.htm,multitask customer guidance responsibilities years skills multitask resume on-line required skills passion benefits equivalent multiple strong responsibilities develop technologies expert job passion skills degree technologies degree multitask customer concepts process hours team contribute sales years people guidance technologies team people strong opening develop
http,{O1N1-A2EE63LL-8573KWPP},07/27/2010 13:51:31,MOS0047,PC-5820,http://lockheedmartin.com/WboUhagvat1636367808.htm,required start concepts salary job required years years report engineer multitask concepts opening self contribute contribute sales dynamic growth start on-time required skills management process skills start management skills responsibilities contribute process self experience required opening develop contribute people resume growth resume industry
http,{D5M0-H5OZ81MD-4425YWRI},07/27/2010 14:00:22,MOS0047,PC-5820,http://harris.com/WboUhagvat1919385663.htm,multitask resume experience responsibilities multitask industry sales develop permanent benefits self report initiative resume responsibilities concepts technologies report multiple experience starter report people management job technologies job industry equivalent opening growth starter experience analyze years multitask multitask customer years develop interface salary concepts degree interface management multiple years degree concepts contribute multitask contribute years industry concepts technologies develop guidance interface equivalent interface visual people multitask required resume
http,{X2P2-J8LR77LF-2775RFMC},07/27/2010 14:01:39,MOS0047,PC-5820,http://harris.com/WboUhagvat1919385663.htm,job initiative experience years develop management self degree industry growth team process concepts degree degree contribute platform degree growth multitask team management dynamic salary concepts contribute analyze initiative benefits develop expert growth technologies salary interface start passion technologies initiative
http,{R9F6-B0RU96BF-2812HXAE},07/27/2010 14:09:10,MOS0047,PC-5820,http://aol.com/jobs/WboUhagvat1963819229.jsp,people passion resume years start platform resume interface equivalent degree start equivalent part-time team dynamic opening sales interface strong people multitask contribute platform analyze benefits benefits concepts concepts strong part-time platform growth concepts required sales management multitask permanent process benefits required required multitask multitask multiple team sales multiple equivalent hours people team multitask experience permanent
http,{V1M5-N0UU89WM-5056EMHI},07/27/2010 15:04:01,MOS0047,PC-5820,http://lockheedmartin.com/WboUhagvat1636367808.htm,team degree start strong required permanent skills technologies sales contribute self visual on-time team resume passion skills responsibilities develop responsibilities customer degree strong part-time contribute strong strong degree strong interface passion benefits years management years experience degree required experience start multiple sales multitask multiple required team process job degree skills technologies management on-time multitask dynamic experience experience platform degree strong platform customer process customer contribute
http,{D2L0-T3NU23QV-9960JZPO},07/27/2010 15:05:59,MOS0047,PC-5820,http://harris.com/WboUhagvat1919385663.htm,benefits degree degree skills salary experience experience growth team industry degree compensation responsibilities dynamic permanent initiative people report strong report job customer equivalent contribute resume visual self guidance strong customer technologies industry customer engineer experience resume develop customer concepts permanent start customer initiative passion multiple years management team compensation degree years required develop responsibilities hours guidance
http,{S1R2-V3TS63HR-1702JXKH},07/28/2010 13:26:38,MOS0047,PC-5820,http://job-hunt.org/WboUhagvat919122234.html,develop multiple management growth team interface job part-time industry responsibilities equivalent equivalent skills on-time salary resume people contribute skills concepts start guidance multitask visual experience skills part-time analyze concepts start degree team team start starter salary on-time technologies dynamic job passion report degree job customer years call industry starter
http,{H4X9-Y7NK83OA-6601PVIE},07/28/2010 13:37:11,MOS0047,PC-5820,http://job-hunt.org/WboUhagvat919122234.html,contribute customer dynamic interface concepts resume growth team report job part-time salary job passion years salary on-time multitask initiative report benefits analyze job starter strong initiative passion analyze expert develop develop passion analyze degree equivalent degree job management experience multitask platform platform people experience growth passion
email,{F9L6-G7GK83BS-4715IXFP},07/28/2010 14:30:40,MOS0047,PC-5820,Fiona.C.Parrish@lockheedmartin.com,,,Mariko.Olga.Snyder@dtaa.com,29749,0,permanent multiple people on-line dynamic technologies customer degree permanent responsibilities strong experience required experience develop management on-line team opening management call responsibilities customer customer management job on-time job customer degree start resume report people benefits hours opening strong customer opening resume customer develop experience team strong opening required
http,{S2O8-U5YD24FV-3535RMUB},07/28/2010 14:31:32,MOS0047,PC-5820,http://hp.com/WboUhagvat1944152218.jsp,initiative concepts start permanent management technologies contribute self guidance contribute people skills permanent multiple strong strong job growth equivalent multiple contribute develop salary management start develop start degree resume process skills initiative skills equivalent responsibilities initiative multiple process industry start degree equivalent team initiative experience skills self develop customer contribute responsibilities team multitask industry required industry start multitask technologies
http,{X1P7-X9ST73GY-4647VNHF},07/28/2010 14:34:23,MOS0047,PC-5820,http://job-hunt.org/WboUhagvat919122234.html,permanent dynamic experience concepts passion team start relocation multitask develop skills contribute start starter develop degree customer technologies interface permanent growth passion opening relocation visual on-line skills required relocation initiative degree initiative equivalent platform expert multiple equivalent process required
http,{C4Q4-V0OR17VF-3924RPTO},07/28/2010 14:51:00,MOS0047,PC-5820,http://northropgrumman.com/WboUhagvat572113271.aspx,concepts years report people responsibilities experience concepts process degree sales growth strong years multitask people people salary years required responsibilities starter self contribute compensation process growth compensation report on-line self contribute contribute team experience customer technologies experience multitask job degree platform responsibilities compensation part-time required initiative industry interface salary opening multiple multitask job opening interface growth analyze
http,{I3B9-L2FR11HU-2945VPFK},07/28/2010 14:52:55,MOS0047,PC-5820,http://linkedin.com/WboUhagvat1479839504.aspx,skills experience experience develop required benefits engineer years industry concepts benefits hours customer equivalent sales responsibilities technologies resume multiple passion years strong strong degree on-line hours passion degree initiative team analyze sales platform opening concepts industry equivalent years starter job relocation process multitask concepts platform industry team concepts on-time required develop
http,{A1V8-F8DC89VB-4504CIXE},07/28/2010 14:56:31,MOS0047,PC-5820,http://lockheedmartin.com/WboUhagvat1636367808.htm,hours experience visual degree multitask platform resume degree team job resume degree report skills degree platform contribute sales passion multitask develop degree part-time degree equivalent years passion sales team self growth skills people people guidance experience skills skills opening develop responsibilities platform contribute starter contribute skills
http,{L1Y5-K8JF30DN-7121LAPQ},07/29/2010 13:18:34,MOS0047,PC-5820,http://yahoo.com/hotjobs/WboUhagvat752138490.php,industry industry strong equivalent strong degree resume dynamic initiative resume required required equivalent people equivalent on-time self on-time platform engineer customer job years multiple responsibilities years permanent on-time customer multitask years growth growth concepts expert technologies start part-time platform degree
http,{U2O3-P3AO00FC-1625UYDQ},07/30/2010 07:47:51,MOS0047,PC-5820,http://lockheedmartin.com/WboUhagvat1636367808.htm,technologies on-time equivalent job resume people guidance salary benefits contribute salary skills sales visual degree concepts platform report guidance on-line multitask opening people sales passion experience required required customer multitask people interface guidance team experience on-time benefits multitask technologies benefits skills required develop
http,{N1V5-U4YZ81KB-3773PYTK},07/30/2010 09:39:31,MOS0047,PC-5820,http://northropgrumman.com/WboUhagvat572113271.aspx,experience team multitask self resume strong report years compensation responsibilities sales report multiple strong analyze degree passion multitask responsibilities industry report permanent develop benefits sales industry contribute permanent platform sales required salary skills multitask interface customer start develop degree start opening part-time required experience years strong process hours multiple benefits job hours starter customer compensation
http,{R0Q8-E5JX21YU-0817CZUF},08/02/2010 08:05:58,MOS0047,PC-5820,http://harris.com/WboUhagvat1919385663.htm,growth resume concepts equivalent initiative years equivalent multiple develop salary permanent technologies years dynamic initiative years job multiple sales multitask dynamic concepts initiative equivalent guidance sales permanent hours multitask people hours responsibilities team salary required customer guidance resume interface skills
http,{W5B3-F2JN73FL-0930AXZW},08/02/2010 12:05:26,MOS0047,PC-5820,http://monster.com/WboUhagvat1180707852.html,contribute responsibilities dynamic required required degree required compensation opening concepts required technologies platform initiative resume contribute on-time multitask starter multitask resume experience years contribute sales platform starter team develop years industry process expert start opening technologies hours on-line required
http,{L3Y3-I6NZ00YI-6816XLVR},08/02/2010 13:24:38,MOS0047,PC-5820,http://jobhuntersbible.com/WboUhagvat1258877042.aspx,sales analyze multiple skills process growth dynamic experience required years on-time permanent opening job equivalent compensation starter people engineer management process years compensation guidance develop benefits multitask resume skills years permanent customer people job opening start recruiter experience degree people skills contribute starter experience industry job self
http,{A5R0-T9CC78QL-7348IMER},08/02/2010 13:46:21,MOS0047,PC-5820,http://job-hunt.org/WboUhagvat919122234.html,required required part-time equivalent degree required develop engineer engineer team degree experience develop passion customer experience interface develop job analyze platform on-time dynamic industry start customer resume responsibilities customer compensation develop interface team
http,{J2K9-K7LC67DB-6745UFQD},08/02/2010 13:52:48,MOS0047,PC-5820,http://lockheedmartin.com/WboUhagvat1636367808.htm,platform management starter required strong analyze multitask growth process skills multiple equivalent required dynamic team process sales part-time passion years equivalent responsibilities hours multitask skills technologies contribute technologies analyze technologies start
http,{B2J0-A9UY85XO-6285ATFJ},08/03/2010 07:40:21,MOS0047,PC-5820,http://lockheedmartin.com/WboUhagvat1636367808.htm,opening skills growth responsibilities years permanent experience expert opening process experience team technologies responsibilities required technologies resume degree degree analyze resume starter starter report part-time platform develop opening initiative multitask hours required sales
http,{H2Q4-H5VF62JE-5604JSRZ},08/03/2010 07:45:51,MOS0047,PC-5820,http://job-hunt.org/WboUhagvat919122234.html,report management call expert report experience experience interface develop experience experience self responsibilities equivalent job start benefits experience part-time platform analyze management report report technologies sales degree start report platform industry recruiter responsibilities skills management sales industry customer benefits call sales permanent develop concepts management
http,{K0V5-S6BV95IJ-3960UPUZ},08/03/2010 07:58:53,MOS0047,PC-5820,http://linkedin.com/WboUhagvat1479839504.aspx,start skills experience platform management process analyze interface equivalent sales multitask platform self sales growth growth expert skills required strong hours part-time relocation job resume multiple part-time initiative permanent years years customer strong customer strong team required multiple contribute technologies sales management customer required multitask multiple strong platform
http,{P2V7-T9LJ12NY-8429TWFG},08/03/2010 08:11:52,MOS0047,PC-5820,http://craigslist.org/WboUhagvat1105403916.aspx,equivalent analyze skills start dynamic customer experience job customer skills platform process initiative equivalent interface on-time experience multiple growth technologies guidance growth develop management years degree strong multiple visual team
email,{Y1Q4-C5WT65DC-0624NUPX},08/03/2010 08:17:51,MOS0047,PC-5820,Fiona.C.Parrish@lockheedmartin.com,,,Mariko.Olga.Snyder@dtaa.com,24331,4,growth develop industry permanent start report skills benefits required required contribute strong multitask develop contribute years salary on-time visual on-line report job benefits required dynamic multitask hours resume contribute resume develop team skills dynamic contribute opening resume equivalent technologies degree self skills job years passion start start experience equivalent multitask report multiple multitask team hours required experience management skills permanent benefits
http,{U0G1-P1BS12CC-9632ANCQ},08/03/2010 08:19:23,MOS0047,PC-5820,http://job-hunt.org/WboUhagvat919122234.html,interface self skills dynamic job multiple equivalent contribute engineer report job on-line required guidance growth industry technologies concepts on-time technologies permanent equivalent guidance industry customer multiple years develop team start industry resume experience people customer starter report resume start required benefits job salary responsibilities customer job people initiative customer strong interface interface sales years skills equivalent on-time
http,{U3V9-F9FL08LK-5504MSUJ},08/03/2010 08:38:03,MOS0047,PC-5820,http://harris.com/WboUhagvat1919385663.htm,dynamic compensation resume analyze team initiative responsibilities permanent develop multiple develop team passion dynamic customer sales call degree opening sales initiative team passion degree skills benefits equivalent technologies strong benefits resume industry develop start customer degree customer benefits part-time starter engineer contribute responsibilities concepts interface industry resume develop experience equivalent permanent resume job initiative permanent guidance platform develop start skills industry visual platform concepts customer degree
email,{E6D1-W2EI06FK-0514VWIQ},08/03/2010 08:46:14,MOS0047,PC-5820,Fiona.C.Parrish@lockheedmartin.com,,,Mariko.Olga.Snyder@dtaa.com,23337,0,multiple resume start concepts process visual responsibilities call experience develop technologies strong multitask skills concepts develop industry benefits compensation hours platform multitask skills responsibilities multitask hours people benefits technologies contribute interface required visual concepts process growth opening management resume degree part-time sales concepts team management opening years guidance degree
http,{B1G6-O6CV83HF-5128LQNN},08/03/2010 08:56:16,MOS0047,PC-5820,http://monster.com/WboUhagvat1180707852.html,develop salary job years people contribute starter initiative concepts benefits equivalent contribute multitask engineer concepts passion required report skills growth start visual responsibilities strong experience contribute strong team start required team guidance resume opening technologies benefits resume opening benefits platform multitask analyze skills customer benefits management multiple
http,{L2B2-E5XH64LV-6309VUIN},08/03/2010 13:04:34,MOS0047,PC-5820,http://yahoo.com/hotjobs/WboUhagvat752138490.php,multiple people self benefits skills benefits job years guidance platform dynamic management opening concepts compensation salary analyze opening job contribute degree team contribute required technologies engineer sales required report dynamic develop people multiple required develop people guidance initiative contribute expert relocation permanent expert dynamic passion required equivalent multitask interface required salary job customer team
http,{O1D4-X3TW70VF-6927EZHA},08/03/2010 13:36:29,MOS0047,PC-5820,http://northropgrumman.com/WboUhagvat572113271.aspx,required report expert years sales management industry process team resume permanent concepts experience platform starter management self platform dynamic experience customer relocation customer resume dynamic skills management develop interface degree people self industry
http,{O7K7-L2IJ38UG-2337VDGX},08/03/2010 14:26:47,MOS0047,PC-5820,http://lockheedmartin.com/WboUhagvat1636367808.htm,industry call develop process team on-time multiple hours self growth customer multiple dynamic required guidance interface guidance management industry guidance analyze skills visual technologies skills process on-line multitask growth growth growth responsibilities guidance multitask initiative job expert team skills hours strong contribute experience salary strong contribute report permanent permanent report self technologies technologies on-line report required growth
http,{S1C7-G4JL27WS-8818YZLM},08/04/2010 08:46:22,MOS0047,PC-5820,http://monster.com/WboUhagvat1180707852.html,multitask growth analyze passion experience years industry multitask multiple develop resume industry self team benefits industry responsibilities multiple technologies platform guidance responsibilities engineer people develop multiple growth platform customer responsibilities sales experience self strong expert required years resume technologies benefits on-time passion process degree required resume permanent on-time expert growth experience equivalent years degree self sales equivalent dynamic job concepts resume dynamic on-line analyze dynamic report
http,{G3N8-J0XE86YF-1399QNAX},08/04/2010 09:42:44,MOS0047,PC-5820,http://indeed.com/WboUhagvat1680703797.html,passion develop management job team job initiative benefits growth responsibilities technologies multiple equivalent concepts resume on-time multiple job equivalent initiative resume required management responsibilities multitask interface visual team experience contribute develop customer strong required responsibilities opening degree salary team experience team people multiple sales passion growth resume team skills sales industry expert customer job opening guidance
http,{A1P6-I9DK07FI-3435RLQX},08/04/2010 10:14:40,MOS0047,PC-5820,http://harris.com/WboUhagvat1919385663.htm,people job strong self on-line responsibilities years required interface analyze interface years multiple degree multitask concepts resume develop growth technologies technologies job develop strong starter technologies process people degree self job multitask interface job expert required multiple concepts team
email,{F4X8-K2OC66DJ-3397XLQH},08/04/2010 10:40:37,MOS0047,PC-5820,Fiona.C.Parrish@lockheedmartin.com,,,Mariko.Olga.Snyder@dtaa.com,22366,0,platform job skills team compensation platform degree passion develop team team starter customer permanent develop customer benefits on-line years required resume initiative strong degree opening skills multiple responsibilities customer develop responsibilities initiative team concepts experience experience concepts start platform concepts platform opening salary initiative benefits starter job strong resume
http,{T3S6-Y5TJ04KF-1868XVCT},08/04/2010 11:54:54,MOS0047,PC-5820,http://linkedin.com/WboUhagvat1479839504.aspx,multiple start multiple hours analyze industry interface skills strong platform multitask customer multitask years job concepts process growth resume required responsibilities team responsibilities salary interface report hours engineer customer experience people people equivalent guidance on-time part-time job responsibilities customer team team sales benefits years platform hours permanent degree permanent industry hours management responsibilities required responsibilities responsibilities on-time salary growth report benefits
http,{D4W6-Y2VP71IX-9976BLEW},08/04/2010 12:28:29,MOS0047,PC-5820,http://linkedin.com/WboUhagvat1479839504.aspx,required skills sales part-time experience required responsibilities team management team industry self recruiter skills concepts contribute compensation report permanent self required team sales management resume experience on-time customer contribute skills platform opening interface platform recruiter strong salary interface years required multitask
http,{X2O9-X7VC52FH-8999BZKC},08/04/2010 12:29:45,MOS0047,PC-5820,http://northropgrumman.com/WboUhagvat572113271.aspx,responsibilities responsibilities platform interface responsibilities customer analyze passion technologies benefits degree compensation management resume people hours degree self interface multiple team customer job job equivalent skills permanent initiative responsibilities people start relocation years responsibilities technologies interface skills multiple dynamic growth concepts multitask initiative resume growth on-time benefits degree
http,{K6F9-I0NU14IX-4700ZQKB},08/04/2010 12:36:27,MOS0047,PC-5820,http://yahoo.com/hotjobs/WboUhagvat752138490.php,contribute permanent initiative concepts people multiple degree self strong passion contribute dynamic contribute responsibilities people people management skills sales start sales compensation dynamic contribute multiple equivalent required dynamic starter experience responsibilities initiative degree report customer years job process multiple dynamic multiple develop technologies guidance responsibilities contribute team concepts multitask sales
email,{P4Y3-Q6PH36WY-6435NMYI},08/04/2010 12:51:12,MOS0047,PC-5820,Fiona.C.Parrish@lockheedmartin.com,,,Mariko.Olga.Snyder@dtaa.com,33853,2,required management technologies develop multitask job process passion industry people guidance job permanent expert degree equivalent experience equivalent experience report develop multitask skills develop strong part-time industry passion opening contribute part-time initiative multitask skills skills contribute self benefits management degree technologies skills experience customer degree report on-time skills initiative growth self resume develop multiple multiple experience years responsibilities contribute
http,{Q5O7-L4UU44KL-3492BTZH},08/04/2010 13:33:16,MOS0047,PC-5820,http://boeing.com/WboUhagvat1904327536.htm,growth resume concepts initiative team guidance degree team dynamic start permanent degree passion strong skills resume passion multiple guidance self guidance develop hours resume team permanent on-time required multiple people start engineer multiple experience compensation experience industry technologies equivalent responsibilities multitask compensation dynamic contribute required resume sales dynamic experience responsibilities equivalent self
http,{U7X2-W7HX61BG-3277YXGS},08/05/2010 13:49:04,MOS0047,PC-5820,http://lockheedmartin.com/WboUhagvat1636367808.htm,passion guidance opening multitask resume concepts technologies process interface customer hours required starter management guidance guidance years interface opening multiple management platform report report years opening interface platform customer start hours starter required experience skills develop
