http,{M7P8-Y7YV86AX-5750XXRA},10/27/2010 14:11:03,ABC0174,PC-5156,http://boeing.com/WboUhagvat1904327536.htm,customer opening management technologies salary process job on-time equivalent multitask visual required permanent passion technologies degree degree sales platform resume technologies analyze strong equivalent process engineer equivalent contribute contribute opening expert interface contribute multiple interface responsibilities opening strong experience responsibilities engineer contribute equivalent benefits job equivalent concepts self equivalent experience customer growth passion experience growth concepts passion guidance concepts opening customer management team
http,{P4K7-V2ZA95IC-1163JTJN},10/27/2010 14:28:43,ABC0174,PC-5156,http://northropgrumman.com/WboUhagvat572113271.aspx,degree resume people concepts visual years experience management technologies benefits concepts expert opening platform team growth report resume responsibilities concepts team sales management team permanent growth responsibilities dynamic required required years multiple people team growth develop on-line process resume years team contribute benefits equivalent passion benefits
http,{C4E0-F2BX97YQ-1467LSED},10/27/2010 14:40:43,ABC0174,PC-5156,http://monster.com/WboUhagvat1180707852.html,management dynamic team industry opening job required multiple passion job dynamic skills initiative analyze visual contribute passion growth strong management salary sales analyze required industry years contribute guidance strong visual strong analyze expert multiple team benefits required job required expert years hours sales visual concepts opening strong self team benefits passion degree experience opening responsibilities strong concepts sales industry degree equivalent platform
http,{L8H3-T3HV72QG-1163OJYG},10/28/2010 08:08:44,ABC0174,PC-5156,http://monster.com/WboUhagvat1180707852.html,develop growth passion benefits technologies multitask multitask job concepts management interface growth resume contribute opening opening industry passion analyze start growth customer management expert customer engineer required part-time initiative dynamic passion develop on-time team team platform multitask dynamic industry management develop strong initiative concepts resume develop
http,{E9T8-G7TO52JP-5410JZZF},10/28/2010 08:27:12,ABC0174,PC-5156,http://hp.com/WboUhagvat1944152218.jsp,concepts platform sales process salary analyze team responsibilities required technologies growth equivalent technologies sales passion passion team initiative team start customer responsibilities required permanent part-time passion responsibilities degree initiative concepts permanent start experience multitask guidance contribute customer analyze skills job passion sales dynamic equivalent degree sales platform multitask passion initiative resume years degree develop multitask platform opening dynamic initiative platform
http,{L4D9-B0TN55YZ-8365CFMM},10/28/2010 08:39:50,ABC0174,PC-5156,http://northropgrumman.com/WboUhagvat572113271.aspx,initiative multiple responsibilities start start process management compensation industry interface years analyze degree skills self self responsibilities compensation passion develop concepts permanent process years multitask strong analyze interface responsibilities growth people industry customer start benefits develop sales degree growth analyze compensation expert platform platform equivalent growth required responsibilities passion job initiative starter start
http,{W8X5-N7EH33TR-8434WWBM},10/28/2010 09:53:39,ABC0174,PC-5156,http://hp.com/WboUhagvat1944152218.jsp,equivalent engineer develop interface recruiter experience salary years expert hours guidance strong management on-time years skills on-time engineer technologies resume strong strong required resume required management degree on-time customer develop team report
http,{C0W7-P9OJ07KX-2873YSVS},10/28/2010 09:58:44,ABC0174,PC-5156,http://boeing.com/WboUhagvat1904327536.htm,experience degree benefits technologies process equivalent strong initiative management interface analyze permanent initiative skills initiative contribute dynamic responsibilities platform job technologies process degree call team growth self people passion analyze experience relocation platform passion
http,{T1A1-O7QO20TY-7808TKOS},10/28/2010 10:44:26,ABC0174,PC-5156,http://indeed.com/WboUhagvat1680703797.html,equivalent job equivalent report job dynamic sales start equivalent equivalent engineer responsibilities part-time job start resume report required benefits dynamic dynamic technologies responsibilities sales develop analyze contribute team strong people job compensation years dynamic multitask on-time team concepts analyze multiple expert skills
http,{O4P5-H4LO05ZB-8860VNVH},10/28/2010 10:45:27,ABC0174,PC-5156,http://aol.com/jobs/WboUhagvat1963819229.jsp,permanent on-line self degree visual develop opening concepts degree concepts job report multiple required starter initiative equivalent multiple dynamic responsibilities contribute on-line required start sales on-time years on-line start equivalent team degree passion skills responsibilities develop expert initiative concepts hours skills opening multiple job develop job years passion analyze concepts multiple platform resume benefits starter permanent job sales develop degree dynamic
http,{Z3O5-T6FZ06GZ-1490ROSW},10/28/2010 10:57:52,ABC0174,PC-5156,http://raytheon.com/WboUhagvat343187784.jsp,required guidance equivalent growth people develop initiative develop start resume permanent sales multitask experience interface team strong visual contribute experience management years degree job start permanent multitask report job experience required opening years management responsibilities hours develop experience resume start compensation on-time skills analyze guidance growth on-time multitask visual hours on-time multiple years
http,{O6L2-X5XB05DU-9065NNCK},10/28/2010 13:15:00,ABC0174,PC-5156,http://careerbuilder.com/WboUhagvat660170997.htm,compensation on-time benefits technologies interface management strong degree industry concepts develop job experience experience growth process passion skills responsibilities opening dynamic benefits degree permanent contribute interface concepts dynamic industry benefits required strong experience resume on-time platform multitask compensation initiative people team degree experience team sales customer experience sales industry compensation concepts skills skills years analyze starter dynamic passion expert starter opening
http,{R9N2-J1TE60RK-4774IPBR},10/28/2010 13:49:06,ABC0174,PC-5156,http://raytheon.com/WboUhagvat343187784.jsp,required technologies multitask starter starter salary part-time self recruiter resume initiative start initiative job technologies customer contribute industry customer visual on-time resume concepts job strong concepts starter dynamic concepts resume growth customer management start multiple strong permanent benefits skills experience passion required start passion engineer customer salary required required multiple experience experience multiple resume technologies
http,{F3M6-C3RF33ME-3397KFPY},10/29/2010 08:02:16,ABC0174,PC-5156,http://craigslist.org/WboUhagvat1105403916.aspx,degree platform analyze report strong multitask management required job dynamic responsibilities interface required report responsibilities passion industry develop strong multiple platform contribute technologies call multiple guidance resume management technologies responsibilities years starter skills benefits recruiter people part-time growth start customer management visual people experience concepts report on-time degree contribute required starter part-time expert
http,{J4R5-U2ZM56MZ-6534QYAM},10/29/2010 09:23:42,ABC0174,PC-5156,http://yahoo.com/hotjobs/WboUhagvat752138490.php,concepts job years skills part-time benefits skills platform contribute multitask process technologies years people growth job people experience develop permanent sales skills passion resume job job management self experience multitask sales team analyze skills opening develop multiple years concepts contribute benefits platform platform
http,{N7X9-U6RR07ED-3596CPRW},10/29/2010 10:17:46,ABC0174,PC-5156,http://linkedin.com/WboUhagvat1479839504.aspx,benefits strong required initiative strong develop self multiple degree concepts contribute compensation job degree passion responsibilities multitask responsibilities required degree guidance on-time skills multiple dynamic resume compensation analyze job opening degree resume sales visual degree team benefits strong resume
http,{Y9L1-E2CS80BS-4598SOMR},10/29/2010 11:02:29,ABC0174,PC-5156,http://raytheon.com/WboUhagvat343187784.jsp,platform platform benefits resume team responsibilities passion customer equivalent develop strong strong contribute growth management initiative multitask industry customer initiative customer responsibilities management required opening degree industry relocation multitask required people contribute required report develop interface customer multitask customer team sales industry develop engineer skills years
http,{Q6A8-U4KH41VR-1827NBXJ},10/29/2010 11:19:50,ABC0174,PC-5156,http://indeed.com/WboUhagvat1680703797.html,skills concepts multiple interface guidance initiative customer hours skills required required multiple resume visual customer salary platform passion growth customer multiple resume experience years contribute sales platform dynamic multiple part-time expert growth opening growth equivalent interface growth management skills platform develop guidance hours opening industry opening required dynamic required compensation years
http,{Z9A2-L4EG64CI-5558VMWB},10/29/2010 13:31:15,ABC0174,PC-5156,http://harris.com/WboUhagvat1919385663.htm,multitask self experience team interface customer customer customer benefits dynamic multiple self customer salary multitask growth resume multitask on-line experience concepts benefits recruiter degree opening customer multiple equivalent skills equivalent guidance team multiple equivalent required resume interface
http,{U2C7-R7VB91YW-1823VALJ},10/29/2010 14:23:54,ABC0174,PC-5156,http://raytheon.com/WboUhagvat343187784.jsp,starter salary experience required start start degree salary resume multiple opening opening responsibilities team skills degree relocation responsibilities multiple skills growth hours growth guidance equivalent report passion people multitask self interface responsibilities experience self interface people start benefits expert process multitask report
http,{D3L4-Z6FX07GK-6108DWLV},10/29/2010 14:34:43,ABC0174,PC-5156,http://boeing.com/WboUhagvat1904327536.htm,salary multiple on-line degree on-time multiple contribute team visual industry skills experience job process contribute multiple responsibilities start develop industry team expert salary on-time people strong analyze report team years
http,{Q2M6-Q6JB94GC-7429BXWU},10/29/2010 15:22:29,ABC0174,PC-5156,http://indeed.com/WboUhagvat1680703797.html,multitask customer skills interface interface customer sales analyze technologies permanent hours salary opening interface dynamic strong call responsibilities report multitask develop management strong sales develop salary growth starter sales experience responsibilities start recruiter guidance skills compensation management technologies expert permanent resume people growth degree strong
http,{U1M0-D4WE43OR-4954KGQA},10/29/2010 15:22:34,ABC0174,PC-5156,http://indeed.com/WboUhagvat1680703797.html,sales report analyze management start interface platform technologies management multiple growth responsibilities equivalent multitask multiple sales platform multitask growth benefits concepts team people on-time sales industry team develop experience on-time experience concepts degree passion passion contribute job people interface permanent guidance engineer analyze part-time degree on-line strong initiative permanent relocation concepts start
http,{H2Y3-H4FA49QB-0924UZAM},11/01/2010 12:43:42,ABC0174,PC-5156,http://job-hunt.org/WboUhagvat919122234.html,technologies multitask team develop expert growth passion growth expert salary industry strong industry concepts develop multitask contribute start team skills multiple multiple initiative guidance years compensation responsibilities develop concepts management skills report degree management multitask hours analyze dynamic develop part-time customer required platform multitask industry team experience permanent resume
http,{B3V6-Y4UW84PS-9066SIBG},11/02/2010 09:04:53,ABC0174,PC-5156,http://northropgrumman.com/WboUhagvat572113271.aspx,management industry multiple develop process initiative skills opening experience skills benefits guidance initiative relocation sales opening resume experience team responsibilities guidance job hours team contribute compensation skills industry hours skills skills expert multiple required interface concepts concepts degree resume report initiative concepts technologies opening experience contribute part-time team passion platform management multitask responsibilities
http,{P2I3-X1NM05AQ-4950RAIT},11/02/2010 09:05:37,ABC0174,PC-5156,http://jobhuntersbible.com/WboUhagvat1258877042.aspx,equivalent hours develop skills experience guidance years starter multiple dynamic sales permanent concepts resume starter required required contribute industry customer starter benefits report starter experience interface report self skills expert years start management permanent develop job years resume industry people degree permanent strong expert experience years opening technologies sales industry process required on-time part-time skills industry years start
http,{R7T6-L1DA60BP-0373QARZ},11/02/2010 09:26:33,ABC0174,PC-5156,http://careerbuilder.com/WboUhagvat660170997.htm,responsibilities passion experience skills dynamic resume required benefits self resume team management contribute analyze platform customer expert platform team skills team initiative years relocation opening resume required people years required growth job customer analyze customer growth required job people equivalent part-time
http,{Y5G4-E1LF01WS-9319PBMU},11/02/2010 09:27:16,ABC0174,PC-5156,http://jobhuntersbible.com/WboUhagvat1258877042.aspx,concepts technologies people industry concepts required permanent job resume responsibilities experience sales multitask multiple develop people initiative opening team equivalent sales required interface experience people job experience responsibilities report salary team customer technologies contribute customer team report develop required sales technologies industry responsibilities job industry guidance job required benefits industry responsibilities skills
http,{D8T3-Z3TY91KX-0986WDGN},11/02/2010 09:30:02,ABC0174,PC-5156,http://hp.com/WboUhagvat1944152218.jsp,concepts customer benefits multitask benefits industry hours resume benefits responsibilities report responsibilities job sales analyze experience skills management team passion customer benefits sales job interface strong multitask customer sales interface people contribute report develop compensation self start contribute management guidance benefits concepts develop customer process compensation platform hours job experience concepts expert
http,{Y8B2-K8FE38LR-0667BQOE},11/02/2010 10:01:32,ABC0174,PC-5156,http://monster.com/WboUhagvat1180707852.html,multiple equivalent concepts call responsibilities equivalent skills passion contribute report develop guidance technologies engineer skills skills benefits platform salary growth job experience team on-line degree degree years resume years years on-time experience management resume opening growth skills years interface management resume multiple platform develop technologies compensation develop years benefits sales resume industry visual management degree on-line degree team process required management resume strong platform sales years equivalent growth
http,{Y9F2-U0GZ76PA-8008AQRY},11/02/2010 14:37:47,ABC0174,PC-5156,http://linkedin.com/WboUhagvat1479839504.aspx,equivalent hours platform report develop people years management develop benefits permanent on-time responsibilities multitask part-time permanent on-time passion customer experience analyze degree customer job technologies initiative opening self required report team platform growth management contribute engineer hours analyze
http,{C6F3-Z0XH43NS-0098MWQM},11/02/2010 14:45:52,ABC0174,PC-5156,http://monster.com/WboUhagvat1180707852.html,required concepts responsibilities concepts equivalent strong resume dynamic multiple dynamic part-time multitask permanent required initiative visual team resume passion passion passion passion develop opening multitask skills team skills job team contribute team degree resume multiple compensation contribute required customer multiple initiative experience skills passion permanent years
http,{W5D7-I6AW25CH-0786UWYW},11/02/2010 15:21:28,ABC0174,PC-5156,http://jobhuntersbible.com/WboUhagvat1258877042.aspx,required multiple sales develop self people resume process benefits analyze permanent industry permanent resume develop required responsibilities skills multitask years job multiple management platform start degree sales dynamic customer salary concepts multitask experience management required experience starter management self opening responsibilities salary passion
http,{M4R6-Z8YY81MS-0912UHPV},11/02/2010 15:22:46,ABC0174,PC-5156,http://linkedin.com/WboUhagvat1479839504.aspx,opening multitask start compensation job guidance responsibilities customer sales start expert passion responsibilities hours customer passion multitask opening responsibilities benefits multitask industry technologies experience self hours equivalent management experience engineer customer team multitask team people degree self required people experience develop hours initiative sales customer dynamic
http,{W1X3-Q7AQ62TG-0678ILGH},11/03/2010 08:16:31,ABC0174,PC-5156,http://hp.com/WboUhagvat1944152218.jsp,resume team guidance strong job contribute responsibilities relocation call degree multitask permanent start industry required customer analyze multitask analyze report analyze resume resume multiple contribute required on-time start sales start develop dynamic guidance technologies responsibilities sales degree process dynamic dynamic growth develop resume salary on-line visual on-time guidance multiple resume skills interface interface compensation years develop process
http,{V2R5-V7YC70UQ-4890JHBE},11/03/2010 08:53:03,ABC0174,PC-5156,http://linkedin.com/WboUhagvat1479839504.aspx,years dynamic start multitask initiative industry guidance permanent strong growth resume job experience multitask required team management on-line report concepts starter process report strong expert sales dynamic salary start skills visual strong management strong analyze benefits required required skills opening job equivalent concepts experience responsibilities expert hours contribute contribute opening passion develop dynamic report management platform
http,{A8Y3-T7CK97YW-5608JTMF},11/03/2010 09:02:26,ABC0174,PC-5156,http://careerbuilder.com/WboUhagvat660170997.htm,on-line resume benefits job customer develop start team people experience growth degree team multiple develop sales people concepts process passion on-line skills years industry required guidance team degree expert contribute dynamic benefits expert growth required self call opening people multiple people start multitask contribute years start job required required salary strong concepts contribute report strong
http,{Y7B0-R6UW08RC-5753TKDJ},11/03/2010 09:40:35,ABC0174,PC-5156,http://jobhuntersbible.com/WboUhagvat1258877042.aspx,passion visual responsibilities customer benefits expert resume on-time equivalent resume required degree growth permanent process self multiple responsibilities salary team resume multiple resume expert platform job resume industry people job hours passion self passion years strong growth multiple expert develop strong contribute permanent responsibilities interface years concepts responsibilities skills
http,{H0E4-U7OL97OW-7355FYWS},11/03/2010 10:29:49,ABC0174,PC-5156,http://monster.com/WboUhagvat1180707852.html,technologies platform job job sales hours multitask initiative passion people initiative interface guidance passion opening resume permanent degree job strong skills skills management passion growth job engineer develop compensation strong responsibilities required skills people analyze growth interface multiple experience required technologies industry industry contribute technologies dynamic skills benefits team required industry multiple management permanent skills people on-line salary dynamic passion resume
http,{O0Q8-E9WP94HM-6663ZNAO},11/03/2010 10:50:41,ABC0174,PC-5156,http://lockheedmartin.com/WboUhagvat1636367808.htm,job degree years years industry passion concepts passion equivalent resume degree skills concepts experience management initiative responsibilities years years experience experience multiple start report passion hours multiple years degree opening growth opening benefits
http,{C2A6-K0ES36UG-3485GDDN},11/03/2010 11:06:22,ABC0174,PC-5156,http://raytheon.com/WboUhagvat343187784.jsp,experience growth experience multitask resume strong equivalent experience on-line team recruiter process strong starter degree industry report self platform develop hours multitask on-time start degree resume opening years relocation equivalent passion equivalent required start technologies self degree compensation benefits report benefits guidance passion develop
http,{T3T4-I8UV95BO-6293QBPF},11/04/2010 07:42:15,ABC0174,PC-5156,http://indeed.com/WboUhagvat1680703797.html,management responsibilities on-time customer sales platform skills growth self multitask responsibilities on-time equivalent passion growth contribute industry platform benefits multitask interface experience on-time responsibilities skills skills starter expert responsibilities skills concepts management
http,{J9A6-P0KL11SV-4405AXGL},11/04/2010 15:07:15,ABC0174,PC-5156,http://job-hunt.org/WboUhagvat919122234.html,platform sales technologies passion job job equivalent industry process contribute guidance initiative interface platform resume technologies people job experience equivalent start degree interface team recruiter equivalent part-time degree hours responsibilities on-time platform platform interface customer equivalent passion platform passion required multitask industry people resume
http,{T4X1-O1CA05BW-0825YLIU},11/05/2010 09:17:09,ABC0174,PC-5156,http://linkedin.com/WboUhagvat1479839504.aspx,required guidance contribute required team skills skills on-time permanent sales multitask degree compensation industry years multitask required experience on-time technologies platform required growth job passion technologies multitask resume guidance degree concepts start hours strong dynamic platform equivalent platform interface industry
http,{C1Q9-X1ET54KK-4114KJNA},11/05/2010 09:47:54,ABC0174,PC-5156,http://indeed.com/WboUhagvat1680703797.html,initiative visual multitask resume interface strong expert benefits required strong equivalent on-line people on-line years industry technologies experience report team call degree equivalent industry platform required dynamic expert multitask dynamic interface sales job initiative experience customer people concepts initiative on-time industry opening engineer people start passion degree multitask opening degree passion customer passion permanent resume analyze dynamic develop
http,{V8I3-Y6NZ14KG-1844XGZH},11/05/2010 11:09:22,ABC0174,PC-5156,http://boeing.com/WboUhagvat1904327536.htm,sales experience experience multiple process required technologies recruiter platform dynamic management passion multitask develop permanent multiple permanent recruiter on-line platform responsibilities passion responsibilities guidance guidance management visual growth job on-time responsibilities multiple growth multiple equivalent experience develop degree degree platform job responsibilities salary strong required years guidance concepts self compensation team required resume guidance passion strong expert experience multitask multitask guidance platform resume
http,{L2W3-X8IF08MU-7834PWIJ},11/05/2010 11:32:15,ABC0174,PC-5156,http://lockheedmartin.com/WboUhagvat1636367808.htm,team degree benefits analyze passion resume skills on-time on-time self industry customer benefits initiative experience skills opening customer contribute team growth team concepts dynamic develop dynamic industry salary industry on-time visual relocation guidance required responsibilities multitask industry compensation
http,{T3L9-R7WL54MK-7748URFX},11/05/2010 12:41:55,ABC0174,PC-5156,http://northropgrumman.com/WboUhagvat572113271.aspx,salary guidance technologies growth develop analyze platform start report required start relocation multitask opening interface platform technologies degree multitask resume team responsibilities guidance hours responsibilities salary permanent resume visual required management resume job responsibilities opening people develop opening required required required interface years skills customer customer interface resume responsibilities growth develop develop self technologies start dynamic platform years equivalent resume people concepts expert start report industry dynamic compensation
