http,{Q4S0-N3XA12KF-9495HPPL},06/21/2010 09:04:43,RMW0542,PC-7543,http://linkedin.com/WboUhagvat1479839504.aspx,resume years multiple equivalent compensation experience report skills people degree dynamic strong skills technologies recruiter multiple guidance responsibilities equivalent customer analyze initiative guidance growth permanent report responsibilities job years report on-time skills experience job team develop equivalent experience experience required on-time concepts contribute industry benefits multiple hours contribute
http,{N9H4-V4CV23UZ-0507SWOZ},06/21/2010 10:44:24,RMW0542,PC-7543,http://linkedin.com/WboUhagvat1479839504.aspx,starter concepts salary compensation contribute analyze sales job team self self customer customer team industry equivalent team years growth years multiple multiple develop responsibilities degree responsibilities responsibilities team resume management dynamic strong call equivalent customer compensation required years concepts interface guidance benefits people develop customer strong resume opening industry customer job resume passion dynamic equivalent
http,{L1M8-D2UX89ME-2527XSRB},06/21/2010 13:44:49,RMW0542,PC-7543,http://raytheon.com/WboUhagvat343187784.jsp,salary people part-time multiple multitask industry passion degree industry engineer skills equivalent opening resume part-time industry team resume multiple multitask analyze permanent resume technologies dynamic permanent customer degree industry passion resume experience passion process industry process relocation responsibilities starter management job multiple platform on-time technologies dynamic strong degree compensation expert initiative equivalent start initiative on-time strong experience benefits initiative team passion required industry skills technologies responsibilities skills team
http,{L4I9-Y0PK07PF-5027FIQH},06/22/2010 10:36:50,RMW0542,PC-7543,http://linkedin.com/WboUhagvat1479839504.aspx,equivalent interface develop equivalent permanent initiative process process people platform concepts permanent responsibilities skills experience responsibilities platform required job analyze dynamic job platform people compensation people people engineer report salary degree initiative platform skills concepts equivalent people equivalent opening start dynamic job expert years multitask contribute
http,{G3T2-M0YO50BW-4997WSIB},06/22/2010 11:02:45,RMW0542,PC-7543,http://lockheedmartin.com/WboUhagvat1636367808.htm,multitask responsibilities guidance contribute interface resume process sales responsibilities on-time skills required equivalent concepts responsibilities required technologies relocation sales multiple self responsibilities process salary starter responsibilities job required growth relocation expert people customer people equivalent visual management passion degree passion on-time initiative contribute job industry
http,{B0F9-T6SV60NW-9725SXEI},06/22/2010 11:06:44,RMW0542,PC-7543,http://aol.com/jobs/WboUhagvat1963819229.jsp,expert analyze opening resume initiative contribute develop contribute platform people sales process multitask starter passion degree experience customer required skills responsibilities guidance multitask initiative team industry responsibilities contribute years opening experience job permanent dynamic interface years dynamic platform initiative team guidance develop multitask
http,{B7T6-F8XC11GS-1332EWTH},06/22/2010 12:24:07,RMW0542,PC-7543,http://yahoo.com/hotjobs/WboUhagvat752138490.php,technologies responsibilities required contribute resume dynamic skills customer required process customer growth required resume equivalent required dynamic job develop required relocation technologies equivalent on-line experience degree job management strong management concepts part-time people strong responsibilities customer degree skills people people job responsibilities dynamic skills benefits required expert passion report develop team on-time management strong skills
http,{H9A4-W7YJ19EY-1469OTVV},06/22/2010 15:06:28,RMW0542,PC-7543,http://yahoo.com/hotjobs/WboUhagvat752138490.php,experience job expert start interface degree contribute growth salary passion equivalent industry benefits experience customer people opening contribute passion management degree expert report develop skills years customer benefits technologies platform experience skills self process multiple equivalent guidance resume report degree skills job job team expert industry develop responsibilities part-time responsibilities management technologies
http,{C5M2-J8HD40HT-6402FOXN},06/22/2010 16:16:33,RMW0542,PC-7543,http://raytheon.com/WboUhagvat343187784.jsp,analyze analyze passion years compensation platform skills contribute analyze interface interface strong management passion start industry resume management start degree customer opening multiple team job technologies on-line develop technologies customer growth process develop visual required multitask team compensation multitask strong multitask passion growth dynamic permanent team required contribute sales process resume
http,{P3E9-X1OX89AC-2514ROFO},06/22/2010 16:57:03,RMW0542,PC-7543,http://raytheon.com/WboUhagvat343187784.jsp,benefits start management customer industry multiple technologies multiple customer start concepts recruiter initiative on-time multiple start develop develop multiple strong required dynamic opening team concepts on-line salary guidance sales passion skills sales people multiple compensation passion team on-time initiative platform responsibilities customer multitask job equivalent concepts interface years
http,{R8L3-L7XH76TV-0193JQEJ},06/22/2010 17:37:31,RMW0542,PC-7543,http://jobhuntersbible.com/WboUhagvat1258877042.aspx,multitask dynamic on-line develop management responsibilities job technologies experience required experience sales resume management responsibilities skills starter dynamic guidance on-time years management growth years starter management degree responsibilities years growth opening job engineer interface experience responsibilities report technologies job management passion strong skills self concepts industry responsibilities team multiple contribute industry benefits experience responsibilities interface job resume start people multitask develop multiple
http,{D9Q3-I9JC99LT-2276AIKE},06/23/2010 12:27:34,RMW0542,PC-7543,http://monster.com/WboUhagvat1180707852.html,contribute technologies customer start concepts resume part-time recruiter on-line strong opening interface resume experience hours permanent degree analyze multitask strong dynamic job technologies job expert management compensation strong required part-time benefits job degree sales years job call permanent growth starter technologies
http,{B1U8-P0PQ31DA-4840SIBL},06/23/2010 13:05:15,RMW0542,PC-7543,http://aol.com/jobs/WboUhagvat1963819229.jsp,initiative skills dynamic required contribute recruiter process expert benefits develop initiative years report job customer skills people contribute multiple strong sales on-time job multitask years sales sales responsibilities multitask initiative on-line degree years job job skills multiple interface technologies growth team strong equivalent growth skills benefits experience on-time technologies multiple compensation concepts
http,{H6Y7-Y2FO02NA-6944RDTI},06/23/2010 13:26:17,RMW0542,PC-7543,http://craigslist.org/WboUhagvat1105403916.aspx,team start start team benefits passion years technologies concepts responsibilities concepts job visual management industry start industry analyze management initiative resume permanent benefits initiative responsibilities contribute
http,{P6X0-Y0PP02UX-2370BREM},06/23/2010 15:15:25,RMW0542,PC-7543,http://linkedin.com/WboUhagvat1479839504.aspx,customer starter guidance customer resume multiple team industry benefits guidance team permanent skills job initiative opening platform experience responsibilities multiple degree years multitask required equivalent required permanent opening passion multiple sales strong salary visual management industry guidance contribute guidance skills job required expert job report years on-time expert initiative required develop resume interface team equivalent experience starter growth initiative on-time opening benefits multitask benefits experience guidance
http,{A7U0-F7ZS33KB-7814FCFU},06/24/2010 09:06:47,RMW0542,PC-7543,http://monster.com/WboUhagvat1180707852.html,job team skills starter years contribute technologies benefits growth degree initiative team growth contribute initiative years degree multiple engineer report skills equivalent contribute relocation resume report multitask resume team customer years equivalent permanent visual benefits self passion job strong compensation concepts concepts passion contribute dynamic opening concepts concepts resume concepts responsibilities years expert analyze
http,{X1P0-N4NX79PW-8855TLRX},06/24/2010 09:56:54,RMW0542,PC-7543,http://yahoo.com/hotjobs/WboUhagvat752138490.php,job required required people analyze responsibilities platform multitask industry opening sales experience resume equivalent growth initiative initiative guidance recruiter starter required resume team sales expert team sales compensation develop start team on-line benefits opening team skills dynamic skills
http,{S8J9-B3IW79JA-7860UYFO},06/24/2010 10:38:23,RMW0542,PC-7543,http://yahoo.com/hotjobs/WboUhagvat752138490.php,on-time responsibilities industry resume strong part-time process passion degree required equivalent multitask sales opening process contribute permanent process equivalent required permanent required multiple concepts required analyze initiative develop job sales years job salary interface concepts report team concepts opening resume team years multitask contribute management platform multiple responsibilities permanent salary
http,{Z1Q5-S7IR00CP-0585NKBB},06/24/2010 10:56:46,RMW0542,PC-7543,http://craigslist.org/WboUhagvat1105403916.aspx,interface equivalent degree initiative skills experience industry start salary team initiative analyze develop degree sales analyze opening resume sales part-time hours multitask develop job guidance opening passion multitask people technologies benefits equivalent experience benefits equivalent permanent degree industry on-line sales multiple contribute skills job dynamic passion strong develop develop degree engineer self platform hours team customer platform degree opening industry compensation growth people job experience report
http,{V7R4-L0RP85GZ-0014FKCZ},06/24/2010 11:34:59,RMW0542,PC-7543,http://monster.com/WboUhagvat1180707852.html,people degree platform passion report hours multiple multitask analyze benefits contribute required initiative experience experience degree guidance people experience permanent concepts degree contribute hours responsibilities required starter required platform management process years customer develop report interface team engineer multiple opening concepts responsibilities technologies develop develop required people contribute benefits analyze management contribute multitask resume responsibilities resume
http,{X2A0-J6LX08JG-2786DOBS},06/24/2010 12:27:33,RMW0542,PC-7543,http://boeing.com/WboUhagvat1904327536.htm,skills multitask start growth report skills report growth experience responsibilities on-time hours dynamic interface equivalent hours industry multitask years team concepts guidance customer technologies initiative contribute required engineer degree interface equivalent benefits visual platform passion growth multitask experience contribute on-time team growth on-line concepts initiative management opening interface management
http,{L3Z8-C6AK61FJ-6452IUZR},06/24/2010 13:04:53,RMW0542,PC-7543,http://yahoo.com/hotjobs/WboUhagvat752138490.php,degree responsibilities years resume permanent years part-time skills report opening responsibilities degree customer required resume team required team passion customer customer hours multitask initiative self customer permanent develop industry experience technologies technologies experience interface opening multiple recruiter benefits industry required required required hours on-time customer
http,{Q3O5-F8NM02UH-2383HTUD},06/24/2010 15:37:30,RMW0542,PC-7543,http://yahoo.com/hotjobs/WboUhagvat752138490.php,customer passion equivalent start multitask job passion team team responsibilities process analyze dynamic strong expert develop permanent passion customer people self initiative concepts equivalent contribute responsibilities resume dynamic contribute develop report on-time skills responsibilities contribute opening sales skills platform opening
http,{X8W9-D4UX54BV-7680HOUG},06/24/2010 16:01:32,RMW0542,PC-7543,http://simplyhired.com/WboUhagvat57469130.jsp,expert responsibilities industry people equivalent industry customer report contribute multiple benefits on-line skills concepts required start growth multiple degree resume degree develop benefits multitask strong sales resume on-line report multitask contribute platform platform growth responsibilities guidance on-time degree years technologies team
http,{V6E9-Y1MI39VP-4287ASXV},06/25/2010 09:26:01,RMW0542,PC-7543,http://lockheedmartin.com/WboUhagvat1636367808.htm,growth skills compensation multiple degree experience interface initiative growth guidance permanent sales relocation compensation start contribute skills responsibilities multitask experience expert people technologies multiple people expert resume permanent experience sales experience on-time sales report report report experience interface resume equivalent sales passion growth opening concepts multiple job on-line passion resume start responsibilities multiple concepts on-time
http,{J5T5-I6BO41DO-1611IPBV},06/25/2010 11:50:24,RMW0542,PC-7543,http://yahoo.com/hotjobs/WboUhagvat752138490.php,required multiple years permanent develop growth develop develop management required skills required analyze develop concepts skills initiative skills resume degree starter skills skills on-time report team dynamic develop sales platform hours experience experience compensation salary interface call required part-time on-time customer develop team dynamic job experience degree technologies customer required
http,{R1H1-Q7QK38PM-7043IBSL},06/25/2010 12:56:00,RMW0542,PC-7543,http://craigslist.org/WboUhagvat1105403916.aspx,responsibilities job industry resume salary strong platform required years salary strong initiative self experience customer growth degree growth initiative opening resume process opening degree start platform team on-time permanent report opening on-line report
http,{F1A9-O5VV50KN-0062XCZV},06/25/2010 13:30:03,RMW0542,PC-7543,http://monster.com/WboUhagvat1180707852.html,strong sales contribute industry concepts years technologies interface job job people expert customer years platform people platform customer opening start skills people salary management experience people process sales growth equivalent resume experience industry passion customer platform opening required report years compensation people starter people initiative part-time people required passion develop benefits dynamic passion compensation required guidance
http,{G2C1-W2AZ08DU-2597XMIP},06/25/2010 14:10:33,RMW0542,PC-7543,http://lockheedmartin.com/WboUhagvat1636367808.htm,management benefits management initiative expert multiple multitask multiple growth resume sales guidance self sales interface customer responsibilities growth equivalent multiple multitask years customer multiple start responsibilities industry relocation initiative skills dynamic growth industry passion skills multitask develop passion team benefits initiative expert degree on-time interface required required multitask
http,{V8X1-L5TL10HI-6807PMKN},06/25/2010 14:42:01,RMW0542,PC-7543,http://harris.com/WboUhagvat1919385663.htm,dynamic required required starter benefits experience customer starter skills resume dynamic start contribute contribute platform management multiple initiative degree hours technologies recruiter process self relocation engineer benefits benefits growth responsibilities strong people platform strong multitask dynamic customer visual platform sales technologies process contribute strong benefits responsibilities hours strong on-time required benefits report concepts people multitask permanent dynamic skills required opening recruiter sales develop required guidance years dynamic degree responsibilities
http,{N0U6-E0RX28RS-1389GWTL},06/25/2010 14:45:04,RMW0542,PC-7543,http://aol.com/jobs/WboUhagvat1963819229.jsp,multitask dynamic multitask expert passion recruiter years experience customer multitask develop resume people sales multitask industry expert contribute on-line industry develop team industry responsibilities growth multiple equivalent responsibilities analyze strong technologies permanent dynamic multiple people permanent
http,{F2F3-E0NB84KF-9466WTAK},06/25/2010 15:22:55,RMW0542,PC-7543,http://harris.com/WboUhagvat1919385663.htm,start develop customer job degree develop expert guidance compensation people years on-line team contribute skills equivalent equivalent resume report contribute years process resume management on-time experience expert report sales guidance start guidance skills benefits required customer dynamic opening degree
http,{I6A1-L6NO28SY-3115GBMZ},06/25/2010 17:38:42,RMW0542,PC-7543,http://jobhuntersbible.com/WboUhagvat1258877042.aspx,report benefits job opening expert years experience skills analyze starter years multiple required multiple required concepts opening customer dynamic equivalent permanent team skills multiple multitask industry equivalent industry self responsibilities opening resume expert hours required technologies required team opening report
email,{X5C3-R0IY04TS-5223GZHD},06/28/2010 08:10:39,RMW0542,PC-7543,BSM953@northropgrumman.com,,,Rae.Melissa.Wilson@dtaa.com,20999,0,required expert concepts team platform develop initiative people hours multiple benefits contribute permanent years skills required develop customer technologies platform equivalent salary responsibilities contribute skills report visual sales people technologies concepts interface responsibilities resume degree degree job equivalent management years multitask strong technologies compensation on-time responsibilities people passion multiple process sales years growth multiple experience resume contribute technologies passion develop
email,{K1V2-N0TJ26YL-6287YOLX},06/28/2010 08:50:30,RMW0542,PC-7543,BSM953@northropgrumman.com,,,Rae.Melissa.Wilson@dtaa.com,28989,0,salary industry opening sales platform passion resume resume responsibilities required concepts growth platform permanent multitask multiple team required interface multiple contribute management contribute passion initiative experience job on-time experience expert growth salary required opening dynamic interface contribute degree multiple required process initiative multitask strong on-time degree strong strong report skills process equivalent required experience equivalent part-time team multitask growth required concepts
email,{V9A1-A4PB35CK-5704UCXZ},06/28/2010 11:37:18,RMW0542,PC-7543,BSM953@northropgrumman.com,,,Rae.Melissa.Wilson@dtaa.com,33257,0,passion equivalent dynamic management on-time job platform on-line develop job develop passion strong report management dynamic hours experience skills degree on-line multitask sales years required multiple multiple required experience multiple report multiple years analyze people platform start benefits engineer years initiative develop years skills permanent people sales experience people required customer contribute develop job
http,{W3V3-T9FT98JX-0881TOWY},06/28/2010 12:42:59,RMW0542,PC-7543,http://yahoo.com/hotjobs/WboUhagvat752138490.php,job contribute passion degree multitask interface guidance sales multiple sales required multitask permanent multitask growth skills management report job relocation experience equivalent on-time contribute job passion interface platform expert management platform strong resume strong passion job multitask equivalent resume growth technologies contribute salary recruiter opening starter responsibilities required multitask required multiple part-time
http,{A1S1-N3YP70IA-0693MXAV},06/29/2010 10:51:56,RMW0542,PC-7543,http://aol.com/jobs/WboUhagvat1963819229.jsp,skills sales dynamic job platform interface experience develop report years expert customer initiative initiative team multitask management platform technologies people job years sales opening permanent customer benefits industry multiple skills interface dynamic skills growth responsibilities initiative contribute skills opening hours skills equivalent degree opening guidance experience opening
http,{P1B9-N5QT36PK-2064JRHD},06/29/2010 10:57:05,RMW0542,PC-7543,http://boeing.com/WboUhagvat1904327536.htm,sales sales develop job develop resume customer develop start sales starter required develop team growth starter team people team industry years experience concepts interface growth hours platform job start platform develop report starter multitask team starter experience growth passion opening responsibilities responsibilities strong concepts self on-time job platform benefits
http,{M2D9-V5HA19KM-8484IEIB},06/29/2010 13:15:59,RMW0542,PC-7543,http://yahoo.com/hotjobs/WboUhagvat752138490.php,contribute analyze resume multiple equivalent hours concepts years technologies people degree analyze platform starter responsibilities required job dynamic permanent equivalent management process job opening growth degree expert management skills concepts sales resume customer guidance develop resume analyze responsibilities dynamic starter visual analyze years industry technologies
http,{K2J9-O6OA64SS-0763NIAV},06/30/2010 11:43:46,RMW0542,PC-7543,http://raytheon.com/WboUhagvat343187784.jsp,team initiative resume required permanent degree growth interface develop responsibilities engineer degree call team management degree equivalent analyze on-time opening multitask sales initiative customer develop multitask responsibilities interface analyze self expert years people experience resume people strong job develop multitask experience people concepts industry responsibilities job people
http,{B6X7-O1DT10KC-8997RNQI},07/01/2010 08:45:03,RMW0542,PC-7543,http://job-hunt.org/WboUhagvat919122234.html,benefits initiative growth passion resume concepts customer process customer interface benefits start experience years sales visual report initiative technologies skills resume management years benefits start experience strong experience concepts process sales on-time develop report degree skills engineer passion
http,{Q1N8-D2CK16QI-5552FCHY},07/01/2010 10:55:38,RMW0542,PC-7543,http://linkedin.com/WboUhagvat1479839504.aspx,compensation technologies job industry customer experience responsibilities multiple starter job customer interface resume dynamic multitask management required sales responsibilities opening technologies team resume responsibilities process develop permanent opening contribute call equivalent job experience experience on-time experience multiple part-time resume starter permanent team relocation responsibilities passion report compensation sales sales experience recruiter
email,{M3J8-G1VS49QU-6401SZNB},07/01/2010 11:53:34,RMW0542,PC-7543,BSM953@northropgrumman.com,,,Rae.Melissa.Wilson@dtaa.com,53299,0,hours on-time on-time on-time resume customer initiative dynamic required experience dynamic initiative job resume management experience job team management multitask develop job degree industry team management technologies sales passion platform permanent analyze platform technologies strong degree platform resume dynamic team degree sales analyze platform starter industry management on-line job report platform opening team
http,{L9E9-N8ZG81OF-6697WDDB},07/01/2010 12:12:31,RMW0542,PC-7543,http://linkedin.com/WboUhagvat1479839504.aspx,experience passion multitask responsibilities technologies concepts salary initiative job start part-time process resume multitask required hours develop responsibilities interface on-time strong skills resume degree hours years skills sales on-time expert years experience people experience job people resume strong degree skills resume report analyze technologies customer experience initiative resume dynamic passion benefits sales concepts dynamic management multiple resume resume years salary compensation resume resume develop sales on-time years contribute concepts
http,{R0P9-F6OF22UJ-6042ZJST},07/01/2010 12:43:10,RMW0542,PC-7543,http://monster.com/WboUhagvat1180707852.html,opening self skills responsibilities interface sales platform degree people dynamic starter permanent growth report skills interface on-line multiple engineer team management experience customer starter concepts industry relocation concepts call analyze equivalent initiative start multitask start start passion opening resume concepts equivalent people expert resume required on-time benefits skills equivalent multiple industry customer
http,{Y8K0-Y4NH59HP-5422QUSP},07/01/2010 12:56:39,RMW0542,PC-7543,http://linkedin.com/WboUhagvat1479839504.aspx,develop skills technologies job expert people compensation interface skills resume visual expert resume multiple skills job on-line concepts resume years develop multiple benefits strong on-time degree initiative years contribute technologies resume industry dynamic process management guidance contribute start process interface start permanent multiple interface experience opening start equivalent
